id,listing_url,scrape_id,last_scraped,name,summary,space,description,experiences_offered,neighborhood_overview,notes,transit,access,interaction,house_rules,thumbnail_url,medium_url,picture_url,xl_picture_url,host_id,host_url,host_name,host_since,host_location,host_about,host_response_time,host_response_rate,host_acceptance_rate,host_is_superhost,host_thumbnail_url,host_picture_url,host_neighbourhood,host_listings_count,host_total_listings_count,host_verifications,host_has_profile_pic,host_identity_verified,street,neighbourhood,neighbourhood_cleansed,neighbourhood_group_cleansed,city,state,zipcode,market,smart_location,country_code,country,latitude,longitude,is_location_exact,property_type,room_type,accommodates,bathrooms,bedrooms,beds,bed_type,amenities,square_feet,price,weekly_price,monthly_price,security_deposit,cleaning_fee,guests_included,extra_people,minimum_nights,maximum_nights,calendar_updated,has_availability,availability_30,availability_60,availability_90,availability_365,calendar_last_scraped,number_of_reviews,first_review,last_review,review_scores_rating,review_scores_accuracy,review_scores_cleanliness,review_scores_checkin,review_scores_communication,review_scores_location,review_scores_value,requires_license,license,jurisdiction_names,instant_bookable,cancellation_policy,require_guest_profile_picture,require_guest_phone_verification,calculated_host_listings_count,reviews_per_month
14026059,https://www.airbnb.com/rooms/14026059,20160906204935,2016-09-07,Large room near hospitals,"My place is ideal for physicians and researchers visiting one of the nearby hospitals for a training or observership as it's only an 8-12 minute walk to Children's Hospital, Dana Farber, Brigham&Women's, Beth Israel and Harvard Medical School. The bedroom is the largest in the unit with a queen-sized bed, couch, two desks, and a large closet.  It's on the 3rd floor of a 3-story townhouse in a very safe neighborhood.","The bathroom would be shared with one other individual.  Wireless, central air, washer/dryer and utilities are included. You would have full use of the kitchen, including microwave, toaster oven, pots and pans, tupperware, and juicer.  The common space, which includes a living room with a 65"" Smart TV, and a smaller reading room is also available to you.  It is ideal for stays that are one month or longer.  There are 3 other individuals living here - all professionals, mostly researchers and doctors at one of the hospitals.  There is a hubway bike rental station 2 blocks away.  And a nearby bike/running path along some nice greenery which takes you to Jamaica Pond and a movie theater.  Guidebooks and maps provided.","My place is ideal for physicians and researchers visiting one of the nearby hospitals for a training or observership as it's only an 8-12 minute walk to Children's Hospital, Dana Farber, Brigham&Women's, Beth Israel and Harvard Medical School. The bedroom is the largest in the unit with a queen-sized bed, couch, two desks, and a large closet.  It's on the 3rd floor of a 3-story townhouse in a very safe neighborhood. The bathroom would be shared with one other individual.  Wireless, central air, washer/dryer and utilities are included. You would have full use of the kitchen, including microwave, toaster oven, pots and pans, tupperware, and juicer.  The common space, which includes a living room with a 65"" Smart TV, and a smaller reading room is also available to you.  It is ideal for stays that are one month or longer.  There are 3 other individuals living here - all professionals, mostly researchers and doctors at one of the hospitals.  There is a hubway bike rental station 2 blocks aw",none,NA,NA,NA,NA,NA,NA,https://a2.muscache.com/im/pictures/773af11a-4f4b-47c9-868f-c5fdbad63336.jpg?aki_policy=small,https://a2.muscache.com/im/pictures/773af11a-4f4b-47c9-868f-c5fdbad63336.jpg?aki_policy=medium,https://a2.muscache.com/im/pictures/773af11a-4f4b-47c9-868f-c5fdbad63336.jpg?aki_policy=large,https://a2.muscache.com/im/pictures/773af11a-4f4b-47c9-868f-c5fdbad63336.jpg?aki_policy=x_large,5350366,https://www.airbnb.com/users/show/5350366,Scott,2013-03-06,"Brookline, Massachusetts, United States","Hi. I am an educated, activity-oriented professional. I bike, hike, eat well, dance and can often be found traveling or in a coffee shop.",within an hour,100%,100%,TRUE,https://a2.muscache.com/im/users/5350366/profile_pic/1365623097/original.jpg?aki_policy=profile_small,https://a2.muscache.com/im/users/5350366/profile_pic/1365623097/original.jpg?aki_policy=profile_x_medium,Brookline,3,3,"['email', 'phone', 'facebook', 'reviews', 'kba']",TRUE,TRUE,"Village Way, Brookline, MA 02445, United States",Brookline,Mission Hill,NA,Brookline,MA,02445,Boston,"Brookline, MA",US,United States,42.33455836291266,-71.1145917254634,TRUE,Apartment,Private room,1,2.5,1,1,Real Bed,"{TV,""Wireless Internet"",""Air Conditioning"",Kitchen,Heating,Washer,Dryer,""Smoke Detector"",""Carbon Monoxide Detector"",Essentials,Shampoo,""24-Hour Check-in"",Hangers,""Hair Dryer"",Iron,""Laptop Friendly Workspace""}",NA,$75.00,$350.00,"$1,200.00",NA,NA,1,$0.00,5,120,today,NA,5,19,19,31,2016-09-06,0,NA,NA,NA,NA,NA,NA,NA,NA,NA,FALSE,NA,NA,FALSE,moderate,FALSE,FALSE,1,NA
14610297,https://www.airbnb.com/rooms/14610297,20160906204935,2016-09-07,Queen Ann Brookline B&B M605 Rm 2,"This home offers character and charm, extraordinary European artifacts, folk art, and warm and friendly hosts to make your stay a blissful experience.  It is close to the Metro stop at Washington Square - Green C Line,  shops and restaurants.  You’ll love it because of the quality of the Victorian décor and the neighborhood. My place is good for couples, solo adventurers, business travelers, and families (with kids). NOTE:  continental breakfast provided (not full).","This home offers character and charm, extraordinary European artifacts, folk art, and warm and friendly hosts to make your stay a blissful experience. It is a beautifully maintained Queen Anne Victorian with rooms on the 2nd and 3rd floor, walk up. Each has a queen bed and private bath. There is an additional room on the 2nd floor that does not have its own bathroom, it can only be reserved with another room which has its own bathroom, so that the two rooms would share the 1st room's bathroom.  Your hosts welcome you to enjoy an expanded continental breakfast in the dining room or their homey kitchen.   The house has been lovingly updated by your hostess, who is an awarding-winning architect. It is air conditioned, has WIFI and cable TV. Those looking for a Boston downtown location will be surprised at how close this is.  The trolley/subway is 1 block away and takes 15 minutes to arrive at Boston Commons.  The best Irish bar in metro Boston, a sensational European bakery and café, and","This home offers character and charm, extraordinary European artifacts, folk art, and warm and friendly hosts to make your stay a blissful experience.  It is close to the Metro stop at Washington Square - Green C Line,  shops and restaurants.  You’ll love it because of the quality of the Victorian décor and the neighborhood. My place is good for couples, solo adventurers, business travelers, and families (with kids). NOTE:  continental breakfast provided (not full). This home offers character and charm, extraordinary European artifacts, folk art, and warm and friendly hosts to make your stay a blissful experience. It is a beautifully maintained Queen Anne Victorian with rooms on the 2nd and 3rd floor, walk up. Each has a queen bed and private bath. There is an additional room on the 2nd floor that does not have its own bathroom, it can only be reserved with another room which has its own bathroom, so that the two rooms would share the 1st room's bathroom.  Your hosts welcome you to enj",none,"Washington Square is an upscale neighborhood in an upscale city, boarding Boston to the West. It has a commercial area of restaurants and shops.",There is one tandem parking spot at the property if available.  Would need to be reserved with reservation if available.,1 block to Beacon St  subway green C line. 5 blocks to Commonwealth Ave subway to BU or BC. Bus #65 to Longwood Medical area at Washington and Bartlet.,Hosts will greet you.,Hosts live at the B&B home,"- This is a residential home and neighborhood, and needs to remain quiet.",https://a2.muscache.com/im/pictures/2410bb7d-6a69-4d77-8480-4b532afbf629.jpg?aki_policy=small,https://a2.muscache.com/im/pictures/2410bb7d-6a69-4d77-8480-4b532afbf629.jpg?aki_policy=medium,https://a2.muscache.com/im/pictures/2410bb7d-6a69-4d77-8480-4b532afbf629.jpg?aki_policy=large,https://a2.muscache.com/im/pictures/2410bb7d-6a69-4d77-8480-4b532afbf629.jpg?aki_policy=x_large,32532791,https://www.airbnb.com/users/show/32532791,Marie,2015-05-03,"Boston, Massachusetts, United States","I am the owner of a small local and reputable company representing accommodations in Metro Boston since 1981 and long-standing members of the Greater Boston Convention and Visitors Bureau, Massachusetts Lodging Association and Professional Association of Innkeepers International. We own, manage and work closely with each property owner to ensure that they meet safety standards, are well maintained, clean and in desirable locations, giving you comfort in knowing there are no scams and meeting your expectations.  Our team at Bed and Breakfast Associates Bay Colony have detailed knowledge of the accommodations and locations. We encourage phone conversations, give personal attention to each inquiry, and are totally committed to providing each guest with exceptional quality, value and customer service.",within an hour,100%,91%,FALSE,https://a2.muscache.com/im/users/32532791/profile_pic/1430696380/original.jpg?aki_policy=profile_small,https://a2.muscache.com/im/users/32532791/profile_pic/1430696380/original.jpg?aki_policy=profile_x_medium,Medford,37,37,"['email', 'phone', 'reviews']",TRUE,FALSE,"Washington Street at Salisbury Road, Brookline, MA 02445, United States",Brookline,Brighton,NA,Brookline,MA,02445,Boston,"Brookline, MA",US,United States,42.33974852294104,-71.1364550323108,TRUE,Bed & Breakfast,Private room,3,1,1,1,Real Bed,"{TV,""Cable TV"",Internet,""Wireless Internet"",""Air Conditioning"",Breakfast,Heating,""Family/Kid Friendly"",""Smoke Detector"",""Carbon Monoxide Detector"",""Fire Extinguisher"",Essentials,""Lock on Bedroom Door"",Hangers,""Hair Dryer"",Iron,""Laptop Friendly Workspace""}",NA,$155.00,NA,NA,NA,$25.00,2,$35.00,2,1125,today,NA,5,28,39,168,2016-09-06,0,NA,NA,NA,NA,NA,NA,NA,NA,NA,FALSE,NA,NA,FALSE,strict,FALSE,FALSE,20,NA
9807292,https://www.airbnb.com/rooms/9807292,20160906204935,2016-09-07,Lux Brookline 2BR w/ gym & WiFi,"This property is a newly renovated 3 story elegant property located in Brookline Massachusetts. At this luxurious community, there is a fantastic variety of on-site amenities including a fitness center, a courtyard picnic area and a community room.","Our beautiful apartments feature bay windows, hardwood flooring, marble baths with heated floors, fully equipped kitchen with stainless steel appliances, unit key-less entries, spacious walk-in closets, in unit washers/dryers and much more. These apartments have been beautifully renovated in keeping with their distinct architectural heritage. Your fully appointed apartment is furnished with all the necessities of home, including linens & towels, and an individual washer/dryer. Property amenities include: • 24-hour concierge • Community room with free WiFi • Zip car on-site • Courtyard picnic area • Professional landscaping • Optional storage units available • Fitness center • Meeting room • Club house • Business center • In unit washer/dryer The private master bedroom with en-suite bathroom features a deluxe queen size bed with our indulgent custom linens, fluffy duvet, and plush pillows, two night tables with lamps, a clock radio, a dresser and a very spacious walk-in closet. The spac","This property is a newly renovated 3 story elegant property located in Brookline Massachusetts. At this luxurious community, there is a fantastic variety of on-site amenities including a fitness center, a courtyard picnic area and a community room. Our beautiful apartments feature bay windows, hardwood flooring, marble baths with heated floors, fully equipped kitchen with stainless steel appliances, unit key-less entries, spacious walk-in closets, in unit washers/dryers and much more. These apartments have been beautifully renovated in keeping with their distinct architectural heritage. Your fully appointed apartment is furnished with all the necessities of home, including linens & towels, and an individual washer/dryer. Property amenities include: • 24-hour concierge • Community room with free WiFi • Zip car on-site • Courtyard picnic area • Professional landscaping • Optional storage units available • Fitness center • Meeting room • Club house • Business center • In unit washer/dryer",none,"Living at this address, residents will enjoy the quiet serenity of residential suburban living in beautiful surroundings, with all of the excitement of Providence and Boston less than half an hour from their door.  The convenient location also offers the option to walk to many chic and trendy upscale local eateries, shopping centers, and cultural venues, as well as visit some of the area’s many extensive nearby parks.","Although we do not allow pets in our apartment, this apartment is located at a residential property that allows pets and there may be pet owners in the building.",Green (D-Riverside) Line runs steps from the property.,"You have access to the entire apartment, and all the fantastic amenities this building offers to its tenants.",We have local staff that you might meet in person that meticulously prepares the apartments for your arrival. Your check-in is typically handled by the building's front desk staff. We provide all other customer service and are available via phone and email promptly.  24 hour support is available for any emergencies that may occur.,"Please remember that this is a residential building. The building rules, apartment occupancy restrictions and the year-round tenants must be respected.  Parties, pets and smoking are not allowed under any circumstances and incur significant fees.",https://a2.muscache.com/im/pictures/76bbe7f2-7701-490f-b32b-9827fc1fa8d9.jpg?aki_policy=small,https://a2.muscache.com/im/pictures/76bbe7f2-7701-490f-b32b-9827fc1fa8d9.jpg?aki_policy=medium,https://a2.muscache.com/im/pictures/76bbe7f2-7701-490f-b32b-9827fc1fa8d9.jpg?aki_policy=large,https://a2.muscache.com/im/pictures/76bbe7f2-7701-490f-b32b-9827fc1fa8d9.jpg?aki_policy=x_large,9419684,https://www.airbnb.com/users/show/9419684,Mike,2013-10-14,"New York, New York, United States","We have been providing vacation rental apartments for over 10 years across the East Coast. We are known for our distinctively furnished apartments in popular locations, and for our attentive service. You’ll find that our rates are quite reasonable. If you're looking for a safe, comfortable place with fabulous amenities and Wi-Fi (we know you need the Wi-Fi!) in the Boston MA area, Washington DC, Miami FL or very close to NYC in Jersey City or Hoboken, we'd love to host you. Many of the buildings where our apartments are located feature amenities such as beautiful lobbies, 24 hour front desk staff, fitness centers, business centers, recreation rooms, indoor or outdoor pools and whirlpools. If you are traveling with children, some buildings offer playgrounds (many buildings are near public playgrounds as well) or indoor playrooms. Depending on the location, you can stay for just a few days, a week, a month or more. 

We offer an assortment of short-term apartments in sizes ranging from a studio to three bedrooms that are fully furnished with all the comforts of home. Our local staff meticulously prepares your apartment before your arrival, and we offer 24 hour assistance for any emergencies after business hours. When you arrive at your apartment, the beds will be made, towels and bath amenities will be stocked in the bathrooms, and the coffee maker will be set up in the kitchen with some sample coffees, sweetener and creamer (teabags too if that is your preference) to start your morning off properly. If you’d like to cook a meal, the kitchen is stocked with dishes, cutlery, glassware and pots and pans. The living room is set up with a TV and cable channels, and the Wi-Fi router password and instructions will be prominently displayed so you can get connected quickly. You can also make local and toll-free phone calls at no charge. 

Please contact us to confirm the exact availability of the apartment you are interested in. We’d love to host you (and your family) for your vacation or business trip.",within a few hours,96%,68%,FALSE,https://a2.muscache.com/im/users/9419684/profile_pic/1427816343/original.jpg?aki_policy=profile_small,https://a2.muscache.com/im/users/9419684/profile_pic/1427816343/original.jpg?aki_policy=profile_x_medium,West End,313,313,"['email', 'phone', 'manual_online', 'reviews', 'manual_offline', 'kba']",TRUE,TRUE,"Chapel Street, Brookline, MA 02446, United States",Brookline,Longwood Medical Area,NA,Brookline,MA,02446,Boston,"Brookline, MA",US,United States,42.34100552712397,-71.11237533968209,TRUE,Apartment,Entire home/apt,5,2,2,2,Real Bed,"{TV,""Cable TV"",Internet,""Wireless Internet"",""Air Conditioning"",Kitchen,""Elevator in Building"",""Buzzer/Wireless Intercom"",Heating,""Family/Kid Friendly"",Washer,Dryer,""Smoke Detector"",""Carbon Monoxide Detector"",Essentials,Shampoo,Hangers,Iron,""Laptop Friendly Workspace""}",NA,$350.00,NA,NA,NA,$100.00,1,$0.00,20,1125,4 days ago,NA,22,52,82,140,2016-09-06,0,NA,NA,NA,NA,NA,NA,NA,NA,NA,FALSE,NA,NA,FALSE,moderate,FALSE,TRUE,61,NA
13015653,https://www.airbnb.com/rooms/13015653,20160906204935,2016-09-07,Big Room at Brookline Hill in Boston,"The private room is big enough. My place is 5 minutes' walking distance to Green Line D (Brookline Hill). It is near to Harvard Medical School and its affiliated hospitals, Pizza Stop,  Supermarket, Cafe. You’ll love my place because of the neighborhood and the outdoors space. My place is good for couples, solo adventurers, and business travelers.",Your private room is big enough. And the living room is spacious.,"The private room is big enough. My place is 5 minutes' walking distance to Green Line D (Brookline Hill). It is near to Harvard Medical School and its affiliated hospitals, Pizza Stop,  Supermarket, Cafe. You’ll love my place because of the neighborhood and the outdoors space. My place is good for couples, solo adventurers, and business travelers. Your private room is big enough. And the living room is spacious. I am available to offer any help during your stay. It is close to Bus 60 and Subway Green Line D- Brookline Hill Station. It is also near to Harvard Medical School and its affiliated hospitals.",none,NA,NA,It is close to Bus 60 and Subway Green Line D- Brookline Hill Station. It is also near to Harvard Medical School and its affiliated hospitals.,NA,I am available to offer any help during your stay.,NA,https://a2.muscache.com/im/pictures/dbd369c3-ef6a-42f6-8c53-4c2c160db253.jpg?aki_policy=small,https://a2.muscache.com/im/pictures/dbd369c3-ef6a-42f6-8c53-4c2c160db253.jpg?aki_policy=medium,https://a2.muscache.com/im/pictures/dbd369c3-ef6a-42f6-8c53-4c2c160db253.jpg?aki_policy=large,https://a2.muscache.com/im/pictures/dbd369c3-ef6a-42f6-8c53-4c2c160db253.jpg?aki_policy=x_large,45902201,https://www.airbnb.com/users/show/45902201,Wencai,2015-10-06,"Boston, Massachusetts, United States",Biomedical researcher. With PhD and MD.,within a few hours,100%,100%,FALSE,https://a2.muscache.com/im/users/45902201/profile_pic/1444142767/original.jpg?aki_policy=profile_small,https://a2.muscache.com/im/users/45902201/profile_pic/1444142767/original.jpg?aki_policy=profile_x_medium,Brookline,1,1,"['email', 'phone', 'reviews']",TRUE,FALSE,"Brookline Hill, Brookline, MA 02445, United States",Brookline,Mission Hill,NA,Brookline,MA,02445,Boston,"Brookline, MA",US,United States,42.3346568973843,-71.11345643936876,TRUE,Apartment,Private room,1,1,1,1,Real Bed,"{""Air Conditioning"",Kitchen,""Hot Tub"",""Indoor Fireplace"",Heating,""Family/Kid Friendly"",Washer,Dryer,""Smoke Detector"",""Carbon Monoxide Detector"",Essentials,Shampoo,Hangers,""Laptop Friendly Workspace""}",NA,$39.00,NA,NA,$100.00,$20.00,1,$20.00,1,1125,6 days ago,NA,3,13,33,226,2016-09-06,4,2016-08-16,2016-08-26,100,10,10,9,10,10,9,FALSE,NA,NA,FALSE,moderate,FALSE,FALSE,1,4
14871445,https://www.airbnb.com/rooms/14871445,20160906204935,2016-09-07,Private Room with half bathroom inside near Subway,"My place is good for couples, solo adventurers, and business travelers.",NA,"My place is good for couples, solo adventurers, and business travelers.",none,NA,NA,NA,NA,NA,NA,https://a2.muscache.com/im/pictures/f9f4d0a9-b040-47d4-8347-49d8ce316dab.jpg?aki_policy=small,https://a2.muscache.com/im/pictures/f9f4d0a9-b040-47d4-8347-49d8ce316dab.jpg?aki_policy=medium,https://a2.muscache.com/im/pictures/f9f4d0a9-b040-47d4-8347-49d8ce316dab.jpg?aki_policy=large,https://a2.muscache.com/im/pictures/f9f4d0a9-b040-47d4-8347-49d8ce316dab.jpg?aki_policy=x_large,33913874,https://www.airbnb.com/users/show/33913874,Mir,2015-05-21,"Boston, Massachusetts, United States",NA,within an hour,100%,100%,FALSE,https://a2.muscache.com/im/pictures/eee27483-65ce-4d78-a77b-ec10d33fe82e.jpg?aki_policy=profile_small,https://a2.muscache.com/im/pictures/eee27483-65ce-4d78-a77b-ec10d33fe82e.jpg?aki_policy=profile_x_medium,Brookline,2,2,"['email', 'phone', 'reviews', 'kba']",TRUE,TRUE,"Dean Road, Brookline, MA 02445, United States",Brookline,Brighton,NA,Brookline,MA,02445,Boston,"Brookline, MA",US,United States,42.33637594727255,-71.14083351429836,TRUE,Apartment,Private room,2,1.5,1,1,Real Bed,"{TV,""Wireless Internet"",""Air Conditioning"",Heating,Washer,Dryer,""Smoke Detector"",""Carbon Monoxide Detector"",Essentials,Iron,""Laptop Friendly Workspace""}",NA,$85.00,NA,NA,NA,NA,1,$0.00,1,1125,4 days ago,NA,22,52,82,357,2016-09-06,0,NA,NA,NA,NA,NA,NA,NA,NA,NA,FALSE,NA,NA,FALSE,flexible,FALSE,FALSE,1,NA
