14592547,https://www.airbnb.com/rooms/14592547,20160906204935,2016-09-07,Private Room Boston/Brookline Great location,"My place is close to 4Acoffee, Starbucks, Harry's Bar & Grill, Tjmaxx, Bfresh, Whole Foods, Coolidge Corner(all stores and restaurants), Washington Square(all bars and restaurants), TraderJoes,KupelBagel. You’ll love my place because of the coziness, the location, and the high ceilings. My place is good for couples, solo adventurers, and business travelers. There is meter parking a block away from the apartment, no meter charging from 8PM to 8AM. There's non metered parking close by as well.",Its a small room but cozy and comfortable. Perfect for quick business or weekend trips.,"My place is close to 4Acoffee, Starbucks, Harry's Bar & Grill, Tjmaxx, Bfresh, Whole Foods, Coolidge Corner(all stores and restaurants), Washington Square(all bars and restaurants), TraderJoes,KupelBagel. You’ll love my place because of the coziness, the location, and the high ceilings. My place is good for couples, solo adventurers, and business travelers. There is meter parking a block away from the apartment, no meter charging from 8PM to 8AM. There's non metered parking close by as well. Its a small room but cozy and comfortable. Perfect for quick business or weekend trips. Guests can use living room, office space(in case we're not working), and kitchen. We're happy to assist with any necessity and help with any area recommendations. In case neither of us are present, we're always available by phone. We live in one of Boston's favorite neighborhoods. Allston/Brookline is the perfect location to be as close to the city as you can while still enjoying the conveniences of a borough. T",none,We live in one of Boston's favorite neighborhoods. Allston/Brookline is the perfect location to be as close to the city as you can while still enjoying the conveniences of a borough.,NA,"The apartment is located one block away from the Harvard T station, uber and taxis are also a convenience.","Guests can use living room, office space(in case we're not working), and kitchen.","We're happy to assist with any necessity and help with any area recommendations. In case neither of us are present, we're always available by phone.",Guests cannot wear shoes in the house.,https://a2.muscache.com/im/pictures/892007e8-7e4b-4bdc-ae19-00e3e8154553.jpg?aki_policy=small,https://a2.muscache.com/im/pictures/892007e8-7e4b-4bdc-ae19-00e3e8154553.jpg?aki_policy=medium,https://a2.muscache.com/im/pictures/892007e8-7e4b-4bdc-ae19-00e3e8154553.jpg?aki_policy=large,https://a2.muscache.com/im/pictures/892007e8-7e4b-4bdc-ae19-00e3e8154553.jpg?aki_policy=x_large,90497470,https://www.airbnb.com/users/show/90497470,Sofia And Kim,2016-08-17,"Brookline, Massachusetts, United States","Hello, 
We are Kim and Sofie. We're roommates and we're  both young professionals that work in the biotech industry. We've both been living in different areas of Boston for  a while but we love where we live now. Boston has been good to us and we could not pick a better location to be in. 
We're easy going and social. We have very busy lives so we're not always at the apartment but we like to come home to a nice, neat and clean space. 
We like to travel and do so as much as we can. In all our travels we like to stay in nice places where the environment feels like home away from home. 
We want to share one of the three bedrooms in our apartment and become those hosts that provide that same quality experience to others.",within an hour,100%,100%,FALSE,https://a2.muscache.com/im/pictures/33734fb2-b17d-4f99-bb91-525ddf4feb2d.jpg?aki_policy=profile_small,https://a2.muscache.com/im/pictures/33734fb2-b17d-4f99-bb91-525ddf4feb2d.jpg?aki_policy=profile_x_medium,Brookline,1,1,"['email', 'phone', 'reviews']",TRUE,FALSE,"Verndale Street, Brookline, MA 02446, United States",Brookline,Allston,NA,Brookline,MA,02446,Boston,"Brookline, MA",US,United States,42.34910682295989,-71.12858566302741,TRUE,Apartment,Private room,2,1,1,1,Real Bed,"{""Wireless Internet"",Kitchen,Heating,Washer,Dryer,""Smoke Detector"",""Carbon Monoxide Detector"",""First Aid Kit"",""Fire Extinguisher"",Essentials,Shampoo,""Lock on Bedroom Door"",Hangers,""Hair Dryer"",Iron,""translation missing: en.hosting_amenity_49"",""translation missing: en.hosting_amenity_50""}",NA,$89.00,NA,NA,NA,NA,1,$0.00,1,1125,today,NA,0,0,0,0,2016-09-06,2,2016-08-30,2016-09-02,100,10,10,10,10,10,10,FALSE,NA,NA,FALSE,flexible,FALSE,FALSE,1,2
13750763,https://www.airbnb.com/rooms/13750763,20160906204935,2016-09-07,Comfortable Space in the Heart of Brookline,"Our place is close to Coolidge Corner, Allston Village, the B and C Lines on Boston's subway system (the T), restaurants, grocery store, shopping, movie theater, gym, yoga studios and just about anything else you can think of is a short walk away.  For those longer treks, you can walk to a zip car location within minutes..","This space consists of 2 Rooms and a private bathroom.  The bedroom has a queen sized bed, AC, cable and wifi.  The living area contains a small refrigerator, table with 2 chairs, sink (with cold water only - bathroom has hot water as well).  Space is accessed from the back of the house through a private entrance.","Our place is close to Coolidge Corner, Allston Village, the B and C Lines on Boston's subway system (the T), restaurants, grocery store, shopping, movie theater, gym, yoga studios and just about anything else you can think of is a short walk away.  For those longer treks, you can walk to a zip car location within minutes.. This space consists of 2 Rooms and a private bathroom.  The bedroom has a queen sized bed, AC, cable and wifi.  The living area contains a small refrigerator, table with 2 chairs, sink (with cold water only - bathroom has hot water as well).  Space is accessed from the back of the house through a private entrance. We are typically available to offer assistance during throughout the stay. Brookline is known for being an excellent and safe area.  Our location has easy walking access to both the Allston Village and Coolidge Corner area restaurants, shops and neighborhood movie theater.  Our house is also next door to a park with tennis courts and a playground.  This loc",none,"Brookline is known for being an excellent and safe area.  Our location has easy walking access to both the Allston Village and Coolidge Corner area restaurants, shops and neighborhood movie theater.  Our house is also next door to a park with tennis courts and a playground.  This location is ideal for folks looking to visit either Boston College or Boston University.",There is no parking available with this rental.,There are 2 green line trains within walking distance in addition to zip car and bicycle rentals nearby.,NA,We are typically available to offer assistance during throughout the stay.,- Multiple night discounts apply for 3 or more nights,https://a2.muscache.com/im/pictures/a998d5cd-8316-4921-a1c7-451e1e7e295a.jpg?aki_policy=small,https://a2.muscache.com/im/pictures/a998d5cd-8316-4921-a1c7-451e1e7e295a.jpg?aki_policy=medium,https://a2.muscache.com/im/pictures/a998d5cd-8316-4921-a1c7-451e1e7e295a.jpg?aki_policy=large,https://a2.muscache.com/im/pictures/a998d5cd-8316-4921-a1c7-451e1e7e295a.jpg?aki_policy=x_large,33906096,https://www.airbnb.com/users/show/33906096,Gillian,2015-05-21,"Brookline, Massachusetts, United States","I am a professional woman, married to a wonderful man for my second time around the block.  We are the proud parents of four children between the two of us; 2 amazing kids each from our previous marriages (ranging in age from 8 - 15).  

I grew up in Marblehead, MA so have a love of the ocean that I am pretty sure comes from a childhood of summers at the beach and winters eating clam chowder and watching storms stir up the waters into a frenzy of crashing waves and foam.

My husband grew up in South Africa and has lived here for almost 20 years.  Between the two of us, we love to travel and explore the world whenever we have the time and resources.  

We are non-smokers.  We treat every home like we would want our home to be treated.  We love to entertain so will sometimes travel with friends or our extended families.  

5 things I cannot live without?
Love, the Ocean, my Children and Husband, my Purse and my Friends.

My favorite destinations:
The beach - always the beach, New cities or countries, South Africa, Korea",N/A,N/A,N/A,FALSE,https://a0.muscache.com/im/users/33906096/profile_pic/1432383849/original.jpg?aki_policy=profile_small,https://a0.muscache.com/im/users/33906096/profile_pic/1432383849/original.jpg?aki_policy=profile_x_medium,Brookline,1,1,"['email', 'phone', 'kba']",TRUE,FALSE,"Russell Street, Brookline, MA 02446, United States",Brookline,Allston,NA,Brookline,MA,02446,NA,"Brookline, MA",US,United States,42.347187056561424,-71.13185996505644,TRUE,Apartment,Private room,2,1,1,1,Real Bed,"{TV,""Wireless Internet"",Heating,""Family/Kid Friendly"",""Smoke Detector"",Essentials,Shampoo,""Lock on Bedroom Door"",Hangers,""Hair Dryer""}",NA,$150.00,NA,NA,NA,NA,1,$0.00,1,1125,today,NA,2,9,9,9,2016-09-06,0,NA,NA,NA,NA,NA,NA,NA,NA,NA,FALSE,NA,NA,FALSE,flexible,FALSE,FALSE,1,NA
14852179,https://www.airbnb.com/rooms/14852179,20160906204935,2016-09-07,Spacious Queen Bed Room Close to Boston University,"- Grocery: A full-size Star market is 2 minutes walk away. - Transportation: Airport is under 20 mins away (no traffic); Babcock B Line station is 2 mins walk away; Bus 57 is 2 mins walk away; if you drive, you'd be on the Pike within 5 mins, or Storrow Drive within 5 mins. Two-hour free parking in the day, and overnight parking on Comm Ave.  - A 65 inch TV, am XBOX, a PS3, a Wii, and an Apple TV. Fridge, oven, gas stove, microwave.. plus a George Foreman, Nespresso and Vitamix",NA,"- Grocery: A full-size Star market is 2 minutes walk away. - Transportation: Airport is under 20 mins away (no traffic); Babcock B Line station is 2 mins walk away; Bus 57 is 2 mins walk away; if you drive, you'd be on the Pike within 5 mins, or Storrow Drive within 5 mins. Two-hour free parking in the day, and overnight parking on Comm Ave.  - A 65 inch TV, am XBOX, a PS3, a Wii, and an Apple TV. Fridge, oven, gas stove, microwave.. plus a George Foreman, Nespresso and Vitamix",none,NA,NA,NA,NA,NA,NA,https://a2.muscache.com/im/pictures/02834ef2-7787-46ae-a05b-6c5fbe6d695f.jpg?aki_policy=small,https://a2.muscache.com/im/pictures/02834ef2-7787-46ae-a05b-6c5fbe6d695f.jpg?aki_policy=medium,https://a2.muscache.com/im/pictures/02834ef2-7787-46ae-a05b-6c5fbe6d695f.jpg?aki_policy=large,https://a2.muscache.com/im/pictures/02834ef2-7787-46ae-a05b-6c5fbe6d695f.jpg?aki_policy=x_large,67981314,https://www.airbnb.com/users/show/67981314,Max,2016-04-19,"Boston, Massachusetts, United States",NA,N/A,N/A,N/A,FALSE,https://a2.muscache.com/im/pictures/e17a5223-1a9e-40c2-9dbb-0d6423f2c48a.jpg?aki_policy=profile_small,https://a2.muscache.com/im/pictures/e17a5223-1a9e-40c2-9dbb-0d6423f2c48a.jpg?aki_policy=profile_x_medium,Brookline,1,1,"['email', 'phone', 'facebook', 'jumio']",TRUE,TRUE,"Winslow Road, Brookline, MA 02446, United States",Brookline,Allston,NA,Brookline,MA,02446,Boston,"Brookline, MA",US,United States,42.349379893443604,-71.1228684685468,TRUE,Condominium,Private room,2,1,1,1,Real Bed,"{TV,""Cable TV"",Internet,""Wireless Internet"",Kitchen,""Pets Allowed"",Heating,Washer,Dryer,""Smoke Detector"",""Carbon Monoxide Detector"",""First Aid Kit"",""Fire Extinguisher"",Essentials,Shampoo,""Lock on Bedroom Door"",""24-Hour Check-in"",Hangers,""Hair Dryer"",Iron,""Laptop Friendly Workspace""}",NA,$100.00,NA,NA,NA,$10.00,1,$0.00,2,1125,yesterday,NA,0,22,23,23,2016-09-06,0,NA,NA,NA,NA,NA,NA,NA,NA,NA,FALSE,NA,NA,FALSE,flexible,FALSE,FALSE,1,NA
