id,listing_url,scrape_id,last_scraped,name,summary,space,description,experiences_offered,neighborhood_overview,notes,transit,access,interaction,house_rules,thumbnail_url,medium_url,picture_url,xl_picture_url,host_id,host_url,host_name,host_since,host_location,host_about,host_response_time,host_response_rate,host_acceptance_rate,host_is_superhost,host_thumbnail_url,host_picture_url,host_neighbourhood,host_listings_count,host_total_listings_count,host_verifications,host_has_profile_pic,host_identity_verified,street,neighbourhood,neighbourhood_cleansed,neighbourhood_group_cleansed,city,state,zipcode,market,smart_location,country_code,country,latitude,longitude,is_location_exact,property_type,room_type,accommodates,bathrooms,bedrooms,beds,bed_type,amenities,square_feet,price,weekly_price,monthly_price,security_deposit,cleaning_fee,guests_included,extra_people,minimum_nights,maximum_nights,calendar_updated,has_availability,availability_30,availability_60,availability_90,availability_365,calendar_last_scraped,number_of_reviews,first_review,last_review,review_scores_rating,review_scores_accuracy,review_scores_cleanliness,review_scores_checkin,review_scores_communication,review_scores_location,review_scores_value,requires_license,license,jurisdiction_names,instant_bookable,cancellation_policy,require_guest_profile_picture,require_guest_phone_verification,calculated_host_listings_count,reviews_per_month
7789055,https://www.airbnb.com/rooms/7789055,20160906204935,2016-09-07,"3B2B parking,MIT/Havard,BU,Fenway, near 2T station","Located in walking distance(~12min.) to two T lines(red and green),Harvard, MIT and BU. Easy access to Boston, nearby Charles river, Magazine beach park, 5min. walk to grocery Trader Joes,swimming pool and Boat house. Safe neighborhood. Offers entire 3B2B.","You can have entire spacious 3 bed rooms, 2 full bath rooms unit at a convenient and quiet neighborhood.  The sofa can be pulled out to a full size bed and there is a full size floor mattress too. The unit offers high ceiling, lot of sun, in unit washer and dryer and central air conditioning. Central square T is at the end of the street.  Grocery store is 5 min.walk at the corner. Next to Charles river, 5 min. to Magazine beach, swimming pool(free), lots green, with wood table and chairs, great river site view and walk. Its a nice place to relax with family and friends. Bus down the street directly goes to Boston downtown. Walking to BU, Fenway( or take T), redline T and greenline T stop. Easy to MIT and Harvard as well. a bike is also offered you for free use during your stay. Washer and dryer are in apt. Parking anywhere nearby with resident permit sign. ( please pay attention to the street cleaning time on each sign to avoid it. It's easy to park nearby.","Located in walking distance(~12min.) to two T lines(red and green),Harvard, MIT and BU. Easy access to Boston, nearby Charles river, Magazine beach park, 5min. walk to grocery Trader Joes,swimming pool and Boat house. Safe neighborhood. Offers entire 3B2B. You can have entire spacious 3 bed rooms, 2 full bath rooms unit at a convenient and quiet neighborhood.  The sofa can be pulled out to a full size bed and there is a full size floor mattress too. The unit offers high ceiling, lot of sun, in unit washer and dryer and central air conditioning. Central square T is at the end of the street.  Grocery store is 5 min.walk at the corner. Next to Charles river, 5 min. to Magazine beach, swimming pool(free), lots green, with wood table and chairs, great river site view and walk. Its a nice place to relax with family and friends. Bus down the street directly goes to Boston downtown. Walking to BU, Fenway( or take T), redline T and greenline T stop. Easy to MIT and Harvard as well. a bike is al",none,"Very nice and safe neighborhood. walking safe and convenient to grocery store, charles river, MIT, Harvard and public transportation.","The parking permit give you the right to park freely anywhere between Massachussets ave. and Charles rive on the east side under resident permit sign. You can park very near to T, Harvard and MIT if you need to save time for walking or in bad weather. And Its very convenient and powerful to use.  Feel free to take the benefit! Also there is a Hubway only several mins away. Very convenient traffic.","Near central square red line T and BU green line T, walking to Harvard and MIT. Walking distance to BU, Fenway as well. Bus downstairs goes to Boston and T.  bus 47 is next to the building, goes to 47 - Central Sq., Cambridge - Broadway Station via B.U. Medical Center, Dudley Station & Longwood Medical Area. Airport is 25 min. By drive or conviniently taking red line T then change silver line to the airport.","entire unit. bed rooms, bath room, kitchen, living room",some time,"It is very quiet neighborhood,  -No party is allowed in the apt. And  -please keep quiet at late time,after 10:00pm.  - Please take off shoes in the apt.  - Please turn off the central air when leave. You can leave the key and parking permit on table and lock the door. Thanks. Please feel free to let me know you have any question. Thanks.",https://a2.muscache.com/im/pictures/0e5f8377-5b6f-4d1f-b993-c4f3f688b01e.jpg?aki_policy=small,https://a2.muscache.com/im/pictures/0e5f8377-5b6f-4d1f-b993-c4f3f688b01e.jpg?aki_policy=medium,https://a2.muscache.com/im/pictures/0e5f8377-5b6f-4d1f-b993-c4f3f688b01e.jpg?aki_policy=large,https://a2.muscache.com/im/pictures/0e5f8377-5b6f-4d1f-b993-c4f3f688b01e.jpg?aki_policy=x_large,19008767,https://www.airbnb.com/users/show/19008767,Ellen,2014-07-27,"Massachusetts, United States","I like interior design, science and arts. I like to share good things in life and I like to host. I can speak English and Chinese fluently. I wish you enjoy your journey and all that I can offer as a small piece of it.  I'm not perfect though, I'm trying my best.  I wish you enjoy the good moment...
",within an hour,100%,98%,FALSE,https://a0.muscache.com/im/users/19008767/profile_pic/1406521313/original.jpg?aki_policy=profile_small,https://a0.muscache.com/im/users/19008767/profile_pic/1406521313/original.jpg?aki_policy=profile_x_medium,Cambridge,7,7,"['email', 'phone', 'reviews', 'jumio']",TRUE,TRUE,"Magazine Street, Cambridge, MA 02139, United States",Cambridge,Allston,NA,Cambridge,MA,02139,Boston,"Cambridge, MA",US,United States,42.35934172208254,-71.11404688704577,TRUE,Apartment,Entire home/apt,8,2,3,5,Real Bed,"{Internet,""Wireless Internet"",""Air Conditioning"",Kitchen,""Free Parking on Premises"",Heating,""Family/Kid Friendly"",Washer,Dryer,""Smoke Detector"",""Carbon Monoxide Detector"",""First Aid Kit"",Essentials,Shampoo,""24-Hour Check-in"",Hangers,""Hair Dryer"",Iron,""Laptop Friendly Workspace""}",NA,$329.00,NA,NA,$100.00,$90.00,4,$20.00,1,1125,today,NA,18,42,68,333,2016-09-06,38,2015-08-22,2016-07-31,89,9,9,9,10,10,9,FALSE,NA,NA,TRUE,strict,FALSE,FALSE,5,2.98
14902894,https://www.airbnb.com/rooms/14902894,20160906204935,2016-09-07,Suite _Charles River/MIT/BU/Fanway Park,"MPrime CambridgePort location on Quiet Area Walk : 9min to Central Square T ( 3 Stop to Downtown Boston ) 9min to Harvard Business S 15min to MIT 20min to Harvard Square/BU 8min to Charles River, Courtyard Cambridge 12min to Hyatt Regency Cambridgy place is close to Central Square, Charlies River, Magazine Beach.","This is Room#1 with private entry door and Suite with queen size bed, twin beds and bath in the room. Full access to living room and kitchen ( coffee maker, toaster, microwave, refrigerator),  but we don't allow stove cooking in the kitchen.","MPrime CambridgePort location on Quiet Area Walk : 9min to Central Square T ( 3 Stop to Downtown Boston ) 9min to Harvard Business S 15min to MIT 20min to Harvard Square/BU 8min to Charles River, Courtyard Cambridge 12min to Hyatt Regency Cambridgy place is close to Central Square, Charlies River, Magazine Beach. This is Room#1 with private entry door and Suite with queen size bed, twin beds and bath in the room. Full access to living room and kitchen ( coffee maker, toaster, microwave, refrigerator),  but we don't allow stove cooking in the kitchen. We have keyless door entry so guest can in/out easily. We are on quiet and one way street. There is many restaurant around Central /Harvard / Inamn Square. Morning walk along Charles River From Logan Airport, take the free Silver Line bus and will pick you up in front of each Logan Terminal. This bus will take you to South Station then take the Red Line subway towards Alewife and off at Central Square. Our house is less then 10 mins walk f",none,We are on quiet and one way street. There is many restaurant around Central /Harvard / Inamn Square.,We provide wireless internet and basic cable TV. Please request ahead of time for quarantee parking permit.,"Morning walk along Charles River From Logan Airport, take the free Silver Line bus and will pick you up in front of each Logan Terminal. This bus will take you to South Station then take the Red Line subway towards Alewife and off at Central Square. Our house is less then 10 mins walk from Central Square.",We have keyless door entry so guest can in/out easily.,NA,NA,https://a2.muscache.com/im/pictures/c9258e1e-6a34-46b4-b27c-8e7a29b568dd.jpg?aki_policy=small,https://a2.muscache.com/im/pictures/c9258e1e-6a34-46b4-b27c-8e7a29b568dd.jpg?aki_policy=medium,https://a2.muscache.com/im/pictures/c9258e1e-6a34-46b4-b27c-8e7a29b568dd.jpg?aki_policy=large,https://a2.muscache.com/im/pictures/c9258e1e-6a34-46b4-b27c-8e7a29b568dd.jpg?aki_policy=x_large,17476640,https://www.airbnb.com/users/show/17476640,John / Evelyn,2014-06-30,"Cambridge, Massachusetts, United States","Hello! I'm John and have been a restaurateur in the Boston area for the last 20+ years. I am semi-retired now and frequently enjoy traveling abroad to China and Taiwan during the year, but Boston will always be my home. My #1 passion is cooking and good food.

I am a quiet and reserved individual and guests will never find me intrusive. Guests can expect absolute 100% privacy staying in our apartment units. However my family or I are always more then happy to lend a helping hand should you need! We are usually never too far away. 
",within an hour,100%,81%,FALSE,https://a2.muscache.com/im/users/17476640/profile_pic/1440600090/original.jpg?aki_policy=profile_small,https://a2.muscache.com/im/users/17476640/profile_pic/1440600090/original.jpg?aki_policy=profile_x_medium,Cambridge,5,5,"['email', 'phone', 'reviews']",TRUE,FALSE,"Allston Street, Cambridge, MA 02139, United States",Cambridge,Allston,NA,Cambridge,MA,02139,Boston,"Cambridge, MA",US,United States,42.355575057917854,-71.11156918509697,TRUE,House,Private room,4,1,1,3,Real Bed,"{TV,Internet,""Wireless Internet"",""Air Conditioning"",Kitchen,""Free Parking on Street"",Heating,Essentials,Shampoo,""24-Hour Check-in"",Hangers,""Hair Dryer"",Iron,""Laptop Friendly Workspace""}",NA,$140.00,NA,NA,$100.00,$20.00,2,$15.00,2,1125,yesterday,NA,24,47,77,352,2016-09-06,0,NA,NA,NA,NA,NA,NA,NA,NA,NA,FALSE,NA,NA,FALSE,strict,FALSE,FALSE,1,NA
14584547,https://www.airbnb.com/rooms/14584547,20160906204935,2016-09-07,"2 Bedrooms Apartment,  Harvard Square Cambridge","Close to Harvard Square, Harvard Yard, Red Line Transportation, Restaurants, Coffee shops. You’ll love my place because of the location. My place is good for couples, solo adventurers, business travelers, and families (with kids).",NA,"Close to Harvard Square, Harvard Yard, Red Line Transportation, Restaurants, Coffee shops. You’ll love my place because of the location. My place is good for couples, solo adventurers, business travelers, and families (with kids).",none,NA,NA,NA,NA,NA,NA,https://a2.muscache.com/im/pictures/4154c793-1e71-44ae-bc97-40355814e25e.jpg?aki_policy=small,https://a2.muscache.com/im/pictures/4154c793-1e71-44ae-bc97-40355814e25e.jpg?aki_policy=medium,https://a2.muscache.com/im/pictures/4154c793-1e71-44ae-bc97-40355814e25e.jpg?aki_policy=large,https://a2.muscache.com/im/pictures/4154c793-1e71-44ae-bc97-40355814e25e.jpg?aki_policy=x_large,84472717,https://www.airbnb.com/users/show/84472717,Tani,2016-07-18,"Cambridge, Massachusetts, United States",NA,within a day,86%,100%,FALSE,https://a2.muscache.com/im/pictures/9aacffc1-2d08-40c5-b3c3-78a882246c55.jpg?aki_policy=profile_small,https://a2.muscache.com/im/pictures/9aacffc1-2d08-40c5-b3c3-78a882246c55.jpg?aki_policy=profile_x_medium,Harvard Square,5,5,"['email', 'phone']",TRUE,FALSE,"Banks Street, Cambridge, MA 02138, United States",Cambridge,Allston,NA,Cambridge,MA,02138,Boston,"Cambridge, MA",US,United States,42.36916541510093,-71.11555022243783,TRUE,Apartment,Entire home/apt,4,1,2,2,Real Bed,"{TV,""Wireless Internet"",""Air Conditioning"",Kitchen,Heating,""Family/Kid Friendly"",Washer,Dryer,Essentials,Hangers,""Laptop Friendly Workspace""}",NA,$295.00,NA,NA,$500.00,$200.00,1,$0.00,7,1125,3 weeks ago,NA,29,59,89,364,2016-09-06,0,NA,NA,NA,NA,NA,NA,NA,NA,NA,FALSE,NA,NA,FALSE,strict,FALSE,FALSE,1,NA
14510982,https://www.airbnb.com/rooms/14510982,20160906204935,2016-09-07,"Central Square, Charles River / Harvard Bus School","My place is close to the Charles River, Central Square, and steps from the Harvard Business School foot bridge. The location is perfect for a stroll along the river, with nearby parks and a lively neighborhood full of restaurants and bars. My entire apartment was just recent remodeled with an updated bathroom, kitchen, new hardwood floors, and new furniture. Easy access to public transportation, just 10 minute walk to Central Square MBTA (subway) a walker's and biker's paradise!","It's modern unit with all new furniture and memory foam mattress. My entire apartment was just recent remodeled with an updated bathroom, kitchen, new hardwood floors, and new furniture.","My place is close to the Charles River, Central Square, and steps from the Harvard Business School foot bridge. The location is perfect for a stroll along the river, with nearby parks and a lively neighborhood full of restaurants and bars. My entire apartment was just recent remodeled with an updated bathroom, kitchen, new hardwood floors, and new furniture. Easy access to public transportation, just 10 minute walk to Central Square MBTA (subway) a walker's and biker's paradise! It's modern unit with all new furniture and memory foam mattress. My entire apartment was just recent remodeled with an updated bathroom, kitchen, new hardwood floors, and new furniture. You can access the entire unit. You can check in via our check-in system. My place is close to the Charles River, Central Square, and steps from the Harvard Business School foot bridge. The location is perfect for a stroll along the river, with nearby parks and a lively neighborhood full of restaurants and bars. Very convenient",none,"My place is close to the Charles River, Central Square, and steps from the Harvard Business School foot bridge. The location is perfect for a stroll along the river, with nearby parks and a lively neighborhood full of restaurants and bars. Very convenient location between Harvard and MIT. Enjoy the morning walk along Charles River. Easy 8 min walk to Central Sq Redline and Whole Foods / Trader Joe's very close by.",NA,"Easy access to public transportation, just 10 minute walk to Central Square MBTA (subway) a walker's and biker's paradise! Easy access via car to major highways and roads in the area (I-95, I-90), all less than a 5 minute drive away.",You can access the entire unit.,You can check in via our check-in system.,NA,https://a2.muscache.com/im/pictures/d6dcc8af-797f-44e2-a797-582d4f988b92.jpg?aki_policy=small,https://a2.muscache.com/im/pictures/d6dcc8af-797f-44e2-a797-582d4f988b92.jpg?aki_policy=medium,https://a2.muscache.com/im/pictures/d6dcc8af-797f-44e2-a797-582d4f988b92.jpg?aki_policy=large,https://a2.muscache.com/im/pictures/d6dcc8af-797f-44e2-a797-582d4f988b92.jpg?aki_policy=x_large,21647935,https://www.airbnb.com/users/show/21647935,Ivan / Kim,2014-09-22,"Cambridge, Massachusetts, United States",I'm a software engineer that travels between SFO and Boston.  My parents take care of my property while I'm not around.  I enjoy travelling and meeting new people.,within an hour,100%,93%,FALSE,https://a2.muscache.com/im/pictures/8db103fb-ed4e-450a-a1d7-7372521cbc08.jpg?aki_policy=profile_small,https://a2.muscache.com/im/pictures/8db103fb-ed4e-450a-a1d7-7372521cbc08.jpg?aki_policy=profile_x_medium,Cambridge,4,4,"['email', 'phone', 'reviews']",TRUE,FALSE,"Western Avenue, Cambridge, MA 02139, United States",Cambridge,Allston,NA,Cambridge,MA,02139,Boston,"Cambridge, MA",US,United States,42.36535111564258,-71.11436298605044,TRUE,House,Entire home/apt,4,1,2,2,Real Bed,"{TV,""Wireless Internet"",""Air Conditioning"",Kitchen,""Free Parking on Premises"",Heating,Washer,Dryer,""Smoke Detector"",""Carbon Monoxide Detector"",Essentials,Shampoo,""24-Hour Check-in"",Hangers,""Hair Dryer"",Iron,""Laptop Friendly Workspace""}",NA,$240.00,NA,NA,NA,$60.00,2,$15.00,3,1125,yesterday,NA,30,60,90,180,2016-09-06,0,NA,NA,NA,NA,NA,NA,NA,NA,NA,FALSE,NA,NA,FALSE,strict,FALSE,FALSE,1,NA
14550228,https://www.airbnb.com/rooms/14550228,20160906204935,2016-09-07,Beautiful Room near MIT and Harvard,"Private room in top floor of a high-rise. Close to major highways and MIT, Whole Foods, Trader Joe, cafe, shops nearby. Central Square is within walking distance.","Top floor of a high-rise right next to the Charles river. MIT and BU are within a few miles as well as Whole Foods, Trader Joe. Walking-distance to Central Square. Close to and easy access to all major routes.","Private room in top floor of a high-rise. Close to major highways and MIT, Whole Foods, Trader Joe, cafe, shops nearby. Central Square is within walking distance. Top floor of a high-rise right next to the Charles river. MIT and BU are within a few miles as well as Whole Foods, Trader Joe. Walking-distance to Central Square. Close to and easy access to all major routes. You will have access to wi-fi, shared bathroom. The living spaces on the living room are available for guests to use as well. We have a lovely balcony which guests are welcomed to use. Kitchen access is unlimited. Diverse, friendly and beautiful neighborhood. Close to Cambridge Port and Central Square. The other side of the Charles river is Boston.",none,"Diverse, friendly and beautiful neighborhood. Close to Cambridge Port and Central Square. The other side of the Charles river is Boston.",NA,NA,"You will have access to wi-fi, shared bathroom. The living spaces on the living room are available for guests to use as well. We have a lovely balcony which guests are welcomed to use. Kitchen access is unlimited.",NA,NA,https://a2.muscache.com/im/pictures/31348d85-597b-4540-91de-0be7445bce82.jpg?aki_policy=small,https://a2.muscache.com/im/pictures/31348d85-597b-4540-91de-0be7445bce82.jpg?aki_policy=medium,https://a2.muscache.com/im/pictures/31348d85-597b-4540-91de-0be7445bce82.jpg?aki_policy=large,https://a2.muscache.com/im/pictures/31348d85-597b-4540-91de-0be7445bce82.jpg?aki_policy=x_large,90052719,https://www.airbnb.com/users/show/90052719,Pohl,2016-08-15,US,NA,within a day,100%,50%,FALSE,https://a2.muscache.com/im/pictures/24dde9fe-1cef-4dea-8086-5af67162d42c.jpg?aki_policy=profile_small,https://a2.muscache.com/im/pictures/24dde9fe-1cef-4dea-8086-5af67162d42c.jpg?aki_policy=profile_x_medium,Cambridge,1,1,"['email', 'phone']",TRUE,FALSE,"Memorial Drive, Cambridge, MA 02139, United States",Cambridge,Allston,NA,Cambridge,MA,02139,Boston,"Cambridge, MA",US,United States,42.359452846935326,-71.11368818159649,TRUE,Apartment,Private room,2,1,1,1,Real Bed,"{TV,""Cable TV"",Internet,""Wireless Internet"",""Air Conditioning"",Kitchen,""Elevator in Building"",""Buzzer/Wireless Intercom"",Heating,Washer,Dryer,""Smoke Detector"",""Carbon Monoxide Detector"",Essentials,Shampoo,Hangers,""Hair Dryer"",Iron,""Laptop Friendly Workspace""}",NA,$113.00,NA,NA,NA,$230.00,1,$0.00,5,1125,a week ago,NA,30,60,90,90,2016-09-06,0,NA,NA,NA,NA,NA,NA,NA,NA,NA,FALSE,NA,NA,FALSE,flexible,FALSE,FALSE,1,NA
14566657,https://www.airbnb.com/rooms/14566657,20160906204935,2016-09-07,Modern Loft North Point,"Enjoy a great stay in East Cambridge ( North Point). This loft is a modern living in a renovated building. North Point is a special place that offers exciting opportunities to my guests.Modern living in one of the hottest neighborhoods in Cambridge. This loft community sits in the heart of East Cambridge, close to the Charles River and MIT with easy access to the MBTA.",NA,"Enjoy a great stay in East Cambridge ( North Point). This loft is a modern living in a renovated building. North Point is a special place that offers exciting opportunities to my guests.Modern living in one of the hottest neighborhoods in Cambridge. This loft community sits in the heart of East Cambridge, close to the Charles River and MIT with easy access to the MBTA.",none,NA,NA,NA,NA,NA,NA,https://a2.muscache.com/im/pictures/7a77dfec-f1e5-4d1d-bfbd-81d6b56382e0.jpg?aki_policy=small,https://a2.muscache.com/im/pictures/7a77dfec-f1e5-4d1d-bfbd-81d6b56382e0.jpg?aki_policy=medium,https://a2.muscache.com/im/pictures/7a77dfec-f1e5-4d1d-bfbd-81d6b56382e0.jpg?aki_policy=large,https://a2.muscache.com/im/pictures/7a77dfec-f1e5-4d1d-bfbd-81d6b56382e0.jpg?aki_policy=x_large,36981635,https://www.airbnb.com/users/show/36981635,Patt,2015-06-28,"New York, New York, United States",I would like to describe myself as a very straight forward person who likes to take things in his stride in a very level headed manner. Life is quite exciting to me as it has galores of opportunities and experiences to offer and I feel one should always make the right use of it. I am adventurous by nature for I like to take up new challenges. It gives me the zeal and impetus to work towards excellence,within an hour,86%,99%,FALSE,https://a2.muscache.com/im/users/36981635/profile_pic/1435535431/original.jpg?aki_policy=profile_small,https://a2.muscache.com/im/users/36981635/profile_pic/1435535431/original.jpg?aki_policy=profile_x_medium,Cambridge,5,5,"['email', 'phone', 'reviews', 'jumio', 'kba']",TRUE,TRUE,"Glassworks Avenue, Cambridge, MA 02141, United States",Cambridge,West End,NA,Cambridge,MA,02141,Boston,"Cambridge, MA",US,United States,42.369265468665986,-71.072024224819,TRUE,Apartment,Entire home/apt,3,1,1,1,Real Bed,"{TV,""Wireless Internet"",""Air Conditioning"",Pool,Kitchen,""Free Parking on Premises"",""Pets Allowed"",Gym,""Elevator in Building"",Heating,""Family/Kid Friendly"",Washer,Dryer,""Smoke Detector"",""Carbon Monoxide Detector"",Essentials,Shampoo,Hangers,""Hair Dryer"",Iron,""Laptop Friendly Workspace""}",NA,$180.00,NA,NA,NA,NA,1,$0.00,1,1125,a week ago,NA,8,30,57,329,2016-09-06,1,2016-08-21,2016-08-21,60,6,6,6,4,8,6,FALSE,NA,NA,TRUE,moderate,FALSE,FALSE,2,1
14689681,https://www.airbnb.com/rooms/14689681,20160906204935,2016-09-07,Beautiful loft style bedroom with large bathroom,"You'd be living on the top floor of a four story townhouse.  High ceilings, luxurious own bathroom, walk-in closet, hardwood floors. Very spacious, bright, modern, quiet.  Excellent location: 12min walk to Harvard Square, 6 to Harvard Business School, 12 to Harvard Kennedy School, 8 to Central Sq, 15 to MIT. Three lovely and respectful housemates (late 20s/early 30s) would be sharing this house with you. My place is perfect for single/double occupancy. Longer-term occupants get a discount.",NA,"You'd be living on the top floor of a four story townhouse.  High ceilings, luxurious own bathroom, walk-in closet, hardwood floors. Very spacious, bright, modern, quiet.  Excellent location: 12min walk to Harvard Square, 6 to Harvard Business School, 12 to Harvard Kennedy School, 8 to Central Sq, 15 to MIT. Three lovely and respectful housemates (late 20s/early 30s) would be sharing this house with you. My place is perfect for single/double occupancy. Longer-term occupants get a discount.",none,NA,NA,NA,NA,NA,NA,https://a2.muscache.com/im/pictures/725a70f0-a4d1-471e-9d7d-6bbb6cc15994.jpg?aki_policy=small,https://a2.muscache.com/im/pictures/725a70f0-a4d1-471e-9d7d-6bbb6cc15994.jpg?aki_policy=medium,https://a2.muscache.com/im/pictures/725a70f0-a4d1-471e-9d7d-6bbb6cc15994.jpg?aki_policy=large,https://a2.muscache.com/im/pictures/725a70f0-a4d1-471e-9d7d-6bbb6cc15994.jpg?aki_policy=x_large,50546418,https://www.airbnb.com/users/show/50546418,Thomas,2015-12-04,"Somerville, Massachusetts, United States",NA,within a day,100%,100%,FALSE,https://a2.muscache.com/im/pictures/f44ebd43-82fa-4505-8b46-fda7e2a63bfe.jpg?aki_policy=profile_small,https://a2.muscache.com/im/pictures/f44ebd43-82fa-4505-8b46-fda7e2a63bfe.jpg?aki_policy=profile_x_medium,Cambridge,1,1,"['email', 'phone', 'reviews', 'jumio']",TRUE,TRUE,"Putnam Avenue, Cambridge, MA 02139, United States",Cambridge,Allston,NA,Cambridge,MA,02139,Boston,"Cambridge, MA",US,United States,42.365112317266274,-71.11480075951329,TRUE,House,Private room,2,1,1,1,Real Bed,"{""Air Conditioning"",Kitchen,""Indoor Fireplace"",Heating,Washer,Dryer,""Smoke Detector"",""Carbon Monoxide Detector"",Essentials,Hangers,""Hair Dryer"",Iron,""Laptop Friendly Workspace"",""translation missing: en.hosting_amenity_49"",""translation missing: en.hosting_amenity_50""}",NA,$124.00,NA,NA,$200.00,$85.00,1,$0.00,2,1125,2 weeks ago,NA,5,5,20,110,2016-09-06,0,NA,NA,NA,NA,NA,NA,NA,NA,NA,FALSE,NA,NA,FALSE,flexible,FALSE,FALSE,1,NA
