id,listing_url,scrape_id,last_scraped,name,summary,space,description,experiences_offered,neighborhood_overview,notes,transit,access,interaction,house_rules,thumbnail_url,medium_url,picture_url,xl_picture_url,host_id,host_url,host_name,host_since,host_location,host_about,host_response_time,host_response_rate,host_acceptance_rate,host_is_superhost,host_thumbnail_url,host_picture_url,host_neighbourhood,host_listings_count,host_total_listings_count,host_verifications,host_has_profile_pic,host_identity_verified,street,neighbourhood,neighbourhood_cleansed,neighbourhood_group_cleansed,city,state,zipcode,market,smart_location,country_code,country,latitude,longitude,is_location_exact,property_type,room_type,accommodates,bathrooms,bedrooms,beds,bed_type,amenities,square_feet,price,weekly_price,monthly_price,security_deposit,cleaning_fee,guests_included,extra_people,minimum_nights,maximum_nights,calendar_updated,has_availability,availability_30,availability_60,availability_90,availability_365,calendar_last_scraped,number_of_reviews,first_review,last_review,review_scores_rating,review_scores_accuracy,review_scores_cleanliness,review_scores_checkin,review_scores_communication,review_scores_location,review_scores_value,requires_license,license,jurisdiction_names,instant_bookable,cancellation_policy,require_guest_profile_picture,require_guest_phone_verification,calculated_host_listings_count,reviews_per_month
13064781,https://www.airbnb.com/rooms/13064781,20160906204935,2016-09-07,Navy Yard Loft,"My place is close to:  The USS Constitution The Old North End The TD Garden Bunker Hill Monument You’ll love my place because of the fabulous location! My place is good for couples, solo adventurers, business travelers, small groups and furry friends (pets).",NA,"My place is close to:  The USS Constitution The Old North End The TD Garden Bunker Hill Monument You’ll love my place because of the fabulous location! My place is good for couples, solo adventurers, business travelers, small groups and furry friends (pets).",none,NA,NA,NA,NA,NA,NA,NA,NA,https://a2.muscache.com/im/pictures/f2744748-3c14-49be-b9bd-23d7c6ecebe5.jpg?aki_policy=large,NA,22548550,https://www.airbnb.com/users/show/22548550,Kristen,2014-10-14,"Boston, Massachusetts, United States",NA,within a day,70%,70%,FALSE,https://a2.muscache.com/im/pictures/7e9cdfff-9871-496b-8b87-484a9a35eb36.jpg?aki_policy=profile_small,https://a2.muscache.com/im/pictures/7e9cdfff-9871-496b-8b87-484a9a35eb36.jpg?aki_policy=profile_x_medium,Charlestown,1,1,"['email', 'phone', 'reviews']",TRUE,FALSE,"1st Avenue, Boston, MA 02129, United States",Charlestown,Charlestown,NA,Boston,MA,02129,Boston,"Boston, MA",US,United States,42.377380676697406,-71.05041078672215,TRUE,Condominium,Entire home/apt,3,1,0,1,Real Bed,"{TV,Internet,""Wireless Internet"",""Air Conditioning"",Kitchen,""Pets Allowed"",Breakfast,""Elevator in Building"",Heating,Washer,Dryer,""Smoke Detector"",""Carbon Monoxide Detector"",""Fire Extinguisher"",Essentials,Shampoo,""24-Hour Check-in"",Hangers,""Hair Dryer"",Iron,""Laptop Friendly Workspace""}",NA,$150.00,NA,NA,NA,NA,1,$0.00,1,7,2 weeks ago,NA,3,11,19,109,2016-09-06,10,2016-05-31,2016-09-04,98,10,10,10,10,10,10,FALSE,NA,NA,FALSE,flexible,FALSE,FALSE,1,3
8454985,https://www.airbnb.com/rooms/8454985,20160906204935,2016-09-07,Modern Navy Yard Apartment,"Stay in a clean, modern, and charming two-bedroom apartment in the Charlestown Navy Yard. Minutes from Downtown Boston, the Freedom Trail, and Bunker Hill Monument. Perfect for vacations, business trips, academic conferences, and university visits.","A fully furnished modern apartment with plenty of space to relax and work. Living room has plenty of seating and comes with a 42 inch flatscreen and premium cable tv channels. Master bedroom furnished with latex mattress, topped with feather-bed topper. Second bedroom used normally as a reading room is furnished with a full size fold down futon, that can accommodate a second or third guest. Full kitchen with use of induction range, microwave, and fridge/freezer (basic cooking and dining needs provided). Laundry room on premises available for use. 150 megabit wireless internet connection is provided.","Stay in a clean, modern, and charming two-bedroom apartment in the Charlestown Navy Yard. Minutes from Downtown Boston, the Freedom Trail, and Bunker Hill Monument. Perfect for vacations, business trips, academic conferences, and university visits. A fully furnished modern apartment with plenty of space to relax and work. Living room has plenty of seating and comes with a 42 inch flatscreen and premium cable tv channels. Master bedroom furnished with latex mattress, topped with feather-bed topper. Second bedroom used normally as a reading room is furnished with a full size fold down futon, that can accommodate a second or third guest. Full kitchen with use of induction range, microwave, and fridge/freezer (basic cooking and dining needs provided). Laundry room on premises available for use. 150 megabit wireless internet connection is provided. Except for closets, all areas of the apartment are available for use. You have the apartment to yourselves! As longtime Boston residents, we wil",none,"Located in the safe and beautiful Charlestown Navy Yard, with water views of downtown, two blocks from the beginning of the Freedom Trail. Charlestown is the oldest neighborhood of Boston and is rich with history. The apartment is minutes away from historic sites like the Bunker Hill Monument, USS Constitution (oldest commissioned warship in the world), and Boston National Historic Park. The Navy Yard is fairly quiet at night, as there are no loud bars or clubs within two blocks of the building, but places to eat, shop, and visit are minutes away. Close access to the Spaulding Rehabilitation Hospital and Massachusetts General Hospital (MGH), Boston Logan Airport, New England Aquarium, TD Garden. Short commute to most major Boston area colleges and universities (Boston University, Harvard, MIT, Tufts Medical School, Mass General Hospital IHP, Suffolk, Simmons, Emmanuel)",The apartment is occupied when not rented as an Airbnb and we ask guests to respect our privacy by not going through room closets. We have set aside a large dresser for guest use and set aside part of the coat closet for items that need to be hung.,"Several public transportation options available. Free shuttle service every 15 minutes during weekdays / 30 minutes weekends to other parts of Boston. Several cafes and restaurants within walking distance. Free street parking at nights, paid parking garage available a block away. Ubers and lyfts usually arrive within five minutes and getting downtown takes less than ten minutes. Water taxi to and from Logan Airport ($10), water shuttle to the Aquarium and Long Wharf ($3).","Except for closets, all areas of the apartment are available for use.","You have the apartment to yourselves! As longtime Boston residents, we will be available for recommendations and suggestions for the area.","No loud music after 10pm. Absolutely no smoking or pets. If there is other evidence of smoking or pets in the property, you will forfeit your entire security deposit. Check in and check out time can be flexible depending upon the dates you are looking for and whether anyone else is staying. Unless we arrange otherwise, check in is after 4pm and check out is before noon. The cleaning fee covers two hours. If additional cleaning is required, you will be charged $50/hour, deducted from your deposit. No parties. If a neighbor complains about a party happening or loud music after 10pm, or if there is a big mess left at the place, you will forfeit your entire deposit. Your internet usage will be logged and monitored if you access a blacklisted site or ip range. Please don't abuse the connection speed by downloading illegal content while a guest. You agree to follow all of the rules of the building, which will be provided. Any issues with not following the building rules and you forfeit your",https://a2.muscache.com/im/pictures/107516373/671ea0d8_original.jpg?aki_policy=small,https://a2.muscache.com/im/pictures/107516373/671ea0d8_original.jpg?aki_policy=medium,https://a2.muscache.com/im/pictures/107516373/671ea0d8_original.jpg?aki_policy=large,https://a2.muscache.com/im/pictures/107516373/671ea0d8_original.jpg?aki_policy=x_large,15151322,https://www.airbnb.com/users/show/15151322,Jianmin,2014-05-05,"Boston, Massachusetts, United States","Out door exercise fan. Like to jogging, hiking, skiing, sailing and wind surfing. Also enjoy read books, chat with knowledge friends.",within a day,82%,100%,FALSE,https://a2.muscache.com/im/users/15151322/profile_pic/1439420116/original.jpg?aki_policy=profile_small,https://a2.muscache.com/im/users/15151322/profile_pic/1439420116/original.jpg?aki_policy=profile_x_medium,Newton,3,3,"['email', 'phone', 'reviews', 'kba']",TRUE,TRUE,"13th St, Charlestown, MA 02129, United States",Charlestown,Charlestown,NA,Charlestown,MA,02129,Boston,"Charlestown, MA",US,United States,42.376634352984695,-71.05237883372453,TRUE,Apartment,Entire home/apt,3,1,2,2,Real Bed,"{TV,""Cable TV"",Internet,""Wireless Internet"",""Air Conditioning"",Kitchen,""Elevator in Building"",""Buzzer/Wireless Intercom"",Heating,Washer,Dryer,""Smoke Detector"",""Carbon Monoxide Detector"",""First Aid Kit"",""Safety Card"",""Fire Extinguisher"",Essentials,Shampoo,""Hair Dryer"",Iron,""Laptop Friendly Workspace""}",NA,$225.00,NA,NA,$150.00,$50.00,3,$25.00,2,7,6 weeks ago,NA,10,40,70,160,2016-09-06,7,2015-09-21,2016-08-07,97,10,9,10,10,9,9,FALSE,NA,NA,FALSE,moderate,FALSE,FALSE,1,0.59
14769652,https://www.airbnb.com/rooms/14769652,20160906204935,2016-09-07,Townhouse in the Town Bedroom #2,"Our place is close to Sullivan Station, Charlestown Navy Yard, Bunkerhill Monument, Historical Freedom Trail, The Warren Tavern, Tavern at the End of the World, train and bus lines all around Boston.. You’ll love our place because of the neighborhood, the light, the comfy bed, the outdoors space, the afternoon light and open concept.. . Our place is good for couples, solo adventurers, business travelers, and families (with kids).",NA,"Our place is close to Sullivan Station, Charlestown Navy Yard, Bunkerhill Monument, Historical Freedom Trail, The Warren Tavern, Tavern at the End of the World, train and bus lines all around Boston.. You’ll love our place because of the neighborhood, the light, the comfy bed, the outdoors space, the afternoon light and open concept.. . Our place is good for couples, solo adventurers, business travelers, and families (with kids).",none,NA,NA,NA,NA,NA,"- - No houseguests outside of who is renting with us.  - You are welcome to use the kitchen and amenities, but we expect all guests to clean up after themselves - No parties of any kind.",https://a2.muscache.com/im/pictures/a21a06d5-5292-409b-9f63-fd7e73169ae8.jpg?aki_policy=small,https://a2.muscache.com/im/pictures/a21a06d5-5292-409b-9f63-fd7e73169ae8.jpg?aki_policy=medium,https://a2.muscache.com/im/pictures/a21a06d5-5292-409b-9f63-fd7e73169ae8.jpg?aki_policy=large,https://a2.muscache.com/im/pictures/a21a06d5-5292-409b-9f63-fd7e73169ae8.jpg?aki_policy=x_large,20733420,https://www.airbnb.com/users/show/20733420,Roger,2014-08-30,"Boston, Massachusetts, United States",NA,within a few hours,100%,100%,FALSE,https://a1.muscache.com/im/users/20733420/profile_pic/1409430593/original.jpg?aki_policy=profile_small,https://a1.muscache.com/im/users/20733420/profile_pic/1409430593/original.jpg?aki_policy=profile_x_medium,Charlestown,2,2,"['email', 'phone', 'reviews', 'jumio']",TRUE,TRUE,"Medford Street, Boston, MA 02129, United States",Charlestown,Charlestown,NA,Boston,MA,02129,Boston,"Boston, MA",US,United States,42.383704883765326,-71.06564446942193,TRUE,Townhouse,Private room,2,1.5,1,1,Real Bed,"{TV,""Wireless Internet"",""Air Conditioning"",Kitchen,""Free Parking on Premises"",Breakfast,""Indoor Fireplace"",Heating,""Family/Kid Friendly"",""Smoke Detector"",""Carbon Monoxide Detector"",""Fire Extinguisher"",Essentials,Shampoo,""Laptop Friendly Workspace"",""translation missing: en.hosting_amenity_50""}",NA,$160.00,NA,NA,NA,NA,1,$0.00,1,1125,1 week ago,NA,27,53,83,83,2016-09-06,0,NA,NA,NA,NA,NA,NA,NA,NA,NA,FALSE,NA,NA,FALSE,flexible,FALSE,FALSE,2,NA
77681,https://www.airbnb.com/rooms/77681,20160906204935,2016-09-07,Waterfall Room: Bunker Hill B&B,NA,"Elegant private suite, on its own floor with dressing room and full sized bed, jacuzzi bath, and access to a fabulous private deck. Furnished with antiques and includes a tv-vcr. Tempur-Pedic mattress. Pet friendly! Relaxing Breakfast Nook is a cozy and comfy eating area, it is adjacent to the patio with a gold fish pond.","Elegant private suite, on its own floor with dressing room and full sized bed, jacuzzi bath, and access to a fabulous private deck. Furnished with antiques and includes a tv-vcr. Tempur-Pedic mattress. Pet friendly! Relaxing Breakfast Nook is a cozy and comfy eating area, it is adjacent to the patio with a gold fish pond.",none,NA,NA,NA,NA,NA,"No candles, no smoking, no food in room, no private kitchen use.",https://a1.muscache.com/im/pictures/639949/96d3c990_original.jpg?aki_policy=small,https://a1.muscache.com/im/pictures/639949/96d3c990_original.jpg?aki_policy=medium,https://a1.muscache.com/im/pictures/639949/96d3c990_original.jpg?aki_policy=large,https://a1.muscache.com/im/pictures/639949/96d3c990_original.jpg?aki_policy=x_large,416912,https://www.airbnb.com/users/show/416912,Christiane,2011-03-01,"Boston, Massachusetts, United States","Christiane Wolff, the owner and hostess, is a former German teacher and former Army, Navy and US Coast Guard Reservist, who likes to offer weary travelers the same kindness and comforts that she received during her many travels.",within a few hours,80%,67%,FALSE,https://a0.muscache.com/im/users/416912/profile_pic/1299014356/original.jpg?aki_policy=profile_small,https://a0.muscache.com/im/users/416912/profile_pic/1299014356/original.jpg?aki_policy=profile_x_medium,Charlestown,2,2,"['email', 'phone', 'reviews']",TRUE,FALSE,"Elm St, Boston, MA 02129, United States",Charlestown,Charlestown,NA,Boston,MA,02129,Boston,"Boston, MA",US,United States,42.37853324504035,-71.06176887037248,TRUE,Bed & Breakfast,Private room,2,1,1,1,Real Bed,"{TV,""Wireless Internet"",""Air Conditioning"",Kitchen,""Pets Allowed"",Breakfast,""Hot Tub"",Heating,""Family/Kid Friendly"",Washer,Dryer}",NA,$160.00,NA,NA,NA,NA,1,$0.00,2,730,3 weeks ago,NA,30,58,88,363,2016-09-06,21,2011-09-19,2016-07-04,83,9,8,8,9,9,8,FALSE,NA,NA,FALSE,strict,FALSE,FALSE,2,0.35
4112178,https://www.airbnb.com/rooms/4112178,20160906204935,2016-09-07,Charlestown Brownstone,Land at Logan. Short ride to Charlestown. Walk everywhere. Small but comfy bedroom with bathroom.,NA,Land at Logan. Short ride to Charlestown. Walk everywhere. Small but comfy bedroom with bathroom.,none,NA,NA,NA,NA,NA,NA,https://a2.muscache.com/im/pictures/548e7a0e-fd3f-46d1-a58a-4305de9b72b1.jpg?aki_policy=small,https://a2.muscache.com/im/pictures/548e7a0e-fd3f-46d1-a58a-4305de9b72b1.jpg?aki_policy=medium,https://a2.muscache.com/im/pictures/548e7a0e-fd3f-46d1-a58a-4305de9b72b1.jpg?aki_policy=large,https://a2.muscache.com/im/pictures/548e7a0e-fd3f-46d1-a58a-4305de9b72b1.jpg?aki_policy=x_large,21336020,https://www.airbnb.com/users/show/21336020,El Has,2014-09-14,"Boston, Massachusetts, United States",NA,within an hour,100%,100%,FALSE,https://a2.muscache.com/im/pictures/afb5c508-6e35-4bb8-8f6f-c17456907cb4.jpg?aki_policy=profile_small,https://a2.muscache.com/im/pictures/afb5c508-6e35-4bb8-8f6f-c17456907cb4.jpg?aki_policy=profile_x_medium,Charlestown,1,1,"['email', 'phone', 'reviews']",TRUE,FALSE,"Auburn Street, Boston, MA 02129, United States",Charlestown,Charlestown,NA,Boston,MA,02129,Boston,"Boston, MA",US,United States,42.38037397683924,-71.06910599055006,TRUE,Condominium,Entire home/apt,1,1,0,1,Real Bed,"{TV,""Wireless Internet"",Kitchen,Breakfast,""Buzzer/Wireless Intercom"",Heating,Washer,Dryer,""Smoke Detector"",""Carbon Monoxide Detector"",""Fire Extinguisher"",Essentials,Shampoo,""Laptop Friendly Workspace"",""translation missing: en.hosting_amenity_49"",""translation missing: en.hosting_amenity_50""}",NA,$125.00,NA,NA,NA,$50.00,1,$0.00,1,3,6 weeks ago,NA,0,0,0,0,2016-09-06,1,2016-08-01,2016-08-01,100,10,10,10,10,10,10,FALSE,NA,NA,FALSE,flexible,FALSE,FALSE,1,0.79
5684598,https://www.airbnb.com/rooms/5684598,20160906204935,2016-09-07,Navy Yard Condo on the Water!,Urban Chic meets Historic Charlestown!  Newly Renovated Fully Furnished 1 bed/1 bath with open floor plan.,"Located in Bostons most desirable neighborhoods.  A great community that is safe and located minutes from Cambridge the North End and downtown Boston.  Newly renovated unit with Stainless Steel appliances, cable tv and high speed internet. Steps away is The Boston Harborwalk and located walking distance to a water taxi, and free Mass General Shuttle to North Station.","Urban Chic meets Historic Charlestown!  Newly Renovated Fully Furnished 1 bed/1 bath with open floor plan. Located in Bostons most desirable neighborhoods.  A great community that is safe and located minutes from Cambridge the North End and downtown Boston.  Newly renovated unit with Stainless Steel appliances, cable tv and high speed internet. Steps away is The Boston Harborwalk and located walking distance to a water taxi, and free Mass General Shuttle to North Station. The kitchen is of renovated and allows you to do a lot of cooking. There is a dishwasher, toaster, coffee maker, spices, salt and pepper, oil and kitchen utensils, and pots & pans. All of our kitchen supplies are available for your use.  The living room is a great place to kick back and relax. Enjoy some home-cooked food or takeout at our dinning table (seats 4). We also have a Flat-screen TV, DVD player for your entertainment.  Secure high-speed wireless internet is included.  Parking spot comes with the unit, Laundr",none,"Charlestown is the oldest neighborhood in Boston.  The Charlestown Navy Yard is a unique area, it was originally developed as a location to repair military ships and today retains a lot of the historic culture.  First-class restaurants and friendly coffee shops, wine bistros and waterfront taverns, all combine to create an array of delightful diversions.",The Constitution Inn which is a short walk away offers full gym and indoor pool for a small fee.,"Walking distance to ferry and MGH Shuttle.  Easy highway access to 93, Route 1, Storrow Drive or the Mass Pike 90. Quick drive to the new Assembly Row Marketplace shopping and restaurants.  Walk to Spaulding. Located walking distance to the USS Constitution.  The boat is the world's oldest commissioned naval vessel afloat and open for visitors year round.","The kitchen is of renovated and allows you to do a lot of cooking. There is a dishwasher, toaster, coffee maker, spices, salt and pepper, oil and kitchen utensils, and pots & pans. All of our kitchen supplies are available for your use.  The living room is a great place to kick back and relax. Enjoy some home-cooked food or takeout at our dinning table (seats 4). We also have a Flat-screen TV, DVD player for your entertainment.  Secure high-speed wireless internet is included.  Parking spot comes with the unit, Laundry facilities on the first floor.",As much as needed!,"I kindly ask that you not smoke in the apartment, the public areas outside the main entry doors. Pets are not allowed.",NA,NA,https://a0.muscache.com/im/pictures/70972632/19cfcc03_original.jpg?aki_policy=large,NA,29472153,https://www.airbnb.com/users/show/29472153,Kristin,2015-03-16,"Livingston, New Jersey, United States",My name is Kristin and I live by myself in a large apartment in Charlestown. I travel often for work and pleasure and my apartment is often left open. I would love for people to get to experience Charlestown like I do. I love my neighbors and our friendly community located in the Navy Yard is a great spot!  I promise you will fall in love with Charlestown and the great location of being on the water!,within a few hours,100%,0%,TRUE,https://a1.muscache.com/im/users/29472153/profile_pic/1426702777/original.jpg?aki_policy=profile_small,https://a1.muscache.com/im/users/29472153/profile_pic/1426702777/original.jpg?aki_policy=profile_x_medium,Charlestown,1,1,"['email', 'phone', 'reviews']",TRUE,FALSE,"1st Avenue, Boston, MA 02129, United States",Charlestown,Charlestown,NA,Boston,MA,02129,Boston,"Boston, MA",US,United States,42.37772359797676,-71.05132419433814,TRUE,Apartment,Entire home/apt,2,1,1,1,Real Bed,"{TV,""Cable TV"",Internet,""Wireless Internet"",""Air Conditioning"",Kitchen,""Free Parking on Premises"",""Elevator in Building"",""Buzzer/Wireless Intercom"",Heating,Washer,Dryer,""Smoke Detector"",""Carbon Monoxide Detector"",""First Aid Kit"",Essentials,Shampoo}",NA,$199.00,NA,NA,$100.00,$25.00,1,$0.00,1,1125,3 weeks ago,NA,0,0,0,248,2016-09-06,19,2015-04-26,2015-10-11,100,10,10,10,10,10,10,FALSE,NA,NA,FALSE,flexible,FALSE,FALSE,1,1.14
14924831,https://www.airbnb.com/rooms/14924831,20160906204935,2016-09-07,"New Construction Comfort, Easy To Get Everywhere","My place is close to Bunker Hill Monument, Freedom Trail, MGH, major Boston hospitals, Harvard U., Tufts U., other Boston schools, downtown, TD Bank Garden, other sports, concert and performing arts venues, MBTA bus stop, Sullivan Square T Station, excellent restaurants (seafood, Italian, Thai, Moroccan...), Whole Foods Market, shopping, movie theaters.. You’ll love my place because of the coziness, quietness and the location. My place is good for solo adventurers and business travelers.","Beautiful, recently constructed single family 3 bedroom home with hard- and landscaped patio in one of Boston's most desirable neighborhoods.  Walk, bus or T to just about anywhere.  The bus stop that drops and picks you up is at the end of the street, and the Orange line is a 5 minute walk just down the hill.    Professional, single owner occupies at all times ensuring a comfortable, attentive stay.  Very friendly, sociable cats do co-habit, though not in guest bedrooms. :)","My place is close to Bunker Hill Monument, Freedom Trail, MGH, major Boston hospitals, Harvard U., Tufts U., other Boston schools, downtown, TD Bank Garden, other sports, concert and performing arts venues, MBTA bus stop, Sullivan Square T Station, excellent restaurants (seafood, Italian, Thai, Moroccan...), Whole Foods Market, shopping, movie theaters.. You’ll love my place because of the coziness, quietness and the location. My place is good for solo adventurers and business travelers. Beautiful, recently constructed single family 3 bedroom home with hard- and landscaped patio in one of Boston's most desirable neighborhoods.  Walk, bus or T to just about anywhere.  The bus stop that drops and picks you up is at the end of the street, and the Orange line is a 5 minute walk just down the hill.    Professional, single owner occupies at all times ensuring a comfortable, attentive stay.  Very friendly, sociable cats do co-habit, though not in guest bedrooms. :) Enjoy a fully furnished bed",none,NA,"Street parking with resident sticker only is what's mostly available.  There is, however, a pay-lot located by about a 5 minute walk down the hill.",NA,"Enjoy a fully furnished bedroom, ample closet and drawer space, your own bathroom shared only with at most one other if another guest is also staying.  Light use of kitchen and refrigerator and common area are also available to you.","Professional owner who enjoys conversation and tips for getting around and exploring is also happy to hear about your experiences, adventures and finds.  Those who've stayed before have enjoyed the comforts of a home and proximity to all of Boston made easy by the easy-access to transportation.",- Quiet but sociable host who looks for the same in individual guests.  No guests of guests please.,https://a2.muscache.com/im/pictures/f53aac9c-a474-4bd8-a0ae-ba7a08b894f2.jpg?aki_policy=small,https://a2.muscache.com/im/pictures/f53aac9c-a474-4bd8-a0ae-ba7a08b894f2.jpg?aki_policy=medium,https://a2.muscache.com/im/pictures/f53aac9c-a474-4bd8-a0ae-ba7a08b894f2.jpg?aki_policy=large,https://a2.muscache.com/im/pictures/f53aac9c-a474-4bd8-a0ae-ba7a08b894f2.jpg?aki_policy=x_large,93820834,https://www.airbnb.com/users/show/93820834,Maria,2016-09-06,US,NA,N/A,N/A,N/A,FALSE,https://a2.muscache.com/im/pictures/0205bcd0-7b64-4fe8-8f3c-1c0b33366509.jpg?aki_policy=profile_small,https://a2.muscache.com/im/pictures/0205bcd0-7b64-4fe8-8f3c-1c0b33366509.jpg?aki_policy=profile_x_medium,Charlestown,1,1,['phone'],TRUE,FALSE,"R Saint Martin Street, Boston, MA 02129, United States",Charlestown,Charlestown,NA,Boston,MA,02129,Boston,"Boston, MA",US,United States,42.38192063033713,-71.06883693947871,TRUE,House,Private room,1,1,1,1,Real Bed,"{""Wireless Internet"",""Air Conditioning"",Kitchen,""Pets live on this property"",Heating,""Smoke Detector"",""Carbon Monoxide Detector"",""Fire Extinguisher"",Essentials,Hangers,Iron,""Laptop Friendly Workspace""}",NA,$190.00,NA,NA,NA,NA,1,$0.00,1,14,today,NA,6,36,66,66,2016-09-06,0,NA,NA,NA,NA,NA,NA,NA,NA,NA,FALSE,NA,NA,FALSE,moderate,FALSE,FALSE,1,NA
