13083342,https://www.airbnb.com/rooms/13083342,20160906204935,2016-09-07,Centrally Located Boston Townhome,"Charlestown is a neighborhood in Boston, right on the Freedom trail. Near many classic Boston sights, close to the center of the city, but also in a quiet, residential neighborhood, our home is the perfect place to vacation, relax, and adventure from. We've lived in Boston for over ten years, in several different neighborhoods, so are happy to give recommendations on things to do and see.","Single family townhome in the city, perfect for families. Playgrounds, pool, and green space nearby.","Charlestown is a neighborhood in Boston, right on the Freedom trail. Near many classic Boston sights, close to the center of the city, but also in a quiet, residential neighborhood, our home is the perfect place to vacation, relax, and adventure from. We've lived in Boston for over ten years, in several different neighborhoods, so are happy to give recommendations on things to do and see. Single family townhome in the city, perfect for families. Playgrounds, pool, and green space nearby. I'll be available by phone and email. Charlestown is a wonderful family-friendly neighborhood in Boston. Right on the freedom trail, it is walkable, bike-able, and accessible to public transportation and highways. Very close to public transportation (bus and subway). Parking is garage only - you don't need a car, unless you are leaving the city. Very walkable as well.",none,"Charlestown is a wonderful family-friendly neighborhood in Boston. Right on the freedom trail, it is walkable, bike-able, and accessible to public transportation and highways.",NA,"Very close to public transportation (bus and subway). Parking is garage only - you don't need a car, unless you are leaving the city. Very walkable as well.",NA,I'll be available by phone and email.,"No smoking or pets, please.",https://a2.muscache.com/im/pictures/6d7d4edc-cc02-4e1f-b045-6aa14348af31.jpg?aki_policy=small,https://a2.muscache.com/im/pictures/6d7d4edc-cc02-4e1f-b045-6aa14348af31.jpg?aki_policy=medium,https://a2.muscache.com/im/pictures/6d7d4edc-cc02-4e1f-b045-6aa14348af31.jpg?aki_policy=large,https://a2.muscache.com/im/pictures/6d7d4edc-cc02-4e1f-b045-6aa14348af31.jpg?aki_policy=x_large,48366914,https://www.airbnb.com/users/show/48366914,Rana,2015-11-06,"Massachusetts, United States",We've lived in Boston for twelve years. We know the city and the surrounding area well. We love talking to people about their travels and love making recommendations on things to see and do. Please ask!,within an hour,100%,100%,FALSE,https://a2.muscache.com/im/pictures/baa6df3a-9eeb-4ef6-8ff7-9acc289da556.jpg?aki_policy=profile_small,https://a2.muscache.com/im/pictures/baa6df3a-9eeb-4ef6-8ff7-9acc289da556.jpg?aki_policy=profile_x_medium,Charlestown,1,1,"['email', 'phone', 'facebook', 'reviews', 'kba']",TRUE,TRUE,"Cook Street, Boston, MA 02129, United States",Charlestown,Charlestown,NA,Boston,MA,02129,Boston,"Boston, MA",US,United States,42.38189202730521,-71.06485197027199,TRUE,House,Entire home/apt,6,2.5,3,3,Real Bed,"{TV,""Cable TV"",Internet,""Wireless Internet"",""Air Conditioning"",Kitchen,Heating,""Family/Kid Friendly"",Washer,Dryer,""Smoke Detector"",""Carbon Monoxide Detector"",Essentials,Shampoo,Hangers,""Hair Dryer"",Iron,""Laptop Friendly Workspace""}",NA,$250.00,NA,NA,"$1,000.00",$150.00,1,$0.00,1,1125,a week ago,NA,0,10,14,14,2016-09-06,0,NA,NA,NA,NA,NA,NA,NA,NA,NA,FALSE,NA,NA,FALSE,flexible,FALSE,FALSE,1,NA
13655073,https://www.airbnb.com/rooms/13655073,20160906204935,2016-09-07,Monument House Furnished Apartment M466,"My place is close to The Bunker Hill Monument, , Charlestown Navy Yard, Freedom Trail, Boston North End. You’ll love my place because of easy access to public transportation and tourist attractions.. My place is good for couples, solo adventurers, business travelers, and families (with kids).","1 BEDROOM, 1 BATH APARTMENT Near the famed Bunker Hill Monument on the Freedom Trail sits this cozy, lower-level apartment that offers privacy and convenience in an 1870's Victorian townhouse. The fully-furnished apartment has a private entry, a queen bed, a fully equipped Pullman kitchen, and a small living room with a queen sleep sofa and TV. Ideal for the budget-conscious traveler, the apartment sits below the main house, 3 steps below grade with full windows.  There is a lovely, spacious private patio for your enjoyment (the host walks through on occasion, to get from her parking spot to the apartment but it is otherwise completely private); the perfect place to enjoy an outdoor meal or relax with a book.  The unit is situated on a quiet street in the center of historic Charlestown (Boston’s original center), with quaint New England city streets and wonderful proximity to tourist attractions. You can take the ferry to Long Wharf and the Aquarium near Faneuil Hall and Quincy Market,","My place is close to The Bunker Hill Monument, , Charlestown Navy Yard, Freedom Trail, Boston North End. You’ll love my place because of easy access to public transportation and tourist attractions.. My place is good for couples, solo adventurers, business travelers, and families (with kids). 1 BEDROOM, 1 BATH APARTMENT Near the famed Bunker Hill Monument on the Freedom Trail sits this cozy, lower-level apartment that offers privacy and convenience in an 1870's Victorian townhouse. The fully-furnished apartment has a private entry, a queen bed, a fully equipped Pullman kitchen, and a small living room with a queen sleep sofa and TV. Ideal for the budget-conscious traveler, the apartment sits below the main house, 3 steps below grade with full windows.  There is a lovely, spacious private patio for your enjoyment (the host walks through on occasion, to get from her parking spot to the apartment but it is otherwise completely private); the perfect place to enjoy an outdoor meal or relax",none,NA,NA,8 minute walk to subway. 6 minute walk to Water shuttle at Navy yard runs every 15 minutes to Aquarium. Free shuttle from MGH Health Center on High Street to MGH runs 9:OO AM to 2:20 PM. Walk over bridge to Green line subway at North Station or Orange line subway at Haymarket in North End.  ea has a studio in the south end. Makes fabric jewelry.,NA,NA,- Residential home.  Quiet is important.,https://a2.muscache.com/im/pictures/f122588c-4718-49ee-b236-aeeb34d52967.jpg?aki_policy=small,https://a2.muscache.com/im/pictures/f122588c-4718-49ee-b236-aeeb34d52967.jpg?aki_policy=medium,https://a2.muscache.com/im/pictures/f122588c-4718-49ee-b236-aeeb34d52967.jpg?aki_policy=large,https://a2.muscache.com/im/pictures/f122588c-4718-49ee-b236-aeeb34d52967.jpg?aki_policy=x_large,32532791,https://www.airbnb.com/users/show/32532791,Marie,2015-05-03,"Boston, Massachusetts, United States","I am the owner of a small local and reputable company representing accommodations in Metro Boston since 1981 and long-standing members of the Greater Boston Convention and Visitors Bureau, Massachusetts Lodging Association and Professional Association of Innkeepers International. We own, manage and work closely with each property owner to ensure that they meet safety standards, are well maintained, clean and in desirable locations, giving you comfort in knowing there are no scams and meeting your expectations.  Our team at Bed and Breakfast Associates Bay Colony have detailed knowledge of the accommodations and locations. We encourage phone conversations, give personal attention to each inquiry, and are totally committed to providing each guest with exceptional quality, value and customer service.",within an hour,100%,91%,FALSE,https://a2.muscache.com/im/users/32532791/profile_pic/1430696380/original.jpg?aki_policy=profile_small,https://a2.muscache.com/im/users/32532791/profile_pic/1430696380/original.jpg?aki_policy=profile_x_medium,Medford,37,37,"['email', 'phone', 'reviews']",TRUE,FALSE,"Cordis Street, Boston, MA 02129, United States",Charlestown,Charlestown,NA,Boston,MA,02129,Boston,"Boston, MA",US,United States,42.37423370980447,-71.06215495192623,TRUE,Apartment,Entire home/apt,4,1,1,2,Real Bed,"{TV,""Cable TV"",Internet,""Wireless Internet"",""Air Conditioning"",Kitchen,""Pets live on this property"",Cat(s),Heating,""Family/Kid Friendly"",""Smoke Detector"",""Carbon Monoxide Detector"",""Fire Extinguisher"",Essentials,Hangers,""Hair Dryer"",Iron,""Laptop Friendly Workspace""}",NA,$150.00,NA,NA,NA,$25.00,2,$25.00,3,1125,today,NA,4,4,4,146,2016-09-06,1,2016-07-20,2016-07-20,100,10,10,10,10,10,10,FALSE,NA,NA,FALSE,strict,FALSE,FALSE,20,0.6
14858782,https://www.airbnb.com/rooms/14858782,20160906204935,2016-09-07,Comfortable room near Subway 14-2c,"My place is close to Sullivan Square Station. You’ll love my place because of the outdoors space, the light, the comfy bed, the kitchen, and the neighborhood. My place is good for business travelers.",NA,"My place is close to Sullivan Square Station. You’ll love my place because of the outdoors space, the light, the comfy bed, the kitchen, and the neighborhood. My place is good for business travelers.",none,NA,NA,NA,NA,NA,"- cleaning, quiet, friendly, no drug, no smoking,",https://a2.muscache.com/im/pictures/13e900be-c176-4e52-969b-8f0fb48e9702.jpg?aki_policy=small,https://a2.muscache.com/im/pictures/13e900be-c176-4e52-969b-8f0fb48e9702.jpg?aki_policy=medium,https://a2.muscache.com/im/pictures/13e900be-c176-4e52-969b-8f0fb48e9702.jpg?aki_policy=large,https://a2.muscache.com/im/pictures/13e900be-c176-4e52-969b-8f0fb48e9702.jpg?aki_policy=x_large,38092410,https://www.airbnb.com/users/show/38092410,Ketai,2015-07-10,US,NA,within a few hours,96%,99%,FALSE,https://a1.muscache.com/im/users/38092410/profile_pic/1440292258/original.jpg?aki_policy=profile_small,https://a1.muscache.com/im/users/38092410/profile_pic/1440292258/original.jpg?aki_policy=profile_x_medium,Somerville,14,14,"['email', 'phone', 'reviews']",TRUE,FALSE,"Brighton Street, Boston, MA 02129, United States",Charlestown,Charlestown,NA,Boston,MA,02129,Boston,"Boston, MA",US,United States,42.38453396653739,-71.07807747994607,TRUE,House,Private room,1,1,1,1,Real Bed,"{""Wireless Internet"",""Air Conditioning"",Kitchen,""Free Parking on Premises"",Heating,Washer,Dryer,Essentials,Hangers,""Laptop Friendly Workspace"",""translation missing: en.hosting_amenity_49"",""translation missing: en.hosting_amenity_50""}",NA,$50.00,NA,NA,NA,NA,1,$0.00,1,1125,5 days ago,NA,5,35,65,340,2016-09-06,0,NA,NA,NA,NA,NA,NA,NA,NA,NA,FALSE,NA,NA,TRUE,flexible,FALSE,FALSE,3,NA
13032590,https://www.airbnb.com/rooms/13032590,20160906204935,2016-09-07,3 bedroom apartment next to T stop,"This is a large 3 bedroom apartment with new kitchen and bath next to Sullivan Station, 3 min walk to T and bus hub.  Only 10 min to Boston. Easy access to Harvard, MIT, Assembly Square shops and restaurants, and Route 93. Parking for 1 car available. The house is very conveniently located close to the city but also exposed to traffic noise.","This apartment is on two top levels of a beautiful house. There is a renovated fully equipped kitchen, new bathroom, dining room, spacious living room, and bedroom on the first level and spiral staircase leading to 2 additional bedrooms upstairs.","This is a large 3 bedroom apartment with new kitchen and bath next to Sullivan Station, 3 min walk to T and bus hub.  Only 10 min to Boston. Easy access to Harvard, MIT, Assembly Square shops and restaurants, and Route 93. Parking for 1 car available. The house is very conveniently located close to the city but also exposed to traffic noise. This apartment is on two top levels of a beautiful house. There is a renovated fully equipped kitchen, new bathroom, dining room, spacious living room, and bedroom on the first level and spiral staircase leading to 2 additional bedrooms upstairs. There is keypad lock at the main entrance, and at the entrance to your apartment at a top of a staircase leading to the apartment. You will receive a 4 digit pass code to enter. The keyless entry would allow you to check-in and out at any time. You would have the entire apartment to your disposal. You would be able to reach me by email, text, and phone. This is a busy urban neighborhood next to a T stop an",none,"This is a busy urban neighborhood next to a T stop and  us hub. It is a very convenient location which allows you to easily get to the most important places in Boston and Cambridge. There is Dunkin Donuts just a block away, Asian House restaurant, ATM, and a Tavern. If you take Orange line outbound, the next stop is Assembly Square-you will find a large variety of stores, coffee shops, and restaurants in there.",There is also another apartment below so I would ask to be considerate of people staying in there.,"You should be able to get to the apartment from Logan Airport in around 35 minutes by using public transportation. Take a shuttle bus to Airport Subway Station. Take Blue line inbound (direction Bowdoin) to State Street (3 stops-about 6 minutes ride), transfer to Orange line outbound (direction Oak Grove) to Sullivan Square (4 stops -about 7 min). It's only about 10 min   drive from/to the airport. Uber shows $9-12 cost.  If you are driving here from the north or south of Boston, take exit 28 from Route I-93 towards Charlestown/Sullivan Square/Assembly Square, merge onto MA-38 S, take a ramp on the left to Charlestown, Boston, Sullivan Square. Turn right onto Cambridge Street, it's the second house on the right side. If you drive from West of Boston take Mass Pike (Route 90) to exit 24 A-B-C for Interstate 93 N, keep right at the fork to continue to Exit 24B towards I-93N, take exit 28 from Route I-93 towards Charlestown/Sullivan Square/Assembly Square, merge onto MA-38 S, take a ramp","There is keypad lock at the main entrance, and at the entrance to your apartment at a top of a staircase leading to the apartment. You will receive a 4 digit pass code to enter. The keyless entry would allow you to check-in and out at any time.","You would have the entire apartment to your disposal. You would be able to reach me by email, text, and phone.","No smoking anywhere on the property is allowed including hallway, back porch, and driveway. Please take your shoes once you enter the apartment.",https://a2.muscache.com/im/pictures/5a993547-2385-4a3f-a638-aa45cac1a9bf.jpg?aki_policy=small,https://a2.muscache.com/im/pictures/5a993547-2385-4a3f-a638-aa45cac1a9bf.jpg?aki_policy=medium,https://a2.muscache.com/im/pictures/5a993547-2385-4a3f-a638-aa45cac1a9bf.jpg?aki_policy=large,https://a2.muscache.com/im/pictures/5a993547-2385-4a3f-a638-aa45cac1a9bf.jpg?aki_policy=x_large,21745230,https://www.airbnb.com/users/show/21745230,Jurek,2014-09-24,"Medford, Massachusetts, United States","I'm a musician. I was born in Poland but I have been living in Boston for the last 25 years. I travelled extensively all over Europe and some other places around the world. My favorite destinations include Southern France, Croatia, and Cape Cod. I love swimming, hiking, biking, reading, and listening to jazz and classical music.",within an hour,100%,89%,TRUE,https://a1.muscache.com/im/users/21745230/profile_pic/1439558479/original.jpg?aki_policy=profile_small,https://a1.muscache.com/im/users/21745230/profile_pic/1439558479/original.jpg?aki_policy=profile_x_medium,Cambridge,10,10,"['email', 'phone', 'reviews', 'jumio']",TRUE,TRUE,"Cambridge Street, Boston, MA 02129, United States",Charlestown,Charlestown,NA,Boston,MA,02129,Boston,"Boston, MA",US,United States,42.3826927598642,-71.07809993795176,TRUE,Apartment,Entire home/apt,6,1,3,3,Real Bed,"{Internet,""Wireless Internet"",""Air Conditioning"",Kitchen,""Free Parking on Premises"",Heating,""Suitable for Events"",Washer,Dryer,Essentials,Shampoo,""24-Hour Check-in"",Hangers,""Laptop Friendly Workspace""}",NA,$195.00,NA,NA,NA,$35.00,1,$0.00,1,1125,yesterday,NA,6,19,47,322,2016-09-06,18,2016-06-27,2016-09-03,96,10,10,10,10,9,9,FALSE,NA,NA,FALSE,flexible,FALSE,FALSE,4,7.4
2660908,https://www.airbnb.com/rooms/2660908,20160906204935,2016-09-07,$99 Historic Charm Walk to Subway,"This one bedroom home with cosy decor includes a nice outside patio area and is only 10 minutes to the subway, providing access to Logan Airport, the surrounding suburbs and all areas of Boston.","Situated in the residential Boston neighborhood of Charlestown, Urban Vacation Homes, the leader in short term, corporate and vacation housing in Boston, offers this one bedroom, one bathroom home, located on Belmont Street, which features modern upgrades and authentic New England charm. A great alternative to expensive hotels, this fully furnished home includes all the necessities and allows guests the ability to experience the city as a true Bostonian.  The bedroom is furnished with a queen size bed and includes a memory foam mattress for added comfort, a full size dresser, upright chest and offers plenty of closet space. The kitchen is fully outfitted with dishes, silverware, tupperware, wine glasses, kettle and all the required items to prepare a family meal after a long day of shopping and touring the city. The outside patio area includes a patio set with umbrella and six chairs, great for hosting family and friends or enjoying a soothing cup of coffee or glass of wine. All proper","This one bedroom home with cosy decor includes a nice outside patio area and is only 10 minutes to the subway, providing access to Logan Airport, the surrounding suburbs and all areas of Boston.  Situated in the residential Boston neighborhood of Charlestown, Urban Vacation Homes, the leader in short term, corporate and vacation housing in Boston, offers this one bedroom, one bathroom home, located on Belmont Street, which features modern upgrades and authentic New England charm. A great alternative to expensive hotels, this fully furnished home includes all the necessities and allows guests the ability to experience the city as a true Bostonian.  The bedroom is furnished with a queen size bed and includes a memory foam mattress for added comfort, a full size dresser, upright chest and offers plenty of closet space. The kitchen is fully outfitted with dishes, silverware, tupperware, wine glasses, kettle and all the required items to prepare a family meal after a long day of shopping an",none,"The walkable neighborhood is host to local parks, including the Bunker Hill Monument, grocery stores, coffee shops, cafes, bistros and other small eateries.","If you are traveling with children we offer baby equipment rentals including baby cribs, pack n plays, high chairs, strollers and more, which can be delivered and setup prior to your arrival.","Walkable to several MBTA lines serving logan airport, all of boston and the surrounding suburbs. Only two stops to downtown this home provides great transportation options and is a short distance to shopping and nightlife.",Guests will have full access to the entire apartment. Feel at home when staying with Urban Vacation Homes.,"All homes in the Urban Vacation Homes portfolio are equipped with automatic lock boxes, which allow our guests the ability to ""self-check in"". This makes it easy for guests arriving late in the evening and are unable to make arrangements to visit our office during business hours.",NA,https://a0.muscache.com/im/pictures/41065308/848a6115_original.jpg?aki_policy=small,https://a0.muscache.com/im/pictures/41065308/848a6115_original.jpg?aki_policy=medium,https://a0.muscache.com/im/pictures/41065308/848a6115_original.jpg?aki_policy=large,https://a0.muscache.com/im/pictures/41065308/848a6115_original.jpg?aki_policy=x_large,3594203,https://www.airbnb.com/users/show/3594203,Shawn,2012-09-17,"Boston, Massachusetts, United States","My name is Shawn and I've enjoyed hosting guests from all over the world since 2012. I'm a news junkie, foodie and love reading. I was born and raised in Orlando, but moved to Boston three years ago. I absolutely love Boston and all it has to offer. From the culture, great culinary treats, to the many open spaces and historic sites. My second home is Fort Lauderdale and Vieques, PR. Can you say warm weather! 

I spend most of my day running my small property management company which specializes in vacation rental and corporate housing management. Does your Airbnb take up too much of your time? Want to put it on autopilot? Shoot me a message, we would love to help :)

Feel free to reach out with any questions. I try to respond as quickly as time allows and am always available for my guests! 

Happy Booking!",within an hour,100%,99%,FALSE,https://a2.muscache.com/im/pictures/8fd8ad92-5f37-4f23-9ef2-eca692f7ad47.jpg?aki_policy=profile_small,https://a2.muscache.com/im/pictures/8fd8ad92-5f37-4f23-9ef2-eca692f7ad47.jpg?aki_policy=profile_x_medium,Cambridge,20,20,"['email', 'phone', 'facebook', 'reviews', 'jumio']",TRUE,TRUE,"Belmont Street, Boston, MA 02129, United States",Charlestown,Charlestown,NA,Boston,MA,02129,Boston,"Boston, MA",US,United States,42.3822680618921,-71.06583593948567,TRUE,Apartment,Entire home/apt,4,1,1,1,Real Bed,"{TV,""Cable TV"",Internet,""Wireless Internet"",""Air Conditioning"",Kitchen,""Pets Allowed"",Heating,""Family/Kid Friendly"",Washer,Dryer,Essentials}",NA,$99.00,NA,"$3,600.00",NA,$99.00,1,$0.00,1,1125,today,NA,1,1,1,1,2016-09-06,15,2014-06-12,2014-08-19,95,9,9,10,10,9,9,FALSE,NA,NA,FALSE,strict,FALSE,FALSE,8,0.55
9132081,https://www.airbnb.com/rooms/9132081,20160906204935,2016-09-07,"Quaint, charming  brownstone","This 2 bedroom, 1 bath brownstone is complete with all the decor you would expect in Boston's historic Charlestown neighborhood. It includes a wood stove, exposed brick and beams - perfect for a cozy winter stay! A 5 minute walk to the orange line T.",NA,"This 2 bedroom, 1 bath brownstone is complete with all the decor you would expect in Boston's historic Charlestown neighborhood. It includes a wood stove, exposed brick and beams - perfect for a cozy winter stay! A 5 minute walk to the orange line T.",none,NA,NA,NA,NA,NA,NA,https://a2.muscache.com/im/pictures/b2124329-6098-42c4-af0e-ca4aea576208.jpg?aki_policy=small,https://a2.muscache.com/im/pictures/b2124329-6098-42c4-af0e-ca4aea576208.jpg?aki_policy=medium,https://a2.muscache.com/im/pictures/b2124329-6098-42c4-af0e-ca4aea576208.jpg?aki_policy=large,https://a2.muscache.com/im/pictures/b2124329-6098-42c4-af0e-ca4aea576208.jpg?aki_policy=x_large,47565180,https://www.airbnb.com/users/show/47565180,Jillian,2015-10-27,US,NA,N/A,N/A,N/A,FALSE,https://a2.muscache.com/im/pictures/9c42c7b5-a730-4a20-a0d4-0af880bbfcf0.jpg?aki_policy=profile_small,https://a2.muscache.com/im/pictures/9c42c7b5-a730-4a20-a0d4-0af880bbfcf0.jpg?aki_policy=profile_x_medium,Charlestown,1,1,"['email', 'phone']",TRUE,FALSE,"Main Street, Boston, MA 02129, United States",Charlestown,Charlestown,NA,Boston,MA,02129,Boston,"Boston, MA",US,United States,42.377009231895215,-71.06573513787451,TRUE,Condominium,Entire home/apt,6,1,2,2,Real Bed,"{TV,Internet,""Wireless Internet"",Kitchen,Heating,Washer,Dryer,""Smoke Detector"",""Carbon Monoxide Detector"",Essentials,""24-Hour Check-in""}",NA,$158.00,NA,NA,NA,$75.00,1,$0.00,2,1125,10 months ago,NA,0,0,0,0,2016-09-06,0,NA,NA,NA,NA,NA,NA,NA,NA,NA,FALSE,NA,NA,FALSE,flexible,FALSE,FALSE,1,NA
