1658983,https://www.airbnb.com/rooms/1658983,20160906204935,2016-09-07,Walk Downtown! Freedom Trail Studio,"Adorable & affordable 1 bedroom/1 bathroom private studio apartment steps from the Freedom Trail & Monument Square!  Cozy, clean, well-equipped, and in an amazing location, this is the perfect spot to explore  Boston for a short or long-term stay!","Adorable & affordable 1 bedroom/1 bathroom private studio apartment steps from the Freedom Trail & Monument Square!  Cozy, clean, well-equipped, and in an amazing location, this is the perfect spot to explore  Boston for a short or long-term stay!  Brand new hardwood floors and newly upgraded bathroom tile make the unit extra modern and clean. Quaint one bedroom private basement apartment one block from Monument Square!!  Direct entrance from street.  Small kitchen with oven & full-sized refrigerator, good-sized living/dining area, full bathroom, and open bedroom with window.  Space for additional air mattress (queen or twin) - $50/additional person charge for AeroBed & linens. Amazing location blocks from public transit! DISCLAIMER: Apartment is a basement suite accessed through a small door (shown in exterior photo at bottom right) and it has low ceilings in parts...if you are over 6' and have trouble ducking, this is probably not the apartment for you :)","Adorable & affordable 1 bedroom/1 bathroom private studio apartment steps from the Freedom Trail & Monument Square!  Cozy, clean, well-equipped, and in an amazing location, this is the perfect spot to explore  Boston for a short or long-term stay! Adorable & affordable 1 bedroom/1 bathroom private studio apartment steps from the Freedom Trail & Monument Square!  Cozy, clean, well-equipped, and in an amazing location, this is the perfect spot to explore  Boston for a short or long-term stay!  Brand new hardwood floors and newly upgraded bathroom tile make the unit extra modern and clean. Quaint one bedroom private basement apartment one block from Monument Square!!  Direct entrance from street.  Small kitchen with oven & full-sized refrigerator, good-sized living/dining area, full bathroom, and open bedroom with window.  Space for additional air mattress (queen or twin) - $50/additional person charge for AeroBed & linens. Amazing location blocks from public transit! DISCLAIMER: Apartmen",none,NA,NA,"Very convenient public transit. 5-7 minute walk to the orange line, and a number of buses are a block away on Bunker Hill Street.  15 minute walk downtown to the North End! Very convenient public transit. Commute anywhere in the city!",NA,Nate & I live upstairs in the main house and will be available to show you around the area as you wish!,NA,https://a1.muscache.com/im/pictures/73397432/017d7265_original.jpg?aki_policy=small,https://a1.muscache.com/im/pictures/73397432/017d7265_original.jpg?aki_policy=medium,https://a1.muscache.com/im/pictures/73397432/017d7265_original.jpg?aki_policy=large,https://a1.muscache.com/im/pictures/73397432/017d7265_original.jpg?aki_policy=x_large,8792144,https://www.airbnb.com/users/show/8792144,Rachel,2013-09-12,"Boston, Massachusetts, United States","Originally from Boston (Rachel) & Portland, ME (Nate), we live upstairs from the unit, and have quickly fallen in love with Charlestown and all it has to offer!  We are here for any questions you might have :)",within a day,100%,100%,TRUE,https://a2.muscache.com/im/pictures/f38cbb7c-919a-40ad-aa67-295df5fe6941.jpg?aki_policy=profile_small,https://a2.muscache.com/im/pictures/f38cbb7c-919a-40ad-aa67-295df5fe6941.jpg?aki_policy=profile_x_medium,Charlestown,1,1,"['email', 'phone', 'facebook', 'reviews', 'kba']",TRUE,TRUE,"Cross Street, Boston, MA 02129, United States",Charlestown,Charlestown,NA,Boston,MA,02129,Boston,"Boston, MA",US,United States,42.377855421674845,-71.0627970924799,TRUE,Apartment,Entire home/apt,3,1,1,1,Real Bed,"{TV,""Cable TV"",Internet,""Wireless Internet"",""Air Conditioning"",Kitchen,Heating,""Smoke Detector"",""Carbon Monoxide Detector"",""First Aid Kit"",""Safety Card"",""Fire Extinguisher"",Essentials,Shampoo,""24-Hour Check-in"",Hangers,""Hair Dryer"",""translation missing: en.hosting_amenity_49"",""translation missing: en.hosting_amenity_50""}",NA,$155.00,$800.00,"$1,685.00",NA,NA,2,$50.00,2,1125,today,NA,0,8,18,235,2016-09-06,46,2013-09-26,2016-08-10,96,10,10,10,10,10,10,FALSE,NA,NA,FALSE,strict,FALSE,FALSE,1,1.28
6000531,https://www.airbnb.com/rooms/6000531,20160906204935,2016-09-07,1 BR Brownstone Freedom Trail,"Located right on Main Street in the beautiful, historic gaslight district of Charlestown, this second floor 1 BR apartment is 1 block from Freedom Trail. This is an amazing, walkable location with tree-lined streets and brownstone buildings. Access to public transport and short walk to North End.","Building built in 1880, exposed brick interior with 12 ft. ceilings, new kitchen, old historic charm. No smoking. Pet friendly. The photos show the old decor and furniture, new furniture has replaced the old, and the space is more open, basic, and simple.","Located right on Main Street in the beautiful, historic gaslight district of Charlestown, this second floor 1 BR apartment is 1 block from Freedom Trail. This is an amazing, walkable location with tree-lined streets and brownstone buildings. Access to public transport and short walk to North End. Building built in 1880, exposed brick interior with 12 ft. ceilings, new kitchen, old historic charm. No smoking. Pet friendly. The photos show the old decor and furniture, new furniture has replaced the old, and the space is more open, basic, and simple. Access to the entire apartment. Hosts will not be present. Beautiful tree-lined, gas-light district, brick sidewalks, 1 block from freedom trail.  Incredibly walkable location with access to bikesharing (Hubway) service - three portals nearby.  View of Bunker hill Monument from adjacent sidewalk, coffee shop across street. 0.4 mi to Community College Subway station 0.7 mi to North Station (orange, green, commuter lines, and trains to Maine/NY",none,"Beautiful tree-lined, gas-light district, brick sidewalks, 1 block from freedom trail.  Incredibly walkable location with access to bikesharing (Hubway) service - three portals nearby.  View of Bunker hill Monument from adjacent sidewalk, coffee shop across street.",0.2 mi to Wholefoods Grocery Store 0.7 mi to TD Garden 0.6 mi to North End 1 Block from historic Warren Tavern,"0.4 mi to Community College Subway station 0.7 mi to North Station (orange, green, commuter lines, and trains to Maine/NYC) 0.6 mi to Charlestown Navy Yard Station (Boat public transport)",Access to the entire apartment.,Hosts will not be present.,Owners live in the building so please be respectful - no parties.  No smoking is permitted in the building.,https://a1.muscache.com/im/pictures/74744674/6407753e_original.jpg?aki_policy=small,https://a1.muscache.com/im/pictures/74744674/6407753e_original.jpg?aki_policy=medium,https://a1.muscache.com/im/pictures/74744674/6407753e_original.jpg?aki_policy=large,https://a1.muscache.com/im/pictures/74744674/6407753e_original.jpg?aki_policy=x_large,1446735,https://www.airbnb.com/users/show/1446735,Mike,2011-11-27,"Boston, Massachusetts, United States","Hello!

My name is Mike, I live and work in Boston. I grew up in Vermont, but I absolutely love Boston - great neighborhoods, food, parks, beer, people, history, science, and sports.  

As a host, I'm very hands-off, as that's my style of traveling - but do not hesitate to reach out if you need anything!",within a few hours,100%,100%,FALSE,https://a1.muscache.com/im/users/1446735/profile_pic/1428073802/original.jpg?aki_policy=profile_small,https://a1.muscache.com/im/users/1446735/profile_pic/1428073802/original.jpg?aki_policy=profile_x_medium,Charlestown,1,1,"['email', 'phone', 'reviews', 'kba']",TRUE,TRUE,"Main Street, Boston, MA 02129, United States",Charlestown,Charlestown,NA,Boston,MA,02129,Boston,"Boston, MA",US,United States,42.37415674756017,-71.06202512836366,TRUE,Apartment,Entire home/apt,3,1,1,2,Real Bed,"{TV,Internet,""Wireless Internet"",Kitchen,""Pets Allowed"",Heating,""Family/Kid Friendly"",""Smoke Detector"",""Carbon Monoxide Detector"",Essentials,""24-Hour Check-in""}",NA,$249.00,NA,NA,NA,NA,4,$0.00,2,1125,today,NA,8,8,8,8,2016-09-06,4,2015-06-17,2016-08-12,100,10,10,10,10,10,10,FALSE,NA,NA,FALSE,strict,FALSE,FALSE,1,0.27
13586128,https://www.airbnb.com/rooms/13586128,20160906204935,2016-09-07,Charlestown Penthouse 3 bedroom/ 2 baths,"Penthouse three bed, two bath duplex with panoramic views of historic Boston skyline.","Penthouse three bed, two bath duplex with sweeping views of Charlestown, Boston Harbor and Downtown. This floor through unit is newly finished, situated on a quiet street. The apartment has two levels and comprises the 3rd and 4th floors of the building. Each of the three bedrooms has a queen size bed with linens, pillows and blankets included. The kitchen is fully-equipped with appliances, including a dishwasher, full size refrigerator, as well as pots, pans and cooking utensils for those who prefer cooking at home. There is a 39″ flat screen TV with local channels located in the cozy living room.  All rental units are equipped with wireless internet, iron, ironing board, hair dryer, coffee maker, tea kettle, toaster, microwave, linens and towels, as well as a guest book with instructions and recommendations.","Penthouse three bed, two bath duplex with panoramic views of historic Boston skyline. Penthouse three bed, two bath duplex with sweeping views of Charlestown, Boston Harbor and Downtown. This floor through unit is newly finished, situated on a quiet street. The apartment has two levels and comprises the 3rd and 4th floors of the building. Each of the three bedrooms has a queen size bed with linens, pillows and blankets included. The kitchen is fully-equipped with appliances, including a dishwasher, full size refrigerator, as well as pots, pans and cooking utensils for those who prefer cooking at home. There is a 39″ flat screen TV with local channels located in the cozy living room.  All rental units are equipped with wireless internet, iron, ironing board, hair dryer, coffee maker, tea kettle, toaster, microwave, linens and towels, as well as a guest book with instructions and recommendations. We have prepared for your stay so that it requires little interaction with us. Charlestown i",none,"Charlestown is truly a residential neighborhood with quiet, tree-lined streets and historic squares and monuments. Yet its residents enjoy convenient and easy access to many services within a short walk, as well as downtown Boston and Cambridge via public transit.",This unit is accessed using stairs (there is no elevator) and is a 3rd floor walk-up. There is no parking available. There is a parking garage located about 5 – 7 mins away at the FlagShip Wharf Parking Garage.,This location offers easy access to Downtown Boston by foot or public transit and to Cambridge via bus and subway. The nearest subway stop is 20 minute taxi ride.,NA,We have prepared for your stay so that it requires little interaction with us.,NA,https://a2.muscache.com/im/pictures/6e8e6278-0f2f-44c6-b18b-c380c10c5bcf.jpg?aki_policy=small,https://a2.muscache.com/im/pictures/6e8e6278-0f2f-44c6-b18b-c380c10c5bcf.jpg?aki_policy=medium,https://a2.muscache.com/im/pictures/6e8e6278-0f2f-44c6-b18b-c380c10c5bcf.jpg?aki_policy=large,https://a2.muscache.com/im/pictures/6e8e6278-0f2f-44c6-b18b-c380c10c5bcf.jpg?aki_policy=x_large,1444340,https://www.airbnb.com/users/show/1444340,Will,2011-11-26,"Boston, Massachusetts, United States","Originally from Los Angeles, my wife and I have now been in Boston for 9 years.",within a day,98%,68%,FALSE,https://a1.muscache.com/im/users/1444340/profile_pic/1322330190/original.jpg?aki_policy=profile_small,https://a1.muscache.com/im/users/1444340/profile_pic/1322330190/original.jpg?aki_policy=profile_x_medium,Roxbury,24,24,"['email', 'phone', 'reviews', 'kba']",TRUE,TRUE,"Mount Vernon Street, Boston, MA 02129, United States",Charlestown,Charlestown,NA,Boston,MA,02129,Boston,"Boston, MA",US,United States,42.37465423256758,-71.05771053837672,TRUE,Apartment,Entire home/apt,6,2,3,3,Real Bed,"{TV,""Wireless Internet"",""Air Conditioning"",Kitchen,Heating,""Family/Kid Friendly"",Washer,Dryer,""Smoke Detector"",""Carbon Monoxide Detector"",Hangers,""Hair Dryer"",Iron,""Laptop Friendly Workspace""}",NA,$315.00,NA,NA,$500.00,$125.00,1,$0.00,2,90,3 weeks ago,NA,11,32,57,332,2016-09-06,1,2016-07-16,2016-07-16,100,10,10,10,10,10,10,FALSE,NA,NA,FALSE,strict,FALSE,FALSE,24,0.56
9900315,https://www.airbnb.com/rooms/9900315,20160906204935,2016-09-07,Uncommon Place (free parking!),"Welcome to my home in the beautiful, historic, gas-lit district of Boston's famous Charlestown neighborhood. It is a quiet retreat with PARKING steps away from the freedom trail, TD garden, and the North End. Please NOTE: If you are booking from Aug 21-Sept 3, I am mid-kitchen renovation and the floor and countertops in the kitchen will be plywood. I have discounted the price to offset the inconvenience. Can provide photos. Still a fantastic place in a great location!!","Please note: My condo is currently being renovated (the photos reflect the current state of the work). I live here during the reno so I promise it's clean/safe, but I want to make sure you know what's happening! The apartment has 12' ceilings and plenty of light- is big and open and on a lovely park.. with your own designated parking space in a small lot right behind the building.  There is one queen bed in the bedroom, and a full airmattress can be made available if needed.  Right on the Freedom trail. 2 minute walk to Bunker Hill, 5 min to the USS Constitution. 8-10 min walk to the MBTA Green and Orange lines. Right on the 93 bus that takes you to central Boston (Haymarket/Downtown Crossing). 5 minute walk to Whole Foods/CVS.  Please email with any questions- this is a new listing so will add more details as the place gets finished!","Welcome to my home in the beautiful, historic, gas-lit district of Boston's famous Charlestown neighborhood. It is a quiet retreat with PARKING steps away from the freedom trail, TD garden, and the North End. Please NOTE: If you are booking from Aug 21-Sept 3, I am mid-kitchen renovation and the floor and countertops in the kitchen will be plywood. I have discounted the price to offset the inconvenience. Can provide photos. Still a fantastic place in a great location!! Please note: My condo is currently being renovated (the photos reflect the current state of the work). I live here during the reno so I promise it's clean/safe, but I want to make sure you know what's happening! The apartment has 12' ceilings and plenty of light- is big and open and on a lovely park.. with your own designated parking space in a small lot right behind the building.  There is one queen bed in the bedroom, and a full airmattress can be made available if needed.  Right on the Freedom trail. 2 minute walk to",none,NA,NA,Less than 10 min walk to the Orange and Green lines at North Station or the Orange line at Community College station.,NA,"I'll be renting my apartment while I'm away on business or personal vacations, so you will be on your own, but I will always be available by phone or email.",Please treat my home as you would your own.,NA,NA,https://a2.muscache.com/im/pictures/d065856a-a1d7-48fe-88fa-fdb3a7fb3dac.jpg?aki_policy=large,NA,724846,https://www.airbnb.com/users/show/724846,Kelly,2011-06-20,"Boston, Massachusetts, United States","30yo female designer. live in boston, work at MIT. love soul/jazz music, working out, watching sports, any excuse to be creative, meeting new people and exploring new places.",within a few hours,100%,48%,FALSE,https://a2.muscache.com/im/pictures/da919504-7979-4e7b-ab74-491dee54586a.jpg?aki_policy=profile_small,https://a2.muscache.com/im/pictures/da919504-7979-4e7b-ab74-491dee54586a.jpg?aki_policy=profile_x_medium,Charlestown,1,1,"['email', 'phone', 'reviews', 'jumio', 'kba']",TRUE,TRUE,"Common Street, Boston, MA 02129, United States",Charlestown,Charlestown,NA,Boston,MA,02129,Boston,"Boston, MA",US,United States,42.373949253367385,-71.06128123238629,TRUE,Apartment,Entire home/apt,4,1,1,1,Real Bed,"{Internet,""Wireless Internet"",""Air Conditioning"",Kitchen,""Free Parking on Premises"",Breakfast,""Family/Kid Friendly"",Washer,Dryer,""Smoke Detector"",""Carbon Monoxide Detector"",""First Aid Kit"",""Safety Card"",Essentials,Shampoo,""24-Hour Check-in"",Hangers,""Hair Dryer"",Iron,""Laptop Friendly Workspace""}",NA,$150.00,NA,NA,NA,$20.00,2,$20.00,2,1125,today,NA,0,1,5,17,2016-09-06,11,2016-03-17,2016-08-31,91,9,9,10,10,10,10,FALSE,NA,NA,FALSE,moderate,FALSE,FALSE,1,1.89
8189821,https://www.airbnb.com/rooms/8189821,20160906204935,2016-09-07,Extra Bedroom in Charlestown Apt,"Extra Room in a 2 bedroom apartment in Charlestown a 1/2 block from the Bunker Hill Monument.  Bedroom with a view of the monument, a queen bed and your own private bathroom.",Beautiful quiet neighborhood near Boston's historic Bunker Hill Monument,"Extra Room in a 2 bedroom apartment in Charlestown a 1/2 block from the Bunker Hill Monument.  Bedroom with a view of the monument, a queen bed and your own private bathroom. Beautiful quiet neighborhood near Boston's historic Bunker Hill Monument As often as you want. Will leave you be or welcome you for a beer and the game Bus to downtown crossing only 2 minutes away. Orange line to any part of the city a 7-8 minute walk. Also walking distance to North End (15 min), the Boston Common (25 min) and Downtown Crossing (30 min)",none,NA,NA,"Bus to downtown crossing only 2 minutes away. Orange line to any part of the city a 7-8 minute walk. Also walking distance to North End (15 min), the Boston Common (25 min) and Downtown Crossing (30 min)",NA,As often as you want. Will leave you be or welcome you for a beer and the game,NA,https://a0.muscache.com/im/pictures/104258188/44575331_original.jpg?aki_policy=small,https://a0.muscache.com/im/pictures/104258188/44575331_original.jpg?aki_policy=medium,https://a0.muscache.com/im/pictures/104258188/44575331_original.jpg?aki_policy=large,https://a0.muscache.com/im/pictures/104258188/44575331_original.jpg?aki_policy=x_large,7723209,https://www.airbnb.com/users/show/7723209,Taylor,2013-07-25,"Boston, Massachusetts, United States",NA,within a few hours,100%,0%,FALSE,https://a0.muscache.com/im/users/7723209/profile_pic/1374779935/original.jpg?aki_policy=profile_small,https://a0.muscache.com/im/users/7723209/profile_pic/1374779935/original.jpg?aki_policy=profile_x_medium,Charlestown,1,1,"['email', 'phone', 'reviews']",TRUE,FALSE,"Soley Street, Boston, MA 02129, United States",Charlestown,Charlestown,NA,Boston,MA,02129,Boston,"Boston, MA",US,United States,42.375882834949905,-71.05973714889127,TRUE,Apartment,Private room,2,1,1,1,Real Bed,"{TV,""Cable TV"",Internet,""Wireless Internet"",""Air Conditioning"",Kitchen,""Pets live on this property"",Dog(s),""Indoor Fireplace"",""Buzzer/Wireless Intercom"",""Smoke Detector"",""Carbon Monoxide Detector"",""Safety Card"",""Fire Extinguisher"",Shampoo}",NA,$200.00,NA,NA,NA,NA,1,$0.00,1,1125,2 months ago,NA,0,0,0,0,2016-09-06,2,2015-09-17,2015-10-16,100,10,10,10,10,10,10,FALSE,NA,NA,FALSE,flexible,FALSE,FALSE,1,0.17
1445064,https://www.airbnb.com/rooms/1445064,20160906204935,2016-09-07,Sunny Quaint Bedroom in Condo,"BEDROOM ONLY AVAILABLE FOR 31+ DAYS (No exceptions, unfortunately!) My sunny bright apartment is just 3 blocks from Bunker Hill Monument, and 1.6 miles from downtown Boston / financial district.","MY LISTING IS ONLY AVAILABLE FOR 31+ DAYS IN A ROW. Unfortunately, NO Exceptions. Therefore monthly rates apply, then discounted daily rates. Rates are negotiable. This quaint, sunny, freshly painted bedroom is located within a 2 bedroom condominium which was built in 1875, and located on a quiet residential street, just 3 short blocks from Bunker Hill Monument in historic Charlestown -- which is right on the Freedom Trail, and home of the Bunker Hill Monument! The bedroom is furnished with a new twin daybed, fresh linens, an antique desk; as well as wireless internet [also throughout the condo]. The kitchen and bath are located on the same floor, and a light cold breakfast will be offered if you choose; coffee, espresso, hot tea or hot chocolate.  Charlestown is a little over 1 mile from the downtown financial district of Boston. Boston Logan Airport is a quick 12 minutes away; and South Station, where the trains and buses come in, is just 3 miles away.  I am a gracious hostess in eve","BEDROOM ONLY AVAILABLE FOR 31+ DAYS (No exceptions, unfortunately!) My sunny bright apartment is just 3 blocks from Bunker Hill Monument, and 1.6 miles from downtown Boston / financial district. MY LISTING IS ONLY AVAILABLE FOR 31+ DAYS IN A ROW. Unfortunately, NO Exceptions. Therefore monthly rates apply, then discounted daily rates. Rates are negotiable. This quaint, sunny, freshly painted bedroom is located within a 2 bedroom condominium which was built in 1875, and located on a quiet residential street, just 3 short blocks from Bunker Hill Monument in historic Charlestown -- which is right on the Freedom Trail, and home of the Bunker Hill Monument! The bedroom is furnished with a new twin daybed, fresh linens, an antique desk; as well as wireless internet [also throughout the condo]. The kitchen and bath are located on the same floor, and a light cold breakfast will be offered if you choose; coffee, espresso, hot tea or hot chocolate.  Charlestown is a little over 1 mile from the d",none,"We have lovely neighbors, friendly merchants and the community around in which I live, as well as our brick sidewalks, pretty colored houses, apartments and condos. And there's always a dog that is being walked if you like the 4-legged creatures as well.",You are more than welcomed to keep meals and liquids in the refrigerator.,"At the corner of Bunker Hill Street and School Street is the #93 bus that routes you down Bunker Hill St., around the monument and through to the downtown Boston.  On the corner of School and Main Street is the #92 bus that routes you down Main Street, also through downtown Boston. To get to the Orange Train Line: Walk straight down Mystic St cross over Bunker Hill Street, then down School St.  Make a left onto Main St., and a right onto Austin Street (at the traffic light). The walk is just 4 blocks from my apartment.  Please be mindful if walking to my apartment from the Orange Line that it is *mostly UP hill*.","Guest will have access to outdoor deck, if he or she chooses.",NA,"I have 2 very friendly pet rabbits. Those with allergies to rabbits (and often cats) are not recommended to stay here. No recreational drug use allowed. No smoking in or around the unit, or it's entry/exit ways, including the deck.  Check-out / check-in will be discussed once accepted as a guest. Guest will have their own alarm code.",NA,NA,https://a2.muscache.com/im/pictures/22179687/1822d69a_original.jpg?aki_policy=large,NA,4724006,https://www.airbnb.com/users/show/4724006,Rosalia,2013-01-16,"Boston, Massachusetts, United States","Hi and welcome to my humble home! I am Rosalia, a young professional and part-time yoga teacher. I have lived in Boston for 15 years and love entertaining visitors from near and far.

I am an easy going person -- in my home, at work, and even when I travel. Yoga is my real passion.

I consider myself a foodie being the daughter of a retired executive chef, so I am happy to recommend any type of restaurant during your stay in Boston. It is one of my specialties! My neighborhood now has a Whole Foods Market, just 3 blocks away from my house. 

Also residing in my apartment is BlackJack21 (he goes by Jack these days) and Cooper. Jack is a  12-year old Dutch rabbit and Cooper is a 8 month old black Mini Rex rabbit. Both are friendly and currently live in 2 separate cages in the apartment. (Cooper likes to be held, Jack does not.) Eventually I will take them to a rabbit bounder so that they can hang out together in a more friendly manner. 

My two favorite cities are London and San Francisco, and I would move to either in a heartbeat --if I could take my pet rabbits with me!",within a few hours,100%,100%,TRUE,https://a2.muscache.com/im/users/4724006/profile_pic/1375243206/original.jpg?aki_policy=profile_small,https://a2.muscache.com/im/users/4724006/profile_pic/1375243206/original.jpg?aki_policy=profile_x_medium,Charlestown,1,1,"['email', 'phone', 'reviews', 'jumio']",TRUE,TRUE,"Mystic Street, Boston, MA 02129, United States",Charlestown,Charlestown,NA,Boston,MA,02129,Boston,"Boston, MA",US,United States,42.379633029456244,-71.06191588184478,TRUE,Condominium,Private room,1,1,1,1,Real Bed,"{TV,Internet,""Wireless Internet"",""Air Conditioning"",Kitchen,""Pets live on this property"",""Other pet(s)"",""Buzzer/Wireless Intercom"",Heating,Washer,Dryer,""Smoke Detector"",""Carbon Monoxide Detector"",""First Aid Kit"",""Fire Extinguisher"",Essentials,Shampoo,""Lock on Bedroom Door"",""24-Hour Check-in"",Hangers,""Hair Dryer"",Iron,""Laptop Friendly Workspace""}",NA,$49.00,NA,NA,NA,$120.00,1,$0.00,32,130,2 weeks ago,NA,0,0,0,250,2016-09-06,73,2013-09-05,2016-04-25,95,10,10,9,10,9,9,FALSE,NA,NA,FALSE,moderate,TRUE,TRUE,1,1.99
