93505,https://www.airbnb.com/rooms/93505,20160906204935,2016-09-07,Spacious Victorian 2br+ apartment,1875 era Victoran Style home in historic Charlestown. Just a few blocks from the Bunker Hill Monument  and a ten minute walk to the USS Constitution.  A short walk over the bridge to the North End (great Italian food).  Then a short walk  intown.,"*To eliminate any confusion. This home was built in 1875. I've tried to keep as much of the home's original character as possible. If you are seeking modern accommodations, you may be better served looking elsewhere. ( it is an older home and I try and  keep its  character. Also space is for maximum of FOUR guests. 5-room comfortable and spacious (OVER 500  SQUARE FEET) apartment, on second floor of three story home. with authentic lovely Victorian architecture in historic Boston. Convenient to downtown and the  historic Freedom Trail, which is a few. Locks away. Just a few blocks from the historic Bunker Hill Monument, and a short walk to the USS(Navy Yard) Constitution. Queen sized bed in master bedroom. A full bed in the smaller, second bedroom. ..Elegant living room, a remodeled(2013) bathroom with an antique, claw foot tub, used as a shower. Linens provided. Kitchenette was remodeled in the fall of 2013. Newer flat screen TV. Internet access. ,  . Easily sleeps four people. Owner","1875 era Victoran Style home in historic Charlestown. Just a few blocks from the Bunker Hill Monument  and a ten minute walk to the USS Constitution.  A short walk over the bridge to the North End (great Italian food).  Then a short walk  intown. *To eliminate any confusion. This home was built in 1875. I've tried to keep as much of the home's original character as possible. If you are seeking modern accommodations, you may be better served looking elsewhere. ( it is an older home and I try and  keep its  character. Also space is for maximum of FOUR guests. 5-room comfortable and spacious (OVER 500  SQUARE FEET) apartment, on second floor of three story home. with authentic lovely Victorian architecture in historic Boston. Convenient to downtown and the  historic Freedom Trail, which is a few. Locks away. Just a few blocks from the historic Bunker Hill Monument, and a short walk to the USS(Navy Yard) Constitution. Queen sized bed in master bedroom. A full bed in the smaller, second bed",none,The neighborhood is a mix of life long Townies and many newer residents. A good mix.,This is my home and I'm hoping that when you're here it becomes your home.,"Yes, the Community College T' stop is about a 8-10 minute walk from the home. You can catch the train and you're only two stops from downtown. There's also a bus at either end of the street that will take you in town.",The second floor is your space.,"I try , if at all possible to be here when you arrive and answer any questions you might have.  I live on the third floor and I'm in and out.  I do not enter the bedroom area only if there is an emergency. I do check the kitchenette and bathroom to empty trash and tidy up.","Check in time is 3pm. Check out is 11am. . Please call or text me if you are delayed in traffic..if you're travelling from the south towards  Boston, expecially Friday afternoon. prepare for delays. *No smoking. Also, please do not smoke on door stoop in front of the house. The smoke makes its way into neighbors window. Also do not throw ciggarette butts into neighbors stairwell. If you need to have a smoke please take a walk.. thanks...  *Please keep noise to minimum after 10 in the evening. *Please refrain from taking showers after 11pm. Please be considerate of those residing below you. *Apartment space is to be used by registered guests only. *No yelling out windows to people in street or in cars. This is a home not a frat house. *Please be considerate of others residing in the home during your stay. No pets Thank you...Joe",https://a0.muscache.com/im/pictures/33683464/6aa15c1f_original.jpg?aki_policy=small,https://a0.muscache.com/im/pictures/33683464/6aa15c1f_original.jpg?aki_policy=medium,https://a0.muscache.com/im/pictures/33683464/6aa15c1f_original.jpg?aki_policy=large,https://a0.muscache.com/im/pictures/33683464/6aa15c1f_original.jpg?aki_policy=x_large,501427,https://www.airbnb.com/users/show/501427,Joe,2011-04-11,"Boston, Massachusetts, United States","Renaissance Man. Suffolk University. Bunker Hill Community College. Roslindale High School Parkway Little League.

I was born in Charlestown. Lived on Bunker Hill Street till I was three years old. Moved to another section of the city known as West Roxbury, where I grew up. Have been back here at 39 Green Street since 2000. This house was the home to Michael and Emily O'Brien(,Cork and Kilarney) my mother's(Rita) parents. I've been to Europe on two different occassions and visited, Berlin, Paris, Amsterdamn, and Naples, in Italy, the birthpace of my fathers'(Blasé) parents, Maria and Giaccommo. I enjoy hosting travellers form all over the world. It's intersting, educational and I receive great pleasure from meeting and conversing with all the different people. I enjoy creative writing, reading, movies and many artistic endeavors.  Love the Red Sox and the other Boston sports teams. Love Italian food.. Don't be afraid to share. I'm more than willing to listen..
Joe",within an hour,100%,91%,FALSE,https://a0.muscache.com/im/users/501427/profile_pic/1366841971/original.jpg?aki_policy=profile_small,https://a0.muscache.com/im/users/501427/profile_pic/1366841971/original.jpg?aki_policy=profile_x_medium,Charlestown,2,2,"['email', 'phone', 'facebook', 'reviews', 'kba']",TRUE,TRUE,"Green St, Boston, MA 02129, United States",Charlestown,Charlestown,NA,Boston,MA,02129,Boston,"Boston, MA",US,United States,42.3775788524057,-71.0637641154371,TRUE,Apartment,Entire home/apt,4,1,2,2,Real Bed,"{TV,Internet,""Wireless Internet"",""Air Conditioning"",Heating,""Family/Kid Friendly"",""Smoke Detector"",""Carbon Monoxide Detector""}",NA,$199.00,NA,NA,NA,NA,0,$0.00,3,365,2 months ago,NA,11,23,23,269,2016-09-06,166,2011-05-22,2016-09-03,94,9,9,10,10,10,9,FALSE,NA,NA,FALSE,strict,TRUE,TRUE,2,2.57
3721095,https://www.airbnb.com/rooms/3721095,20160906204935,2016-09-07,"Unique 3 Bed, 2 Bath Apartment","Beautiful 1400 sq' apartment with 3 bedrooms, all with queen beds, and 2 bathrooms.  working fireplace, custom built bar , wine fridge, and deck.  private washer and dryer.  Special original 1800's townhouse. Two night minimum on week ends, holidays.","This apartment has a lot of its original architectural character while maintaining an updated, eclectic feel.","Beautiful 1400 sq' apartment with 3 bedrooms, all with queen beds, and 2 bathrooms.  working fireplace, custom built bar , wine fridge, and deck.  private washer and dryer.  Special original 1800's townhouse. Two night minimum on week ends, holidays. This apartment has a lot of its original architectural character while maintaining an updated, eclectic feel. The guests have exclusive access to the entire unit, as well as the deck off of the top floor and the private washer and dryer. Charlestown has all the great traits of a neighborhood while still being located in the city. This apartment is a 5-10 minute walk from a variety of amenities such as restaurants and bars, parks, and other historical sites. There is a bus stop at the top of the street which will take you down town in 10 minutes. There is also an Orange Line train stop within walking distance, as well as a Hubway station. The airport is a 5-10 minute cab ride away.",none,"Charlestown has all the great traits of a neighborhood while still being located in the city. This apartment is a 5-10 minute walk from a variety of amenities such as restaurants and bars, parks, and other historical sites.",NA,"There is a bus stop at the top of the street which will take you down town in 10 minutes. There is also an Orange Line train stop within walking distance, as well as a Hubway station. The airport is a 5-10 minute cab ride away.","The guests have exclusive access to the entire unit, as well as the deck off of the top floor and the private washer and dryer.",NA,NA,https://a1.muscache.com/im/pictures/46847112/7733a9ae_original.jpg?aki_policy=small,https://a1.muscache.com/im/pictures/46847112/7733a9ae_original.jpg?aki_policy=medium,https://a1.muscache.com/im/pictures/46847112/7733a9ae_original.jpg?aki_policy=large,https://a1.muscache.com/im/pictures/46847112/7733a9ae_original.jpg?aki_policy=x_large,10477638,https://www.airbnb.com/users/show/10477638,Robert,2013-12-06,"Massachusetts, United States",NA,within an hour,90%,100%,TRUE,https://a0.muscache.com/im/users/10477638/profile_pic/1406989397/original.jpg?aki_policy=profile_small,https://a0.muscache.com/im/users/10477638/profile_pic/1406989397/original.jpg?aki_policy=profile_x_medium,Charlestown,1,1,"['email', 'phone', 'reviews', 'kba']",TRUE,TRUE,"Mystic Street, Charlestown, MA 02129, United States",Charlestown,Charlestown,NA,Charlestown,MA,02129,Boston,"Charlestown, MA",US,United States,42.38134840856283,-71.06190760557617,TRUE,Apartment,Entire home/apt,6,2,3,3,Real Bed,"{TV,""Cable TV"",Internet,""Wireless Internet"",""Air Conditioning"",Kitchen,Breakfast,""Indoor Fireplace"",Heating,Washer,Dryer,""Smoke Detector"",""Carbon Monoxide Detector"",""First Aid Kit"",""Fire Extinguisher"",Essentials,Shampoo,""translation missing: en.hosting_amenity_49"",""translation missing: en.hosting_amenity_50""}",NA,$375.00,"$2,275.00","$7,500.00",$500.00,$80.00,1,$0.00,2,1125,3 days ago,NA,9,20,47,313,2016-09-06,98,2014-08-16,2016-08-19,99,10,10,10,10,9,10,FALSE,NA,NA,TRUE,moderate,FALSE,FALSE,1,3.9
44205,https://www.airbnb.com/rooms/44205,20160906204935,2016-09-07,Elegance at Salem Street Court,NA,"Romantic, comfortable, and elegant! Enjoy the hospitality and warmth of a home with luxury amenities for your relaxation and wellness: 3-room luxury suite with authentic European and Asian furnishings and fine art, in the beautifully-renovated & historic Thomas Osgood House close to Freedom Trail, downtown, and TD Garden in Boston's oldest neighborhood. Cathedral ceilings, hand-hewn beams, skylights throughout--fresh flowers, luxurious & romantic space! Large bedroom with king sleigh feather bed and ultimately soft modal cotton linens.  Elegant and cozy living room with leather sofas, oriental carpet, books, fireplace and French doors opening onto balcony with bistro table; overlooking historic courtyard garden with fountain and gas lamp. Meditation alcove.  Firewood available upon request. Grand European-style bath with oversized tub set below sklylight view to stars! Artisan soaps hand-crafted and organic. Delight your senses with romance, spa, massage, and packages available upon re","Romantic, comfortable, and elegant! Enjoy the hospitality and warmth of a home with luxury amenities for your relaxation and wellness: 3-room luxury suite with authentic European and Asian furnishings and fine art, in the beautifully-renovated & historic Thomas Osgood House close to Freedom Trail, downtown, and TD Garden in Boston's oldest neighborhood. Cathedral ceilings, hand-hewn beams, skylights throughout--fresh flowers, luxurious & romantic space! Large bedroom with king sleigh feather bed and ultimately soft modal cotton linens.  Elegant and cozy living room with leather sofas, oriental carpet, books, fireplace and French doors opening onto balcony with bistro table; overlooking historic courtyard garden with fountain and gas lamp. Meditation alcove.  Firewood available upon request. Grand European-style bath with oversized tub set below sklylight view to stars! Artisan soaps hand-crafted and organic. Delight your senses with romance, spa, massage, and packages available upon re",none,NA,NA,NA,"A beautiful 3-room suite, balcony overlooking a courtyard garden, and a peaceful garden with a fountain.",NA,"Feedback is welcome--please let us know how we can improve your experience! Check in is 4-8 p.m. Early and late check-ins are possible, but must be requested in advance and are subject to availability.  Check out time is 11 a.m. Late check-out is possible upon request in advance subject to availability. Regretfully, the suite is not appropriate for children and we cannot accommodate them. Regretfully, for health and safety reasons, there is no smoking on the property. Regretfully, we cannot accommodate guest pets  14 days' cancellation notice or full charge for stay.  If you check out before the end of your reserved stay, the full amount of your stay will be charged.",https://a1.muscache.com/im/pictures/618426/4a904e8d_original.jpg?aki_policy=small,https://a1.muscache.com/im/pictures/618426/4a904e8d_original.jpg?aki_policy=medium,https://a1.muscache.com/im/pictures/618426/4a904e8d_original.jpg?aki_policy=large,https://a1.muscache.com/im/pictures/618426/4a904e8d_original.jpg?aki_policy=x_large,128280,https://www.airbnb.com/users/show/128280,Elizabeth,2010-05-19,"Boston, Massachusetts, United States","Friendly art historian/designer. 

Born and raised in Asia, I love international design and traditional folk arts, which is why my spaces are eclectic, decorated in European, Pan-Asian, and Moroccan styles. One of the main reasons I like sharing my spaces is because, in this way, I am also sharing experiences and beauty I have encountered while traveling.",within an hour,100%,100%,FALSE,https://a0.muscache.com/im/users/128280/profile_pic/1274308069/original.jpg?aki_policy=profile_small,https://a0.muscache.com/im/users/128280/profile_pic/1274308069/original.jpg?aki_policy=profile_x_medium,Charlestown,4,4,"['email', 'phone', 'reviews']",TRUE,FALSE,"Salem Street, Boston, MA 02129, United States",Charlestown,Charlestown,NA,Boston,MA,02129,Boston,"Boston, MA",US,United States,42.376551110585275,-71.06676905680453,FALSE,House,Entire home/apt,2,1,1,1,Real Bed,"{TV,""Cable TV"",Internet,""Wireless Internet"",""Air Conditioning"",Breakfast,""Indoor Fireplace"",Heating,""Smoke Detector"",""Carbon Monoxide Detector"",""Fire Extinguisher"",Essentials,Shampoo,Hangers,""Hair Dryer"",Iron,""translation missing: en.hosting_amenity_49"",""translation missing: en.hosting_amenity_50""}",NA,$235.00,"$1,300.00","$3,900.00",NA,$25.00,2,$25.00,2,21,today,NA,6,19,37,264,2016-09-06,76,2010-09-07,2016-08-29,99,10,10,10,10,10,10,FALSE,NA,NA,FALSE,strict,FALSE,FALSE,3,1.04
4402259,https://www.airbnb.com/rooms/4402259,20160906204935,2016-09-07,Large Studio w/ private patio!,"Large studio will welcome you with warm colors, exposed brick, and large private patio! 2 queen beds (one is a pull out couch) in great location: 5 min walk to whole foods and public transit, a mile away from the north end,the garden, and galleria.","Private patio, exposed brick, excellent location, free wi-fi, quiet neighborhood, free street parking on weekends.","Large studio will welcome you with warm colors, exposed brick, and large private patio! 2 queen beds (one is a pull out couch) in great location: 5 min walk to whole foods and public transit, a mile away from the north end,the garden, and galleria. Private patio, exposed brick, excellent location, free wi-fi, quiet neighborhood, free street parking on weekends. Right half of dresser, half of closet, kitchen, patio, whole apartment, W/D in basement. NO smoking inside, no parties, no large dogs. I won't be home! So just text/call if you need anything. close walk to bars, train, whole foods. You're in the city but get to live a kind of suburb life at the same time.  Orange line (bunker hill) 92 and 93 bus uber green cab Walls can be kind of thin. You may hear people walking around upstairs. Very safe neighborhood, I know the majority of my neighbors on my block.",none,"close walk to bars, train, whole foods. You're in the city but get to live a kind of suburb life at the same time.","Walls can be kind of thin. You may hear people walking around upstairs. Very safe neighborhood, I know the majority of my neighbors on my block.",Orange line (bunker hill) 92 and 93 bus uber green cab,"Right half of dresser, half of closet, kitchen, patio, whole apartment, W/D in basement. NO smoking inside, no parties, no large dogs.",I won't be home! So just text/call if you need anything.,"NO smoking, no parties, no large dogs. I expect that the house will be the way I left it for you :) (small dogs ok)",https://a0.muscache.com/im/pictures/59474030/85263611_original.jpg?aki_policy=small,https://a0.muscache.com/im/pictures/59474030/85263611_original.jpg?aki_policy=medium,https://a0.muscache.com/im/pictures/59474030/85263611_original.jpg?aki_policy=large,https://a0.muscache.com/im/pictures/59474030/85263611_original.jpg?aki_policy=x_large,22851843,https://www.airbnb.com/users/show/22851843,Caitlyn,2014-10-22,"Boston, Massachusetts, United States",NA,within a day,100%,50%,FALSE,https://a0.muscache.com/im/users/22851843/profile_pic/1414004190/original.jpg?aki_policy=profile_small,https://a0.muscache.com/im/users/22851843/profile_pic/1414004190/original.jpg?aki_policy=profile_x_medium,Charlestown,1,1,"['email', 'phone', 'reviews', 'kba']",TRUE,TRUE,"Bartlett Street, Boston, MA 02129, United States",Charlestown,Charlestown,NA,Boston,MA,02129,Boston,"Boston, MA",US,United States,42.377678065287505,-71.06480028672766,TRUE,Apartment,Entire home/apt,2,1,0,2,Real Bed,"{TV,""Cable TV"",Internet,""Wireless Internet"",Kitchen,""Pets Allowed"",Breakfast,""Pets live on this property"",Dog(s),Heating,Washer,Dryer,""Smoke Detector"",""Carbon Monoxide Detector"",Essentials,Shampoo}",NA,$175.00,NA,NA,$500.00,NA,2,$15.00,1,7,3 days ago,NA,2,12,42,317,2016-09-06,33,2014-12-15,2016-08-28,93,9,9,10,10,10,9,FALSE,NA,NA,FALSE,flexible,FALSE,FALSE,1,1.56
1223050,https://www.airbnb.com/rooms/1223050,20160906204935,2016-09-07,The Little Room,Single person private room in an amazing penthouse located in the heart of Historic Boston (Freedom Trail). Gracious host and great rate! Monthly rental available.  Not for guests who do not like animals or are allergic to them! This is a small one-person room.,"Visit Boston in style! This cozy one-person guest room is nestled in a spacious penthouse. The 5-story historic row house is located on the Freedom Trail in the Gaslight District of Charlestown, MA right across from the Navy Yard, The USS Constitution, and MGH campus. There's easy access to all tourist attractions: North End, Downtown Boston, Haymarket, Cambridge/Kendall MIT, TD Bank Garden etc....   The guest room is a lovely self-service hotel-style space with access to an elegant penthouse; including a breathtaking panoramic view of Boston, Boston Harbor, and the Zakim Bridge.   The residence is professionally maintained to be a safe, comfortable environment for guests. Please note that this is a gay household. In addition, there are two cats (Agnes and Kelsey) and a small dog (Leo). It is NOT suitable for guests who are allergic to animals, though the place is vacuumed daily. The residence is a 4th-story walkup without an elevator, so it is not suitable for guests who cannot climb","Single person private room in an amazing penthouse located in the heart of Historic Boston (Freedom Trail). Gracious host and great rate! Monthly rental available.  Not for guests who do not like animals or are allergic to them! This is a small one-person room. Visit Boston in style! This cozy one-person guest room is nestled in a spacious penthouse. The 5-story historic row house is located on the Freedom Trail in the Gaslight District of Charlestown, MA right across from the Navy Yard, The USS Constitution, and MGH campus. There's easy access to all tourist attractions: North End, Downtown Boston, Haymarket, Cambridge/Kendall MIT, TD Bank Garden etc....   The guest room is a lovely self-service hotel-style space with access to an elegant penthouse; including a breathtaking panoramic view of Boston, Boston Harbor, and the Zakim Bridge.   The residence is professionally maintained to be a safe, comfortable environment for guests. Please note that this is a gay household. In addition, t",none,"Sophisticated and historic, close to all downtown attractions","Cats use the litter box in the top floor bathroom, so the door MUST always be left open when not in use.",Online maps are the best! Also the MBTA. Easy access to bus and train info.,"Main living areas: living/dining room, bathrooms, and lounge area. Not suitable for couples. For couples, we have another larger room option.","Owner assists guests, as needed. Owner lives on premises with daughter.","All guests must agree to the following:   1. The hallway going up to the penthouse is narrow. Take care not to make marks or scratches from suitcases on the walls. 2. No smoking anywhere on the premises or around the building.  3. The guest must keep the room clean. Please dispose of the garbage can bag upon checkout and leave the used towels and sheets in the white hamper at the foot of the bed.  4. Guests may use the washer and dryer in the basement, but clothes must be immediately removed from machines when done. Make sure to clean the lint tray on the dryer to avoid a risk of fire.  5. No additional guests are allowed to stay past 11:00 PM or sleep over. The room is designed for a single-person use only.  6. When using the bathroom, male guests are asked to sit or keep seats down and to clean the seat after each use. Guests must tidy the shower when done.  7. Guests may NOT place hot pans or cooking items on the marble counters without a trivet. There are two silicone trivets and a",https://a0.muscache.com/im/pictures/19789176/38b6f655_original.jpg?aki_policy=small,https://a0.muscache.com/im/pictures/19789176/38b6f655_original.jpg?aki_policy=medium,https://a0.muscache.com/im/pictures/19789176/38b6f655_original.jpg?aki_policy=large,https://a0.muscache.com/im/pictures/19789176/38b6f655_original.jpg?aki_policy=x_large,3432624,https://www.airbnb.com/users/show/3432624,Alex,2012-08-31,"Boston, Massachusetts, United States","With more than two decades of career experience in the real estate industry, Boston-based Alex Haidar offers expertise in buying and selling residential and commercial properties, interior design, investing opportunities and property management.

As Founder & CEO of Skyline Realty, his entrepreneurial, professional and academic achievements have demonstrated Alex’s ability to guide his firm’s clients to satisfaction and success throughout the Greater Boston Area. His roster of services also includes real estate sales, high-end leasing, professional relocation, and real estate investment consulting.

Raised in Boston, Alex uses his intimate knowledge of the communities and neighborhoods throughout the Boston metro area to find the right match for his clients. His familiarity with all aspects of the city, including schools, transportation and other amenities, as well as his recommended, trusted partners in banking, legal and all related fields, enables him to find the right connections with whom to aligns his clients.

In addition to residential brokerage, Alex also assists clients with real estate-related life transitions in diverse areas including family loss, estate management, change of ownership, divorce & asset division, estate liquidations & auctions, broker price opinion, and real estate partnerships, trusts and multi-investor ventures.

Alex’s background encompasses extensive studies in interior design, including his  window treatment & decorative painting firm Ambiance Interiors, and culminating in his current venture, Alex Haidar Interiors. Alex has completed over 200 projects for both residential and commercial clients, including noteworthy projects such as Portico Home, Heritage on the Green in Boston, and 1501 Beacon St. in Brookline, Massachusetts.

Illustrating the versatility of his background, Alex studied Aviation Science at Bridgewater State College, completing FAA course certification and flying for a year before transitioning to the Computer Science and Business Management fields. In 1993, he recognized his current calling in real estate, combining those well-honed skills in interior design and real estate investing to work on real estate development through  founding Skyline Realty. Alex most recently launched the Skyline Realty Property Management Division.",within a few hours,100%,85%,FALSE,https://a2.muscache.com/im/users/3432624/profile_pic/1370021798/original.jpg?aki_policy=profile_small,https://a2.muscache.com/im/users/3432624/profile_pic/1370021798/original.jpg?aki_policy=profile_x_medium,Charlestown,4,4,"['email', 'phone', 'facebook', 'reviews', 'kba']",TRUE,TRUE,"Chestnut Street, Charlestown, MA 02129, United States",Charlestown,Charlestown,NA,Charlestown,MA,02129,Boston,"Charlestown, MA",US,United States,42.37502380569482,-71.05921092547084,TRUE,House,Private room,1,1,1,1,Real Bed,"{TV,""Cable TV"",Internet,""Wireless Internet"",""Air Conditioning"",Kitchen,Breakfast,""Pets live on this property"",Dog(s),Cat(s),""Indoor Fireplace"",""Buzzer/Wireless Intercom"",Heating,""Smoke Detector"",""Carbon Monoxide Detector"",""Fire Extinguisher"",""translation missing: en.hosting_amenity_49"",""translation missing: en.hosting_amenity_50""}",NA,$100.00,$600.00,"$2,000.00",$200.00,NA,0,$0.00,1,2,today,NA,3,13,25,60,2016-09-06,39,2013-07-02,2016-07-19,96,10,10,10,10,10,10,FALSE,NA,NA,FALSE,strict,FALSE,FALSE,4,1.01
