601763,https://www.airbnb.com/rooms/601763,20160906204935,2016-09-07,The Alameda 2 | 2BR 1BA | 2nd Floor,Our comfy two bedroom apartment with tons of light has a true leafy neighborhood feel! It comfortably fits four and is conveniently located near Brookline and Newton. Enjoy a short walk to the commuter rail and zip into downtown in 15 minutes!,"West Roxbury – Friendly Neighborhood – Commuter Rail Access Our Alameda 2 property features a vintage 1920’s floor plan and tall ceilings. The unit offers 3 bedrooms and an additional study for your comfort. The Alameda 2 hosts a large living room, dining room and renovated eat in granite/stainless kitchen. The Alameda 2 is located just a short walk from Starbucks, Roche Brothers grocery store, and Bertucci’s Pizza.  Transportation to and from a Swank Properties unit is very convenient and easy. Whether using public transportation or a car, all of our units are selected based on their ease of access to public transportation and interstate highways. All of our units are located within walking distance to the Boston T (subway) system.  Parking: This unit offers free, non-metered on street parking near the residence. Our properties are fully furnished, providing our guests with all the conveniences of home during their visit to Boston. Our kitchens are fully equipped with a full set of ap","Our comfy two bedroom apartment with tons of light has a true leafy neighborhood feel! It comfortably fits four and is conveniently located near Brookline and Newton. Enjoy a short walk to the commuter rail and zip into downtown in 15 minutes! West Roxbury – Friendly Neighborhood – Commuter Rail Access Our Alameda 2 property features a vintage 1920’s floor plan and tall ceilings. The unit offers 3 bedrooms and an additional study for your comfort. The Alameda 2 hosts a large living room, dining room and renovated eat in granite/stainless kitchen. The Alameda 2 is located just a short walk from Starbucks, Roche Brothers grocery store, and Bertucci’s Pizza.  Transportation to and from a Swank Properties unit is very convenient and easy. Whether using public transportation or a car, all of our units are selected based on their ease of access to public transportation and interstate highways. All of our units are located within walking distance to the Boston T (subway) system.  Parking: Thi",none,NA,NA,NA,NA,NA,NA,https://a0.muscache.com/im/pictures/7574118/6486d77d_original.jpg?aki_policy=small,https://a0.muscache.com/im/pictures/7574118/6486d77d_original.jpg?aki_policy=medium,https://a0.muscache.com/im/pictures/7574118/6486d77d_original.jpg?aki_policy=large,https://a0.muscache.com/im/pictures/7574118/6486d77d_original.jpg?aki_policy=x_large,71783,https://www.airbnb.com/users/show/71783,Lance,2010-01-19,"Boston, Massachusetts, United States","Lance R. Swank, Principal

His units offer comfortable and luxurious appointments to compliment the style of the building, whether a newly constructed condo or a historic Brownstone. Visitors to Boston seeking a furnished apartment without the corporate, hotel-room-like feel of most furnished rentals will find themselves more at home in Lance’s spaces.

Lance is the President of LSBM Management, LLC and holds an MBA degree from of the F.W. Olin Graduate School of Business at Babson College. He lives and invests in the City of Boston.",within a day,73%,91%,FALSE,https://a1.muscache.com/im/users/71783/profile_pic/1342801683/original.jpg?aki_policy=profile_small,https://a1.muscache.com/im/users/71783/profile_pic/1342801683/original.jpg?aki_policy=profile_x_medium,Dorchester,10,10,"['email', 'phone', 'facebook', 'reviews', 'kba']",TRUE,TRUE,"Alameda Rd, Boston, MA 02132, United States",West Roxbury,West Roxbury,NA,Boston,MA,02132,Boston,"Boston, MA",US,United States,42.29118076806377,-71.15316226886526,TRUE,Apartment,Entire home/apt,5,1,2,2,Real Bed,"{TV,""Cable TV"",Internet,""Wireless Internet"",""Air Conditioning"",Kitchen,""Buzzer/Wireless Intercom"",Heating,""Family/Kid Friendly"",Washer,Dryer,""Smoke Detector"",""Fire Extinguisher""}",1200,$125.00,$800.00,"$3,200.00",$500.00,$175.00,2,$10.00,2,365,today,NA,5,10,40,300,2016-09-06,0,NA,NA,NA,NA,NA,NA,NA,NA,NA,FALSE,NA,NA,FALSE,strict,FALSE,FALSE,10,NA
13266176,https://www.airbnb.com/rooms/13266176,20160906204935,2016-09-07,Private Room with Queen Bed,"In this beautiful colonial style family house, we offer two sunny and quiet private rooms with a King or Queen bed. There is a large GREEN GARDEN where grows various organic vegetables. My guest, Laura, wrote “Susan was an amazing host. She went above and beyond in welcoming us and making sure we were comfortable. The rooms were beautiful and quiet. There were even fresh strawberries from the garden with breakfast. If i ever need to stay in Boston again, i can't imagine staying anywhere else!”",NA,"In this beautiful colonial style family house, we offer two sunny and quiet private rooms with a King or Queen bed. There is a large GREEN GARDEN where grows various organic vegetables. My guest, Laura, wrote “Susan was an amazing host. She went above and beyond in welcoming us and making sure we were comfortable. The rooms were beautiful and quiet. There were even fresh strawberries from the garden with breakfast. If i ever need to stay in Boston again, i can't imagine staying anywhere else!”",none,NA,NA,NA,NA,NA,NA,https://a2.muscache.com/im/pictures/f2a809ff-f269-4386-8acb-bf3581a53bad.jpg?aki_policy=small,https://a2.muscache.com/im/pictures/f2a809ff-f269-4386-8acb-bf3581a53bad.jpg?aki_policy=medium,https://a2.muscache.com/im/pictures/f2a809ff-f269-4386-8acb-bf3581a53bad.jpg?aki_policy=large,https://a2.muscache.com/im/pictures/f2a809ff-f269-4386-8acb-bf3581a53bad.jpg?aki_policy=x_large,43544288,https://www.airbnb.com/users/show/43544288,Susan,2015-09-06,"Boston, Massachusetts, United States","Boston is my second hometown (originally from China). I speak English and Chinese both. I love to travel and have conversations with people from all over the world. I enjoy my large green garden with beautiful flowers, fresh fruit and organic vegetables.  
Welcome to Boston, Welcome to my home . 
Contact me: 85xx7xx218xxxxx982x2
",within an hour,100%,99%,TRUE,https://a2.muscache.com/im/pictures/e39619b2-bd99-487a-aa45-3d665c31e22a.jpg?aki_policy=profile_small,https://a2.muscache.com/im/pictures/e39619b2-bd99-487a-aa45-3d665c31e22a.jpg?aki_policy=profile_x_medium,West Roxbury,5,5,"['email', 'phone', 'reviews']",TRUE,FALSE,"Morrell Street, Boston, MA 02132, United States",West Roxbury,West Roxbury,NA,Boston,MA,02132,Boston,"Boston, MA",US,United States,42.27427278569533,-71.16860805844178,TRUE,House,Private room,2,2.5,1,1,Real Bed,"{TV,""Wireless Internet"",""Air Conditioning"",Kitchen,""Free Parking on Premises"",Heating,Essentials,Shampoo}",NA,$55.00,NA,NA,NA,$20.00,1,$20.00,1,1125,today,NA,25,53,70,345,2016-09-06,11,2016-07-01,2016-09-01,93,9,9,10,10,9,9,FALSE,NA,NA,FALSE,flexible,FALSE,FALSE,5,4.78
10185866,https://www.airbnb.com/rooms/10185866,20160906204935,2016-09-07,Beautiful large 2 BR for three week,"Fully furnished apartment is available for short term rental for three weeks, from Jan 8 to Jan 30.  In this apartment in West Roxbury, MA, you don't need to worry about anything . It's another home for you. Just come with few clothes",NA,"Fully furnished apartment is available for short term rental for three weeks, from Jan 8 to Jan 30.  In this apartment in West Roxbury, MA, you don't need to worry about anything . It's another home for you. Just come with few clothes",none,NA,NA,NA,NA,NA,NA,https://a2.muscache.com/im/pictures/ac2ca70f-d422-44df-bf7b-62580512cdaa.jpg?aki_policy=small,https://a2.muscache.com/im/pictures/ac2ca70f-d422-44df-bf7b-62580512cdaa.jpg?aki_policy=medium,https://a2.muscache.com/im/pictures/ac2ca70f-d422-44df-bf7b-62580512cdaa.jpg?aki_policy=large,https://a2.muscache.com/im/pictures/ac2ca70f-d422-44df-bf7b-62580512cdaa.jpg?aki_policy=x_large,52311253,https://www.airbnb.com/users/show/52311253,Amita,2015-12-26,US,NA,N/A,N/A,N/A,FALSE,https://a2.muscache.com/im/pictures/7756828a-b4bc-45c3-b02e-b16aa395ce2b.jpg?aki_policy=profile_small,https://a2.muscache.com/im/pictures/7756828a-b4bc-45c3-b02e-b16aa395ce2b.jpg?aki_policy=profile_x_medium,West Roxbury,1,1,"['email', 'phone']",TRUE,FALSE,"Ridgecrest Terrace, Boston, MA 02132, United States",West Roxbury,West Roxbury,NA,Boston,MA,02132,Boston,"Boston, MA",US,United States,42.263385659608225,-71.15365616404101,TRUE,Apartment,Entire home/apt,2,1,2,2,Real Bed,"{TV,""Cable TV"",Internet,""Wireless Internet"",""Air Conditioning"",Kitchen,Breakfast,""Buzzer/Wireless Intercom"",Heating,""Family/Kid Friendly"",Washer,Dryer,""Smoke Detector"",""First Aid Kit"",Essentials,Shampoo,""24-Hour Check-in"",Hangers,Iron,""Laptop Friendly Workspace""}",NA,$120.00,NA,NA,NA,NA,1,$0.00,1,1125,9 months ago,NA,0,0,0,0,2016-09-06,0,NA,NA,NA,NA,NA,NA,NA,NA,NA,FALSE,NA,NA,FALSE,flexible,FALSE,FALSE,1,NA
4698367,https://www.airbnb.com/rooms/4698367,20160906204935,2016-09-07,Beautiful 2BD / 1 BA - 2nd Floor,"Newly renovated 2 BR / 1BA on the 2nd floor of a house.  Eat in kitchen with washer & dryer.  Walk to shops and restaurants one block away on Center St.  Quiet street with easy on-street parking, and commuter rail station just a 5 minute walk away.","This house has been in my family for over 90 years!  We fully renovated the house while preserving its charm and historic details.  You'll have everything you need to feel right at home, including a very well equipped kitchen with all new appliances and in-unit laundry, wifi and a nice big TV with AppleTV.    Our self-checkin process is simple!  You can arrive any time and check yourself in, no need to pick up or drop off keys.","Newly renovated 2 BR / 1BA on the 2nd floor of a house.  Eat in kitchen with washer & dryer.  Walk to shops and restaurants one block away on Center St.  Quiet street with easy on-street parking, and commuter rail station just a 5 minute walk away. This house has been in my family for over 90 years!  We fully renovated the house while preserving its charm and historic details.  You'll have everything you need to feel right at home, including a very well equipped kitchen with all new appliances and in-unit laundry, wifi and a nice big TV with AppleTV.    Our self-checkin process is simple!  You can arrive any time and check yourself in, no need to pick up or drop off keys. You'll have access to our big back and side yards. There are great shops, restaurants, grocery stores and nightlife all within a 10 minute walk from the apartment.  Here are some recommendations to get you started! Rox Diner - best breakfast West on Center - excellent lunch and dinner, and great bar as well Coffee - S",none,"There are great shops, restaurants, grocery stores and nightlife all within a 10 minute walk from the apartment.  Here are some recommendations to get you started! Rox Diner - best breakfast West on Center - excellent lunch and dinner, and great bar as well Coffee - Sugar Bakery, great pastries as well Sandwiches - The Real Deal",NA,"The apartment is 5 a minute walk from the West Roxbury Commuter Rail station and the 35 & 36 bus stop at Centre and Lorette St.  You can get to downtown Boston in 30 minutes on either one.  I personally prefer the Commuter Rail, as it is a very relaxing experience on the train compared to a bus. If you have a car, you can park on Temple Street, there are no meters or permits.  Please park as close to  driveway openings as possible, but do not block them.  This will maximize the number of cars that can be parked on the street and is very helpful to the neighbors!",You'll have access to our big back and side yards.,"Our self-checkin process is simple!  You can arrive any time and check yourself in, no need to pick up or drop off keys.","No parties, no smoking.",https://a1.muscache.com/im/pictures/58994521/928cd2e4_original.jpg?aki_policy=small,https://a1.muscache.com/im/pictures/58994521/928cd2e4_original.jpg?aki_policy=medium,https://a1.muscache.com/im/pictures/58994521/928cd2e4_original.jpg?aki_policy=large,https://a1.muscache.com/im/pictures/58994521/928cd2e4_original.jpg?aki_policy=x_large,2935501,https://www.airbnb.com/users/show/2935501,John,2012-07-14,"San Francisco, California, United States","I have lived in beautiful San Francisco for twelve years, originally from Boston.  San Francisco is my favorite city in the US by far.  We have incredible food, culture, outdoor sports and the most welcoming people you'll ever find.",within an hour,100%,100%,FALSE,https://a2.muscache.com/im/users/2935501/profile_pic/1342295356/original.jpg?aki_policy=profile_small,https://a2.muscache.com/im/users/2935501/profile_pic/1342295356/original.jpg?aki_policy=profile_x_medium,West Roxbury,2,2,"['email', 'phone', 'facebook', 'reviews']",TRUE,FALSE,"Temple Street, West Roxbury, MA 02132, United States",West Roxbury,West Roxbury,NA,West Roxbury,MA,02132,Boston,"West Roxbury, MA",US,United States,42.27795631554848,-71.1618076172348,TRUE,Apartment,Entire home/apt,4,1,2,2,Real Bed,"{TV,""Cable TV"",Internet,""Wireless Internet"",""Air Conditioning"",Kitchen,""Free Parking on Premises"",Heating,""Family/Kid Friendly"",Washer,Dryer,""Smoke Detector"",""Carbon Monoxide Detector"",""Fire Extinguisher"",Essentials,""24-Hour Check-in"",""Laptop Friendly Workspace""}",NA,$100.00,NA,NA,NA,$100.00,1,$0.00,2,1125,yesterday,NA,16,16,16,16,2016-09-06,60,2015-03-12,2016-08-14,95,10,9,10,10,9,10,FALSE,NA,NA,TRUE,strict,FALSE,FALSE,2,3.3
7513906,https://www.airbnb.com/rooms/7513906,20160906204935,2016-09-07,"Temple Street By Maverick, Six",Studio offers the luxury of home furnishings with the accessibility of downtown Boston and Walking distance to MGH.,"Our professional managed apartments are great for those in town on business, pleasure or if you are teaching at one of the great schools in Boston. Our Temple Street apartment rentals offers free 40′ Plasma TV, WiFi, utilities, Flatware, Silverware and Cooking Utensils, towels, linens and convenient access to downtown Boston.   Studio Features:       40″ flatscreen TV with built in WIFI       Direct Satellite TV       Grey Lacquer Kitchen Cabinets       All Stainless Appliances       Italian Carera Marble Counters       European Style Bathrooms       Individual Heat & AC Controls Property Features:       Free High Speed Wireless Internet       Coin-op laundry       Access to Iron and Ironing Boar(URL HIDDEN)Vacuum For Guests to Share The studio's kitchenette comes equipped with a mini fridge, microwave, two plate stove top, toaster and coffee maker.","Studio offers the luxury of home furnishings with the accessibility of downtown Boston and Walking distance to MGH. Our professional managed apartments are great for those in town on business, pleasure or if you are teaching at one of the great schools in Boston. Our Temple Street apartment rentals offers free 40′ Plasma TV, WiFi, utilities, Flatware, Silverware and Cooking Utensils, towels, linens and convenient access to downtown Boston.   Studio Features:       40″ flatscreen TV with built in WIFI       Direct Satellite TV       Grey Lacquer Kitchen Cabinets       All Stainless Appliances       Italian Carera Marble Counters       European Style Bathrooms       Individual Heat & AC Controls Property Features:       Free High Speed Wireless Internet       Coin-op laundry       Access to Iron and Ironing Boar(URL HIDDEN)Vacuum For Guests to Share The studio's kitchenette comes equipped with a mini fridge, microwave, two plate stove top, toaster and coffee maker. The studio's kitchenet",none,"Beacon Hill is one of Boston’s most historic neighborhoods. Close to public transportation, the neighborhood offers antique shops, boutiques and restaurants. Beacon Hill is regarded as the most desirable and expensive neighborhood in Boston.","Things you'll need to bring: Paper products: toilet paper, paper towels, napkins Basic cleaning supplies Basic seasonings Cooking oil Coffee filters Garbage bags Corkscrew Extra linens: sheets, bath towels, kitchen towels Toiletries: shampoo, conditioner, soap Hair dryer The studio is cleaned between each stay.",Located less than a five minute walk to Park Street Station and also convenient to Government center and downtown Boston.,"The studio's kitchenette comes equipped with a mini fridge, microwave, two plate stove top, toaster and coffee maker. Guests have access to a set of towels and linens provided upon arrival, flatware, silverware and cooking utensils, direct satellite TV, wireless internet and coin-op Laundry which is located in the building for tenants to use. There is an access code given to each tenant which is needed to enter the front door to the building. which The unit has an access code to enter the unit. Parking: Public transportation is the suggested form of transportation as it is only less than a 5 minute walk to the Park Street Station.  There is primarily street parking reserved for residents.   Nearby garages:      Laz Parking      100 Cambridge Street      Boston, MA (phone number hidden)      (Intersection/Between: Cambridge St & Bowdoin St(URL HIDDEN) Government Center Garage      50 New Sudbury Street      Boston, MA (phone number hidden(URL HIDDEN) Interpark      1 Center Plaza      B",NA,No Smoking No Pets,https://a0.muscache.com/im/pictures/95270128/333c0e9a_original.jpg?aki_policy=small,https://a0.muscache.com/im/pictures/95270128/333c0e9a_original.jpg?aki_policy=medium,https://a0.muscache.com/im/pictures/95270128/333c0e9a_original.jpg?aki_policy=large,https://a0.muscache.com/im/pictures/95270128/333c0e9a_original.jpg?aki_policy=x_large,22348222,https://www.airbnb.com/users/show/22348222,Alicia,2014-10-09,"Middlesex County, Massachusetts, United States",NA,within a few hours,100%,91%,FALSE,https://a0.muscache.com/im/users/22348222/profile_pic/1441049651/original.jpg?aki_policy=profile_small,https://a0.muscache.com/im/users/22348222/profile_pic/1441049651/original.jpg?aki_policy=profile_x_medium,Beacon Hill,52,52,"['email', 'phone', 'reviews', 'jumio']",TRUE,TRUE,"Temple Street, Boston, MA 02114, United States",West Roxbury,West Roxbury,NA,Boston,MA,02114,Boston,"Boston, MA",US,United States,42.2800955909269,-71.16076254472407,TRUE,Apartment,Entire home/apt,2,1,0,1,Real Bed,"{TV,""Cable TV"",""Wireless Internet"",""Air Conditioning"",Kitchen,Heating,Washer,Dryer,""Smoke Detector"",""Fire Extinguisher"",""translation missing: en.hosting_amenity_49"",""translation missing: en.hosting_amenity_50""}",NA,$137.00,NA,NA,NA,$225.00,1,$0.00,7,1125,2 weeks ago,NA,0,7,37,312,2016-09-06,1,2015-10-25,2015-10-25,100,10,10,10,10,10,8,FALSE,NA,NA,FALSE,strict,FALSE,FALSE,50,0.09
13028899,https://www.airbnb.com/rooms/13028899,20160906204935,2016-09-07,"New King Bed, Free Parking&WiFi","In this beautiful colonial style family house, we offer two sunny and quiet private rooms with a King or Queen bed. There is a large GREEN GARDEN where grows various organic vegetables. My guest, Laura, wrote “Susan was an amazing host. She went above and beyond in welcoming us and making sure we were comfortable. The rooms were beautiful and quiet. There were even fresh strawberries from the garden with breakfast. If i ever need to stay in Boston again, i can't imagine staying anywhere else!”",NA,"In this beautiful colonial style family house, we offer two sunny and quiet private rooms with a King or Queen bed. There is a large GREEN GARDEN where grows various organic vegetables. My guest, Laura, wrote “Susan was an amazing host. She went above and beyond in welcoming us and making sure we were comfortable. The rooms were beautiful and quiet. There were even fresh strawberries from the garden with breakfast. If i ever need to stay in Boston again, i can't imagine staying anywhere else!”",none,NA,NA,NA,NA,NA,"1. No wearing shoes inside the house. We will give you slippers (you could bring your own slippers) 2. Living room and kitchen are closed at 10 pm, and please be quiet after 10 pm",https://a2.muscache.com/im/pictures/5a937800-6954-4ff4-9904-c6deff10911c.jpg?aki_policy=small,https://a2.muscache.com/im/pictures/5a937800-6954-4ff4-9904-c6deff10911c.jpg?aki_policy=medium,https://a2.muscache.com/im/pictures/5a937800-6954-4ff4-9904-c6deff10911c.jpg?aki_policy=large,https://a2.muscache.com/im/pictures/5a937800-6954-4ff4-9904-c6deff10911c.jpg?aki_policy=x_large,43544288,https://www.airbnb.com/users/show/43544288,Susan,2015-09-06,"Boston, Massachusetts, United States","Boston is my second hometown (originally from China). I speak English and Chinese both. I love to travel and have conversations with people from all over the world. I enjoy my large green garden with beautiful flowers, fresh fruit and organic vegetables.  
Welcome to Boston, Welcome to my home . 
Contact me: 85xx7xx218xxxxx982x2
",within an hour,100%,99%,TRUE,https://a2.muscache.com/im/pictures/e39619b2-bd99-487a-aa45-3d665c31e22a.jpg?aki_policy=profile_small,https://a2.muscache.com/im/pictures/e39619b2-bd99-487a-aa45-3d665c31e22a.jpg?aki_policy=profile_x_medium,West Roxbury,5,5,"['email', 'phone', 'reviews']",TRUE,FALSE,"Morrell Street, Boston, MA 02132, United States",West Roxbury,West Roxbury,NA,Boston,MA,02132,Boston,"Boston, MA",US,United States,42.2740855479012,-71.16879200051908,TRUE,House,Private room,2,2.5,1,1,Real Bed,"{""Wireless Internet"",""Air Conditioning"",Kitchen,""Free Parking on Premises"",Heating,""Smoke Detector"",""Carbon Monoxide Detector"",""First Aid Kit"",Essentials,Shampoo}",NA,$65.00,NA,NA,NA,$20.00,1,$20.00,1,1125,today,NA,6,34,51,326,2016-09-06,3,2016-07-11,2016-07-21,93,10,10,10,10,8,9,FALSE,NA,NA,FALSE,strict,FALSE,FALSE,5,1.53
4530670,https://www.airbnb.com/rooms/4530670,20160906204935,2016-09-07,West Roxbury (Boston) private room,"B&B style private room with double bed and adjacent office/sitting room, private full bath.  Free wifi, safe on-street parking on dead end street, lovely back yard and deck, fireplace and cats. Full kitchen and dining area available for your use!","Quiet, family neighborhood on a safe dead end street. A mile to West Roxbury shopping and restaurants. .6ths of a mile to Commuter Rail to get to downtown Boston","B&B style private room with double bed and adjacent office/sitting room, private full bath.  Free wifi, safe on-street parking on dead end street, lovely back yard and deck, fireplace and cats. Full kitchen and dining area available for your use! Quiet, family neighborhood on a safe dead end street. A mile to West Roxbury shopping and restaurants. .6ths of a mile to Commuter Rail to get to downtown Boston Guests can access the common areas  including kitchen and fenced back yard and deck I will welcome guests and enjoy getting to know visitors to the area. In addition, I will have a basket of information about  local restaurants, public transportation and general Boston attractions.  This is a quiet, friendly neighborhood with shops and nice restaurants nearby and close to Commuter Rail station. The Commuter Rail stop is six tenths of a mile away with trains into downtown Boston. Also a bus stop is a 5 minute walk. Rt 128 is about a 15 minute drive. Buses don't run late at night. Hope",none,"This is a quiet, friendly neighborhood with shops and nice restaurants nearby and close to Commuter Rail station.",Hope you like cats and my garden.,The Commuter Rail stop is six tenths of a mile away with trains into downtown Boston. Also a bus stop is a 5 minute walk. Rt 128 is about a 15 minute drive. Buses don't run late at night.,Guests can access the common areas  including kitchen and fenced back yard and deck,"I will welcome guests and enjoy getting to know visitors to the area. In addition, I will have a basket of information about  local restaurants, public transportation and general Boston attractions.",Please no smoking.,https://a0.muscache.com/im/pictures/56895078/a7547079_original.jpg?aki_policy=small,https://a0.muscache.com/im/pictures/56895078/a7547079_original.jpg?aki_policy=medium,https://a0.muscache.com/im/pictures/56895078/a7547079_original.jpg?aki_policy=large,https://a0.muscache.com/im/pictures/56895078/a7547079_original.jpg?aki_policy=x_large,23490243,https://www.airbnb.com/users/show/23490243,Helen,2014-11-08,"Boston, Massachusetts, United States",NA,within a few hours,100%,38%,TRUE,https://a0.muscache.com/im/users/23490243/profile_pic/1415471999/original.jpg?aki_policy=profile_small,https://a0.muscache.com/im/users/23490243/profile_pic/1415471999/original.jpg?aki_policy=profile_x_medium,West Roxbury,1,1,"['email', 'phone', 'reviews']",TRUE,FALSE,"Alta Crest Road, Boston, MA 02132, United States",West Roxbury,West Roxbury,NA,Boston,MA,02132,Boston,"Boston, MA",US,United States,42.271745147344056,-71.16148454283409,TRUE,House,Private room,2,1,1,1,Real Bed,"{""Cable TV"",Internet,""Wireless Internet"",""Air Conditioning"",Kitchen,""Pets live on this property"",Cat(s),""Indoor Fireplace"",Heating,""Family/Kid Friendly"",""Smoke Detector"",""Carbon Monoxide Detector"",Essentials,Shampoo,""translation missing: en.hosting_amenity_50""}",NA,$80.00,NA,NA,NA,NA,1,$0.00,1,5,a week ago,NA,21,51,81,356,2016-09-06,30,2015-01-01,2016-06-28,99,10,10,10,10,10,10,FALSE,NA,NA,FALSE,flexible,FALSE,FALSE,1,1.46
