14685903,https://www.airbnb.com/rooms/14685903,20160906204935,2016-09-07,SPACIOUS private Boston home surrounded by nature!,"Bright + airy 6 rm, 2 bed home with lg LR, DR, EIK, huge outdoor space, back deck, garage + driveway parking. Close to the Arboretum, wooded walking trails, Centre Street, Faulkner hospital, Jamaica Pond, great restaurants + coffee shops, public transport, bike path, MFA + access to downtown. Less than 8 mil (13 km) to Harvard, Harvard med, BU, BC, MIT, Tufts Dental, Emerson, BB&N, Brimmer + most hospitals. We're an urban oasis - both in the city & nestled in nature at the same time!",NA,"Bright + airy 6 rm, 2 bed home with lg LR, DR, EIK, huge outdoor space, back deck, garage + driveway parking. Close to the Arboretum, wooded walking trails, Centre Street, Faulkner hospital, Jamaica Pond, great restaurants + coffee shops, public transport, bike path, MFA + access to downtown. Less than 8 mil (13 km) to Harvard, Harvard med, BU, BC, MIT, Tufts Dental, Emerson, BB&N, Brimmer + most hospitals. We're an urban oasis - both in the city & nestled in nature at the same time!",none,NA,NA,NA,NA,NA,NA,https://a2.muscache.com/im/pictures/e0e9bdfc-5ba8-42a2-8125-77ca1070f8a0.jpg?aki_policy=small,https://a2.muscache.com/im/pictures/e0e9bdfc-5ba8-42a2-8125-77ca1070f8a0.jpg?aki_policy=medium,https://a2.muscache.com/im/pictures/e0e9bdfc-5ba8-42a2-8125-77ca1070f8a0.jpg?aki_policy=large,https://a2.muscache.com/im/pictures/e0e9bdfc-5ba8-42a2-8125-77ca1070f8a0.jpg?aki_policy=x_large,2953540,https://www.airbnb.com/users/show/2953540,Meghan & Matt,2012-07-16,"Boston, Massachusetts, United States","About Meghan: I'm an adventurous, free-spirirted woman in her 30s eager to see the world and share her home with those wishing to do the same!  My fav travel destinations to date: Thailand- Vancouver, BC- Morocco- India.  Next up on my list- New Zealand! 

I'm a recovering lawyer who now owns her own private chef/catering business in the Boston, MA area.  Cooking, traveling, eating and drinking great things, running, yoga, family and friends are the most important things in my life and achieving the elusive ""balance"" is always a work in progress.

""Happiness resides not in possessions, and not in gold, happiness dwells in the soul""

About Matt: I'm a football playing geek who finds adventure outdoors on the trail or in the mountains, in the kitchen trying new foods from around the world, and indoors reading everything from comics to Hawking to National Geographic.",within a day,100%,100%,FALSE,https://a1.muscache.com/im/users/2953540/profile_pic/1376230582/original.jpg?aki_policy=profile_small,https://a1.muscache.com/im/users/2953540/profile_pic/1376230582/original.jpg?aki_policy=profile_x_medium,West Roxbury,1,1,"['email', 'phone', 'facebook', 'reviews', 'kba']",TRUE,TRUE,"Allandale Street, Boston, MA 02130, United States",West Roxbury,West Roxbury,NA,Boston,MA,02130,Boston,"Boston, MA",US,United States,42.299553215464385,-71.12913835315712,TRUE,House,Entire home/apt,8,1,2,2,Real Bed,"{TV,""Cable TV"",Internet,""Wireless Internet"",""Air Conditioning"",Kitchen,""Free Parking on Premises"",Breakfast,Heating,""Family/Kid Friendly"",Washer,Dryer,""Smoke Detector"",""Carbon Monoxide Detector"",""First Aid Kit"",Essentials,Shampoo,Iron,""Laptop Friendly Workspace""}",NA,$349.00,NA,NA,NA,NA,1,$0.00,2,1125,2 weeks ago,NA,25,55,85,360,2016-09-06,0,NA,NA,NA,NA,NA,NA,NA,NA,NA,FALSE,NA,NA,FALSE,flexible,TRUE,TRUE,1,NA
1757417,https://www.airbnb.com/rooms/1757417,20160906204935,2016-09-07,Queen in Arts & Crafts Bungalow,Relax in our 1912 Arts & Crafts bungalow in the quiet Bellevue Hill neighborhood of West Roxbury in Boston's southwest corner. Soak in the clawfoot tub. Enjoy sunsets on the front porch. Curl up in front of the stone fireplace. Free street parking.,Expansive front porch. Field stone fireplace. Coffered ceilings. Built-in hutches. Window seats. We think you'll find our 1912 Arts & Crafts era bungalow's unpretentious character warmly welcoming. You'll have a large private room with queen bed adjacent to a full bathroom with shower and clawfoot tub. (Bathroom may be shared with up to 2 other guests if our second bedroom with double bed happens to be rented.),"Relax in our 1912 Arts & Crafts bungalow in the quiet Bellevue Hill neighborhood of West Roxbury in Boston's southwest corner. Soak in the clawfoot tub. Enjoy sunsets on the front porch. Curl up in front of the stone fireplace. Free street parking. Expansive front porch. Field stone fireplace. Coffered ceilings. Built-in hutches. Window seats. We think you'll find our 1912 Arts & Crafts era bungalow's unpretentious character warmly welcoming. You'll have a large private room with queen bed adjacent to a full bathroom with shower and clawfoot tub. (Bathroom may be shared with up to 2 other guests if our second bedroom with double bed happens to be rented.) Feel comfortable lounging in the living room in front of the fireplace, hanging out on the front porch, and taking a meal or playing a board game at the dining room table. Just ask for a tour of the kitchen if you'd like to prepare a meal or store things in the fridge. We'll greet you and get you oriented and settled, then give you sp",none,"Quiet and friendly. Convenient, but uncongested. See our Guidebook for nearby attractions.","We live on a dead end street, so there is always free parking right in front of our house. Come and go as you wish, but please check-in before 9PM.","We're a 10 minute drive from I-95. Free street parking is always available right in front of our house. While we're not near a subway stop, you can hop on the MBTA 38 bus in a quick 3 minute stroll down the block to Park and Woodard Streets, or catch the more frequent 34 and 40 buses in an easy 10 minute walk to the stops at the corner of LaGrange and Washington Streets. In addition, the speedy Boston commuter rail is accessible at the bottom of the hill at the corner of Park and Railroad Streets in a brisk 15 minute hike. See our Guidebook for these public transit stops and then use G00GLE Maps Transit to plan your routes from the corner of Park and Robin Streets. In addition, ride sharing options such as Uber, Lyft, and Fasten are very convenient alternatives, and fairly cost-competitive with public transportation when traveling in a group.","Feel comfortable lounging in the living room in front of the fireplace, hanging out on the front porch, and taking a meal or playing a board game at the dining room table. Just ask for a tour of the kitchen if you'd like to prepare a meal or store things in the fridge.","We'll greet you and get you oriented and settled, then give you space to relax. Let us know what you need and we'll do our best to ensure you have an enjoyable  stay in Boston. Keith works from his home office on the second floor, so is available for assistance at most times.",We love our home and enjoy sharing it with others. We hope you'll treat it as with as much care as we do. Our neighbors are friendly and quiet. We hope you'll fit right in.,https://a2.muscache.com/im/pictures/682d9c05-ce2c-4938-8e79-d9a76bf9dd6b.jpg?aki_policy=small,https://a2.muscache.com/im/pictures/682d9c05-ce2c-4938-8e79-d9a76bf9dd6b.jpg?aki_policy=medium,https://a2.muscache.com/im/pictures/682d9c05-ce2c-4938-8e79-d9a76bf9dd6b.jpg?aki_policy=large,https://a2.muscache.com/im/pictures/682d9c05-ce2c-4938-8e79-d9a76bf9dd6b.jpg?aki_policy=x_large,9241244,https://www.airbnb.com/users/show/9241244,Keith (& Beth),2013-10-05,"Boston, Massachusetts, United States","My wife Beth and I are bibliophiles, turophiles, and oenophiles who enjoy reading (she classic works of fiction, me non-fiction philosophy and science), fine cheese, and (cheap) wine. We also share a love of theater, architecture, international travel, intellectual conversation, and cooking together.",within a day,100%,95%,TRUE,https://a2.muscache.com/im/pictures/f074d6ef-aabc-43a0-be11-55bf7c54a4aa.jpg?aki_policy=profile_small,https://a2.muscache.com/im/pictures/f074d6ef-aabc-43a0-be11-55bf7c54a4aa.jpg?aki_policy=profile_x_medium,West Roxbury,3,3,"['email', 'phone', 'reviews', 'kba']",TRUE,TRUE,"Robin Street, Boston, MA 02132, United States",West Roxbury,West Roxbury,NA,Boston,MA,02132,Boston,"Boston, MA",US,United States,42.27753724788013,-71.14347839569454,TRUE,House,Private room,2,1,1,1,Real Bed,"{Internet,""Wireless Internet"",Kitchen,""Free Parking on Premises"",""Indoor Fireplace"",Heating,""Family/Kid Friendly"",Washer,Dryer,""Smoke Detector"",""Carbon Monoxide Detector"",""First Aid Kit"",Essentials,Shampoo,Hangers,""Hair Dryer"",""Laptop Friendly Workspace""}",NA,$60.00,$500.00,NA,NA,$15.00,2,$0.00,1,1125,today,NA,5,19,43,44,2016-09-06,19,2015-10-31,2016-08-11,100,10,10,10,10,10,10,FALSE,NA,NA,FALSE,flexible,FALSE,FALSE,3,1.82
10964552,https://www.airbnb.com/rooms/10964552,20160906204935,2016-09-07,"Quiet, Clean, and Comfortable","Room available in a modern, clean single family house.  The house is located in a quiet and safe neighborhood in Boston.  Plenty of free on street parking.  Guests have full use of the house as well as very flexible check in/out times.","Kitchen: I have a fully stocked kitchen with spices, dishes, cooking equipment.  Feel free to use the kitchen for meal preparations.  I also provide ice and filtered water (refrigerated and room temperature).  There is a dishwasher and I just ask that dishes are placed in it in a timely manner.  I also have two refrigerators (one upstairs and one in basement) so feel free to store any leftovers/ food for meals in the upstairs refrigerator. Bathroom:  There is an upstairs bathroom that is reserved for air bnb guests.   Living Room:  There is a 60 inch tv in the living room as well as a couch and easy chair.  Guests have full access to the living room and are free to relax in the living room. Laundry in Basement: I provide laundry soap/fabric softener.  There is no charge to use the laundry facilities.  Please coordinate with me for access to laundry area as my cats stay in the basement when I am not home. Your Room: There is a brand new full mattress in the room as well a bureau, bookca","Room available in a modern, clean single family house.  The house is located in a quiet and safe neighborhood in Boston.  Plenty of free on street parking.  Guests have full use of the house as well as very flexible check in/out times. Kitchen: I have a fully stocked kitchen with spices, dishes, cooking equipment.  Feel free to use the kitchen for meal preparations.  I also provide ice and filtered water (refrigerated and room temperature).  There is a dishwasher and I just ask that dishes are placed in it in a timely manner.  I also have two refrigerators (one upstairs and one in basement) so feel free to store any leftovers/ food for meals in the upstairs refrigerator. Bathroom:  There is an upstairs bathroom that is reserved for air bnb guests.   Living Room:  There is a 60 inch tv in the living room as well as a couch and easy chair.  Guests have full access to the living room and are free to relax in the living room. Laundry in Basement: I provide laundry soap/fabric softener.  Th",none,NA,NA,NA,Kitchen: Full access Bathroom: Private bathroom for Air BnB guests Living Room: Full Access,I enjoy meeting new people!  If you would rather have privacy please let me know and I can accommodate.,Shoes must be removed after entering the house. The cats are strictly indoor. No smoking,https://a2.muscache.com/im/pictures/be8de230-6c94-4506-b5fb-24cc7c5c1a27.jpg?aki_policy=small,https://a2.muscache.com/im/pictures/be8de230-6c94-4506-b5fb-24cc7c5c1a27.jpg?aki_policy=medium,https://a2.muscache.com/im/pictures/be8de230-6c94-4506-b5fb-24cc7c5c1a27.jpg?aki_policy=large,https://a2.muscache.com/im/pictures/be8de230-6c94-4506-b5fb-24cc7c5c1a27.jpg?aki_policy=x_large,56874023,https://www.airbnb.com/users/show/56874023,Erin,2016-01-31,"Boston, Massachusetts, United States",NA,within a few hours,61%,100%,FALSE,https://a2.muscache.com/im/pictures/f9445cca-0a39-4a84-a351-a4b4c13d5cc6.jpg?aki_policy=profile_small,https://a2.muscache.com/im/pictures/f9445cca-0a39-4a84-a351-a4b4c13d5cc6.jpg?aki_policy=profile_x_medium,West Roxbury,2,2,"['email', 'phone', 'reviews', 'kba']",TRUE,TRUE,"Pheasant Street, Boston, MA 02132, United States",West Roxbury,West Roxbury,NA,Boston,MA,02132,Boston,"Boston, MA",US,United States,42.27307168640065,-71.14653442057656,TRUE,House,Private room,2,2,1,1,Real Bed,"{TV,Internet,""Wireless Internet"",""Air Conditioning"",Kitchen,""Free Parking on Premises"",Breakfast,""Pets live on this property"",Heating,""Family/Kid Friendly"",Washer,Dryer,""Smoke Detector"",""Carbon Monoxide Detector"",Essentials}",NA,$45.00,NA,NA,NA,NA,1,$0.00,1,1125,2 months ago,NA,1,9,18,68,2016-09-06,51,2016-02-09,2016-08-21,96,10,10,10,10,10,10,FALSE,NA,NA,TRUE,moderate,FALSE,FALSE,2,7.22
13487348,https://www.airbnb.com/rooms/13487348,20160906204935,2016-09-07,Private room in attic,My place is good for solo adventurers.,"This is my lovely home. A beautiful and cozy house located on the center street, very easy to access to Boston city. Walk five minutes to the bus stop and take 3 buses to the city.",My place is good for solo adventurers.,none,NA,NA,NA,You may sit in the spacious back yard garden and have a relax or on the sofa in the living room to watch TV.,NA,- $20 per extra person. Maximum 2 person for attic room.,https://a2.muscache.com/im/pictures/e3562938-f505-48bd-96b0-7a74c1c9d0f4.jpg?aki_policy=small,https://a2.muscache.com/im/pictures/e3562938-f505-48bd-96b0-7a74c1c9d0f4.jpg?aki_policy=medium,https://a2.muscache.com/im/pictures/e3562938-f505-48bd-96b0-7a74c1c9d0f4.jpg?aki_policy=large,https://a2.muscache.com/im/pictures/e3562938-f505-48bd-96b0-7a74c1c9d0f4.jpg?aki_policy=x_large,75909219,https://www.airbnb.com/users/show/75909219,Jane,2016-06-05,"Boston, Massachusetts, United States","I am a well-educated and friendly professional. I am kindly easy-going and laid back. I have a full time job. I like to hang out with my family and friends, dine out in a nice restaurant, music, dance, work out and travel...
Airbnb hosing is my new adventure :-) Hopefully you follow my house rules and keep the place clean.
",within a few hours,100%,100%,FALSE,https://a2.muscache.com/im/pictures/058da69a-40a9-477e-978d-69bd84089949.jpg?aki_policy=profile_small,https://a2.muscache.com/im/pictures/058da69a-40a9-477e-978d-69bd84089949.jpg?aki_policy=profile_x_medium,West Roxbury,1,1,"['email', 'phone', 'reviews']",TRUE,FALSE,"Alaric Street, Boston, MA 02132, United States",West Roxbury,West Roxbury,NA,Boston,MA,02132,Boston,"Boston, MA",US,United States,42.27609545484709,-71.16250419223144,TRUE,House,Private room,2,1,1,2,Real Bed,"{""Wireless Internet"",""Air Conditioning"",Kitchen,""Free Parking on Premises"",Heating,""Smoke Detector"",""Carbon Monoxide Detector"",""First Aid Kit"",""Safety Card"",Essentials,Shampoo,Hangers,""Hair Dryer"",""Laptop Friendly Workspace"",""translation missing: en.hosting_amenity_49"",""translation missing: en.hosting_amenity_50""}",NA,$60.00,NA,NA,NA,NA,1,$20.00,1,1125,today,NA,20,50,80,80,2016-09-06,1,2016-07-17,2016-07-17,100,10,10,10,10,10,10,FALSE,NA,NA,TRUE,flexible,FALSE,FALSE,1,0.57
6261296,https://www.airbnb.com/rooms/6261296,20160906204935,2016-09-07,"Free parking, spacious private room","Spacious, clean, SUNNY room in a brick single family house with a desk,  lamp, closet, and a QUEEN SIZED BED. Located in the SAFEST NEIGHBORHOOD IN BOSTON. Lovely HARDWOOD FLOORS, ivy covered RED BRICK house. Spacious dining room and living room.","New England red brick house with a modern touch. We have leather sofas and a REAL FIREPLACE in our spacious living room. We have a 52 inch flat television.  We have a GREEN BACK GARDEN that grows strawberries and flowers. Squirrels and blue jays frequently come around in the morning. On nice days, you can have breakfast overlooking our outdoor garden.  We have a kitchen with a dishwasher. Guests are allowed to use the kitchen for eating or making simple foods such as sandwiches.  Please tell us if you are going to use the kitchen for any other purposes.","Spacious, clean, SUNNY room in a brick single family house with a desk,  lamp, closet, and a QUEEN SIZED BED. Located in the SAFEST NEIGHBORHOOD IN BOSTON. Lovely HARDWOOD FLOORS, ivy covered RED BRICK house. Spacious dining room and living room. New England red brick house with a modern touch. We have leather sofas and a REAL FIREPLACE in our spacious living room. We have a 52 inch flat television.  We have a GREEN BACK GARDEN that grows strawberries and flowers. Squirrels and blue jays frequently come around in the morning. On nice days, you can have breakfast overlooking our outdoor garden.  We have a kitchen with a dishwasher. Guests are allowed to use the kitchen for eating or making simple foods such as sandwiches.  Please tell us if you are going to use the kitchen for any other purposes. WIFI.  You are welcome to watch television, and the sound must be turned off to small after 10 pm. No alcohol consumption above 2 beers or the equivalent. I love talking about anything, so you",none,"West Roxbury is the SAFEST neighborhood in Boston according to the City of Boston website. West Roxbury, located in Boston's southwest corner, was home to a 19th century experimental, utopian community frequented by such notable writers as Ralph Waldo Emerson, Nathaniel Hawthorne and Henry David Thoreau.","I collect magnets of all of the countries I have been to. If you are interested, I can show you my magnet collection","8 minutes walk from bus 35, 36, 37. (goes to the orange line and Copley/downtown) 1 minutes walk from bus 51  bus (goes to Green line and Boston College/Boston University/Fenway Park) 8 minutes walk from commuter rail.","WIFI.  You are welcome to watch television, and the sound must be turned off to small after 10 pm. No alcohol consumption above 2 beers or the equivalent.","I love talking about anything, so you are welcome to ask me about VACATION PLANS, MOVING TO BOSTON, BEST SIGHTS IN BOSTON, WHERE TO SHOP, FREE THINGS TO DO. If you want privacy, please let us know and we will let you have your own space.",1. No pets allowed.  2. No Children under the age of 10 allowed.  3. No smoking inside the house. You may smoke outside.  4. No wearing shoes inside the house. We will give you slippers for you to wear.  5. Quiet time starts at 11pm,https://a0.muscache.com/im/pictures/81202156/d691837a_original.jpg?aki_policy=small,https://a0.muscache.com/im/pictures/81202156/d691837a_original.jpg?aki_policy=medium,https://a0.muscache.com/im/pictures/81202156/d691837a_original.jpg?aki_policy=large,https://a0.muscache.com/im/pictures/81202156/d691837a_original.jpg?aki_policy=x_large,7614614,https://www.airbnb.com/users/show/7614614,Yedan,2013-07-20,"Boston, Massachusetts, United States","Hello!

My name is Yedan and I live  in Boston with my husband and daughter. 

We are Chinese - American and have been in Boston for 17 years. I love to travel and host AirBnB guests. I love having conversations about traveling and getting to know people.

I work as a laboratory researcher in Boston.

Thank you for visiting my profile and see you on Airbnb!",within an hour,100%,100%,FALSE,https://a2.muscache.com/im/pictures/c9fadf80-a134-4e7a-933b-4835d6d48678.jpg?aki_policy=profile_small,https://a2.muscache.com/im/pictures/c9fadf80-a134-4e7a-933b-4835d6d48678.jpg?aki_policy=profile_x_medium,West Roxbury,1,1,"['email', 'phone', 'reviews', 'jumio']",TRUE,TRUE,"Sunnybank Road, Boston, MA 02132, United States",West Roxbury,West Roxbury,NA,Boston,MA,02132,Boston,"Boston, MA",US,United States,42.290185437863244,-71.15637538377736,TRUE,House,Private room,2,1.5,1,1,Real Bed,"{TV,""Cable TV"",Internet,""Wireless Internet"",""Air Conditioning"",Kitchen,""Free Parking on Premises"",Breakfast,""Indoor Fireplace"",""Buzzer/Wireless Intercom"",Heating,Washer,Dryer,""Smoke Detector"",""Carbon Monoxide Detector"",""First Aid Kit"",Essentials,Shampoo,""24-Hour Check-in"",Hangers,""Hair Dryer"",Iron,""Laptop Friendly Workspace""}",NA,$70.00,$430.00,"$2,000.00",$100.00,$20.00,1,$20.00,2,1125,today,NA,18,37,66,341,2016-09-06,58,2015-05-25,2016-08-30,97,10,10,10,10,9,10,FALSE,NA,NA,TRUE,strict,FALSE,FALSE,1,3.69
12618291,https://www.airbnb.com/rooms/12618291,20160906204935,2016-09-07,Historic Single Family Victorian!,"Welcome to the 'ur-burbs'~~!  This Single Family Victorian is located in West Roxbury, the furthest neighborhood in Boston.  Very family friendly and super community atmosphere.","Welcome to our house!!!  We would love for your family to come and experience what it is like to live in the 'ur-burbs' - or the urban suburbs or Boston.  Not quite sure you want to make the move from the city to the burbs?  Come try it out!!  Live in the burbs and want to be in the city for the Fall?  Come try it out!  Amazing neighborhood next to a park, Starbucks and tons of eating options! I would like to make and potential renters aware that this listing is our home, it is not a second property or investment property - so it isn't *that* kind of rental.  We have stayed at lots of airbnb rentals ourselves, so just wanted to let you all know that.  Its not pristine, but it is a huge, beautiful, historic house which we love:) This Victorian house in the Bellevue Hill neighborhood, built in 1880 features all original woodwork and a hand carved staircase.  7500 square foot lot, which can lead to lots of lazy summer BBQs for you!  Included in the price is professional yard workers and a","Welcome to the 'ur-burbs'~~!  This Single Family Victorian is located in West Roxbury, the furthest neighborhood in Boston.  Very family friendly and super community atmosphere. Welcome to our house!!!  We would love for your family to come and experience what it is like to live in the 'ur-burbs' - or the urban suburbs or Boston.  Not quite sure you want to make the move from the city to the burbs?  Come try it out!!  Live in the burbs and want to be in the city for the Fall?  Come try it out!  Amazing neighborhood next to a park, Starbucks and tons of eating options! I would like to make and potential renters aware that this listing is our home, it is not a second property or investment property - so it isn't *that* kind of rental.  We have stayed at lots of airbnb rentals ourselves, so just wanted to let you all know that.  Its not pristine, but it is a huge, beautiful, historic house which we love:) This Victorian house in the Bellevue Hill neighborhood, built in 1880 features all o",none,"West Roxbury has so much to offer!!! We are 1 block away from Billings Field, which hosts the Corrib Run on the first Sunday in June!  Also a huge kids playground there and basketball courts.  The newly renovated YMCA and West Roxbury Library are also 1 block away (as is a Blanchard's~).  Lots of restaurants, Starbucks, grocery stores etc. within walking distance.",NA,This property is 1 block from bus service and 3 blocks from the commuter rail.,You can access the entire space except one room on the third floor.  That room will be full of the stuff we emptied for you to use the rest of the house!!!,Our family uses Air B&B to helps support my son who is a dancer with the Boston Ballet.  He is so talented but it costs an amazing amount to support him!  We stay with my folks who are also in the area - so if guests need assistance we are close by.  We will also try our best to be there when you check in.,This listing is located in a residential area and so all the regular rules of living in a residential area apply.  Please be kind to the neighbors - we know and love them!  Please keep BBQs/outside activity to a minimum after 9 or 10PM.,https://a2.muscache.com/im/pictures/4df663bd-f3e5-4d31-9074-8d4739370d3b.jpg?aki_policy=small,https://a2.muscache.com/im/pictures/4df663bd-f3e5-4d31-9074-8d4739370d3b.jpg?aki_policy=medium,https://a2.muscache.com/im/pictures/4df663bd-f3e5-4d31-9074-8d4739370d3b.jpg?aki_policy=large,https://a2.muscache.com/im/pictures/4df663bd-f3e5-4d31-9074-8d4739370d3b.jpg?aki_policy=x_large,68502098,https://www.airbnb.com/users/show/68502098,Kristen,2016-04-23,"Boston, Massachusetts, United States","I am mom of three kids (8, 5 and 3), a wife to a great husband and happen to have a gig on the side called a full-time job:)~~   We love our neighborhood for the suburban feel but still in the city. I grew up here, so if you have questions just let me know!!",within a few hours,100%,50%,FALSE,https://a2.muscache.com/im/pictures/bde90335-db36-46a3-9dc3-1783be8e01a9.jpg?aki_policy=profile_small,https://a2.muscache.com/im/pictures/bde90335-db36-46a3-9dc3-1783be8e01a9.jpg?aki_policy=profile_x_medium,West Roxbury,1,1,"['email', 'phone', 'reviews', 'kba']",TRUE,TRUE,"Maxfield Street, Boston, MA 02132, United States",West Roxbury,West Roxbury,NA,Boston,MA,02132,Boston,"Boston, MA",US,United States,42.280756536765175,-71.1532143565036,TRUE,House,Entire home/apt,6,1.5,5,5,Real Bed,"{TV,Internet,""Wireless Internet"",Kitchen,""Free Parking on Premises"",Gym,""Family/Kid Friendly"",""Suitable for Events"",Washer,Dryer,""Smoke Detector"",""Carbon Monoxide Detector"",""First Aid Kit"",""Fire Extinguisher"",Essentials,Shampoo,""24-Hour Check-in"",Hangers,""Hair Dryer"",""Laptop Friendly Workspace""}",NA,$300.00,NA,NA,$500.00,$75.00,1,$0.00,3,30,a week ago,NA,25,41,71,346,2016-09-06,3,2016-07-06,2016-08-21,100,9,10,10,10,10,10,FALSE,NA,NA,FALSE,strict,FALSE,FALSE,1,1.41
