id,listing_url,scrape_id,last_scraped,name,summary,space,description,experiences_offered,neighborhood_overview,notes,transit,access,interaction,house_rules,thumbnail_url,medium_url,picture_url,xl_picture_url,host_id,host_url,host_name,host_since,host_location,host_about,host_response_time,host_response_rate,host_acceptance_rate,host_is_superhost,host_thumbnail_url,host_picture_url,host_neighbourhood,host_listings_count,host_total_listings_count,host_verifications,host_has_profile_pic,host_identity_verified,street,neighbourhood,neighbourhood_cleansed,neighbourhood_group_cleansed,city,state,zipcode,market,smart_location,country_code,country,latitude,longitude,is_location_exact,property_type,room_type,accommodates,bathrooms,bedrooms,beds,bed_type,amenities,square_feet,price,weekly_price,monthly_price,security_deposit,cleaning_fee,guests_included,extra_people,minimum_nights,maximum_nights,calendar_updated,has_availability,availability_30,availability_60,availability_90,availability_365,calendar_last_scraped,number_of_reviews,first_review,last_review,review_scores_rating,review_scores_accuracy,review_scores_cleanliness,review_scores_checkin,review_scores_communication,review_scores_location,review_scores_value,requires_license,license,jurisdiction_names,instant_bookable,cancellation_policy,require_guest_profile_picture,require_guest_phone_verification,calculated_host_listings_count,reviews_per_month
295285,https://www.airbnb.com/rooms/295285,20160906204935,2016-09-07,"Single Bedroom, Quiet Neighborhood",NA,"Single bedroom available in a quiet Boston neighborhood. T accessible, Wi-Fi, cable, wahser/dryer. I have neither pets nor children. Parking in a driveway is available.","Single bedroom available in a quiet Boston neighborhood. T accessible, Wi-Fi, cable, wahser/dryer. I have neither pets nor children. Parking in a driveway is available.",none,NA,NA,NA,NA,NA,NA,NA,NA,https://a0.muscache.com/im/pictures/3090800/1d220b6e_original.jpg?aki_policy=large,NA,1271326,https://www.airbnb.com/users/show/1271326,Tom,2011-10-10,"Boston, Massachusetts, United States","My name is Tom; I have lived in the Greater Boston area my whole life. I attended Cornell University for my undergraduate, and the University of Oxford for my graduate degre. I'm 31 years old engineer, and work for a medical device company. I have owned this house for just over 5 years, and love the neighborhood!",within an hour,100%,57%,FALSE,https://a0.muscache.com/im/users/1271326/profile_pic/1324498202/original.jpg?aki_policy=profile_small,https://a0.muscache.com/im/users/1271326/profile_pic/1324498202/original.jpg?aki_policy=profile_x_medium,West Roxbury,1,1,"['email', 'phone', 'facebook', 'reviews', 'kba']",TRUE,TRUE,"Keith St, Boston, MA 02132, United States",West Roxbury,West Roxbury,NA,Boston,MA,02132,Boston,"Boston, MA",US,United States,42.28719370532695,-71.1681597440516,TRUE,House,Private room,4,1.5,1,1,Real Bed,"{""Cable TV"",""Wireless Internet"",Washer,Dryer}",NA,$80.00,NA,$816.00,NA,NA,1,$0.00,1,1125,9 months ago,NA,0,0,12,287,2016-09-06,19,2013-05-21,2016-09-03,97,10,9,10,10,9,10,FALSE,NA,NA,FALSE,strict,FALSE,FALSE,1,0.47
11441717,https://www.airbnb.com/rooms/11441717,20160906204935,2016-09-07,"Clean, Quiet, and Comfortable","Room available in a modern, clean single family house. The house is located in a quiet and safe neighborhood in Boston. Plenty of free on street parking. Guests have full use of the house as well as very flexible check in/out times.","Kitchen: I have a fully stocked kitchen with spices, dishes, cooking equipment. Feel free to use the kitchen for meal preparations. I also provide ice and filtered water (refrigerated and room temperature). There is a dishwasher and I just ask that dishes are placed in it in a timely manner. I also have two refrigerators (one upstairs and one in basement) so feel free to store any leftovers/ food for meals in the upstairs refrigerator. Bathroom: There is an upstairs bathroom that is reserved for air bnb guests.  Living Room: There is a 60 inch tv in the living room as well as a couch and easy chair. Guests have full access to the living room and are free to relax in the living room. Laundry in Basement: I provide laundry soap/fabric softener. There is no charge to use the laundry facilities. Please coordinate with me for access to laundry area as my cats stay in the basement when I am not home. Your Room: There is a brand new full mattress in the room as well a bureau, bookcase, and de","Room available in a modern, clean single family house. The house is located in a quiet and safe neighborhood in Boston. Plenty of free on street parking. Guests have full use of the house as well as very flexible check in/out times. Kitchen: I have a fully stocked kitchen with spices, dishes, cooking equipment. Feel free to use the kitchen for meal preparations. I also provide ice and filtered water (refrigerated and room temperature). There is a dishwasher and I just ask that dishes are placed in it in a timely manner. I also have two refrigerators (one upstairs and one in basement) so feel free to store any leftovers/ food for meals in the upstairs refrigerator. Bathroom: There is an upstairs bathroom that is reserved for air bnb guests.  Living Room: There is a 60 inch tv in the living room as well as a couch and easy chair. Guests have full access to the living room and are free to relax in the living room. Laundry in Basement: I provide laundry soap/fabric softener. There is no ch",none,NA,NA,NA,Kitchen: Full access Bathroom: Private bathroom for Air BnB guests Living Room: Full Access,I enjoy meeting new people! If you would rather have privacy please let me know and I can accommodate.,Shoes must be removed after entering the house. The cats are strictly indoor. No smoking,NA,NA,https://a2.muscache.com/im/pictures/88a79fd1-a9af-432e-a906-c2330eafca2f.jpg?aki_policy=large,NA,56874023,https://www.airbnb.com/users/show/56874023,Erin,2016-01-31,"Boston, Massachusetts, United States",NA,within a few hours,61%,100%,FALSE,https://a2.muscache.com/im/pictures/f9445cca-0a39-4a84-a351-a4b4c13d5cc6.jpg?aki_policy=profile_small,https://a2.muscache.com/im/pictures/f9445cca-0a39-4a84-a351-a4b4c13d5cc6.jpg?aki_policy=profile_x_medium,West Roxbury,2,2,"['email', 'phone', 'reviews', 'kba']",TRUE,TRUE,"Pheasant Street, Boston, MA 02132, United States",West Roxbury,West Roxbury,NA,Boston,MA,02132,Boston,"Boston, MA",US,United States,42.272605834880025,-71.1466903299697,TRUE,House,Private room,1,2,1,1,Real Bed,"{TV,""Cable TV"",Internet,""Wireless Internet"",""Air Conditioning"",Kitchen,""Free Parking on Premises"",""Pets Allowed"",Heating,""Family/Kid Friendly"",Washer,Dryer,""Smoke Detector"",""Carbon Monoxide Detector"",""First Aid Kit"",Essentials,Shampoo,""24-Hour Check-in"",Hangers,""Laptop Friendly Workspace""}",NA,$45.00,NA,NA,NA,NA,1,$0.00,30,1125,4 weeks ago,NA,0,0,4,279,2016-09-06,10,2016-04-02,2016-08-03,96,10,10,10,10,10,10,FALSE,NA,NA,FALSE,flexible,FALSE,FALSE,2,1.89
962610,https://www.airbnb.com/rooms/962610,20160906204935,2016-09-07,Convenient Boston Hotel Alternative,This is a cozy yet spacious one bedroom unit with everything you need to make your stay a comfortable one!,"Recently renovated, private one bedroom apartment which sits on the border of the great Boston neighborhoods of Roslindale and West Roxbury.  Has everything you need to make your short or medium term stay comfortable, convenient, and affordable!  Rents by the day, week, and month.  Approximately 600 sqft of fully furnished top floor living space including a spacious bedroom, large living room, new bathroom, efficiency kitchen (no oven) and eating area.  Private entrance.  Access to shared back porch, grilling area and backyard.  WiFi and internet cable included. Note: This unit is 5-6 miles outside of downtown so please take location into consideration before you book.  Please see note below regarding public transportation. 7 minute walk to the Needham Line commuter rail (note: does not run on Sundays) and a short bus ride to the Forest Hills T station (orange line).  Takes about 15-20 minutes to get to the heart of Boston via train.  10-15 minutes by car depending on where you are goi","This is a cozy yet spacious one bedroom unit with everything you need to make your stay a comfortable one! Recently renovated, private one bedroom apartment which sits on the border of the great Boston neighborhoods of Roslindale and West Roxbury.  Has everything you need to make your short or medium term stay comfortable, convenient, and affordable!  Rents by the day, week, and month.  Approximately 600 sqft of fully furnished top floor living space including a spacious bedroom, large living room, new bathroom, efficiency kitchen (no oven) and eating area.  Private entrance.  Access to shared back porch, grilling area and backyard.  WiFi and internet cable included. Note: This unit is 5-6 miles outside of downtown so please take location into consideration before you book.  Please see note below regarding public transportation. 7 minute walk to the Needham Line commuter rail (note: does not run on Sundays) and a short bus ride to the Forest Hills T station (orange line).  Takes about",none,"This neighborhood truly has it all.  Good, not overpriced restaurants and a variety of food.  Everything you need (groceries, zipcar, alcohol, etc.) is within a mile.  It's ideally close to the city center but in a quiet residential area.  My guests tell me they feel like they are ""home"" when they stay here.","Please note that this is a third floor apartment.  There is an inclined driveway which you will need to walk to access the back door of the house.  From there, you will walk up two flights of stairs.",Plenty of on street parking with no restrictions.  On major bus line.  Subway is 2 miles away and is a nice walk through the Arnold Arboretum or about 10 minutes by bus. The Needham line commuter rail is about a 7-8 minute walk from the house.  It runs on a set schedule Monday through Saturday.  Cab/Uber/Lyft rides from the city center approx $15-25.,There is a shared porch and patio available to all guests.,I'm available for questions anytime before or during your stay.  Do not hesitate to ask me anything.,"NO SMOKING AND PETS ANYWHERE ON THE PROPERTY 1. Be respectful of the other tenants 2. When walking up the back stairwell into the unit, please minimize the amount of talking, door closing, and foot noise (these stairs border bedrooms) 3. If you use the grill, be sure to turn off the gas 4. Notify the owner of any discrepancies or things not functioning properly immediately 5. Please treat carpet stains promptly (or notify the owner) 6. Kindly turn off lights, air conditioners, and other electrical items when they aren't needed",https://a2.muscache.com/im/pictures/35703662/880fbc01_original.jpg?aki_policy=small,https://a2.muscache.com/im/pictures/35703662/880fbc01_original.jpg?aki_policy=medium,https://a2.muscache.com/im/pictures/35703662/880fbc01_original.jpg?aki_policy=large,https://a2.muscache.com/im/pictures/35703662/880fbc01_original.jpg?aki_policy=x_large,4434391,https://www.airbnb.com/users/show/4434391,Damon,2012-12-18,"Boston, Massachusetts, United States","Hi, I am a thirty something, happy-go-lucky kind of guy with an entrepreneurial spirit  and adventurous soul.  I've spent a portion of my life traveling with the military, for jobs and school, and of course for fun!  I'm a little more settled these days considering my best buddy is my 6 year old daughter so I figured I'd have to get my ""traveler fix"" by giving others a comfortable place to stay in the great area of Boston!  Look forward to hosting you!",within an hour,100%,100%,TRUE,https://a2.muscache.com/im/users/4434391/profile_pic/1361980516/original.jpg?aki_policy=profile_small,https://a2.muscache.com/im/users/4434391/profile_pic/1361980516/original.jpg?aki_policy=profile_x_medium,Roslindale,2,2,"['email', 'phone', 'facebook', 'reviews', 'kba']",TRUE,TRUE,"Centre Street, Boston, MA 02131, United States",West Roxbury,West Roxbury,NA,Boston,MA,02131,Boston,"Boston, MA",US,United States,42.29052559198051,-71.14105591088912,TRUE,Apartment,Entire home/apt,2,1,1,1,Real Bed,"{TV,""Cable TV"",Internet,""Wireless Internet"",""Air Conditioning"",Kitchen,""Free Parking on Premises"",Heating,""Family/Kid Friendly"",""Smoke Detector"",""Carbon Monoxide Detector"",""First Aid Kit"",""Fire Extinguisher"",Essentials,Shampoo,""24-Hour Check-in"",Hangers,""Hair Dryer"",Iron,""Laptop Friendly Workspace""}",NA,$119.00,$740.00,"$2,550.00",$150.00,$25.00,2,$35.00,3,1125,today,NA,9,23,53,328,2016-09-06,33,2013-08-01,2016-08-19,99,10,10,10,10,9,10,FALSE,NA,NA,TRUE,strict,FALSE,FALSE,2,0.87
5270703,https://www.airbnb.com/rooms/5270703,20160906204935,2016-09-07,Mrs. Herrera,"We are going on vacation and we are renting our house while away, but need references. We prefer a couple. We are offering a $500.00 discount if you take care of our dog while  we are gone.",I am renting two bedrooms in my house. Additional 1 or to persons to consider.,"We are going on vacation and we are renting our house while away, but need references. We prefer a couple. We are offering a $500.00 discount if you take care of our dog while  we are gone. I am renting two bedrooms in my house. Additional 1 or to persons to consider. Full access to kitchen and other public areas. Towels and bed sheets. I am not going to be around. My neighbor is going to be in charge. It is very quiet and beautiful. There is a bus stop within 5 minutes walk that brings you to the T, or metro.  There is back yard with a trampoline and a playground.",none,It is very quiet and beautiful.,There is back yard with a trampoline and a playground.,"There is a bus stop within 5 minutes walk that brings you to the T, or metro.",Full access to kitchen and other public areas. Towels and bed sheets.,I am not going to be around. My neighbor is going to be in charge.,"Absolutely not smoking in the house. I am looking for easy going people, not for party people. This is a quiet neighborhood. People who can take care of our stuff.",https://a0.muscache.com/im/pictures/65859794/b6e8359e_original.jpg?aki_policy=small,https://a0.muscache.com/im/pictures/65859794/b6e8359e_original.jpg?aki_policy=medium,https://a0.muscache.com/im/pictures/65859794/b6e8359e_original.jpg?aki_policy=large,https://a0.muscache.com/im/pictures/65859794/b6e8359e_original.jpg?aki_policy=x_large,27281334,https://www.airbnb.com/users/show/27281334,Gabriela,2015-02-05,US,NA,N/A,N/A,N/A,FALSE,https://a0.muscache.com/im/users/27281334/profile_pic/1423177745/original.jpg?aki_policy=profile_small,https://a0.muscache.com/im/users/27281334/profile_pic/1423177745/original.jpg?aki_policy=profile_x_medium,West Roxbury,1,1,"['email', 'phone']",TRUE,FALSE,"Blueview Circle, Boston, MA 02132, United States",West Roxbury,West Roxbury,NA,Boston,MA,02132,Boston,"Boston, MA",US,United States,42.26344340728242,-71.14864175608963,TRUE,House,Private room,2,2,1,2,Real Bed,"{TV,""Wireless Internet"",Kitchen,""Free Parking on Premises"",""Pets live on this property"",Dog(s),""Buzzer/Wireless Intercom"",Washer,Dryer,""Smoke Detector"",""Carbon Monoxide Detector"",""Fire Extinguisher""}",NA,$160.00,"$1,000.00","$3,500.00",NA,NA,1,$0.00,1,1125,13 months ago,NA,0,0,0,0,2016-09-06,0,NA,NA,NA,NA,NA,NA,NA,NA,NA,FALSE,NA,NA,FALSE,flexible,FALSE,FALSE,1,NA
1161210,https://www.airbnb.com/rooms/1161210,20160906204935,2016-09-07,Cozy rooms with parking and Wi-Fi,"Our neighborhood is 10 miles away to Downtown Boston, going there by T could be a lengthy trip. You need 20 min. by bus to T station and 25 min. by subway T  to Downtown. Bus stop is at the street corner. Driving is better approach in the winter.","We are offering 1-2 bright and beautiful private bedrooms available in a 4-bed family home in West Roxbury. The bedrooms are clean and comfortable, and have just been renovated with new hardwood floors. A full bathroom is right next door. All toiletries (shampoo/conditioner/body washer, etc) are provided. A half bathroom on the first floor is also available. One bedroom has a double bed that sleeps 2, one bedroom has a queen size bed with a sofa bed next to it.  Restaurants nearby: With in 10 min. walk, we have Spring st. Cafe, Sofia Steak House;  Dunkin Donuts and Tony's place which serves the best Pizza in our town. Within 5 min. drive, there are several other restaurants, such as Japanese, Tai, American... Parking: on street parking (driveway parking by special arrangement only), but we have never had any problem with parking. Location The house is located on a quiet street in West Roxbury, next to a community center (Elk) and a church. It is walking distance to a supermarket, resta","Our neighborhood is 10 miles away to Downtown Boston, going there by T could be a lengthy trip. You need 20 min. by bus to T station and 25 min. by subway T  to Downtown. Bus stop is at the street corner. Driving is better approach in the winter. We are offering 1-2 bright and beautiful private bedrooms available in a 4-bed family home in West Roxbury. The bedrooms are clean and comfortable, and have just been renovated with new hardwood floors. A full bathroom is right next door. All toiletries (shampoo/conditioner/body washer, etc) are provided. A half bathroom on the first floor is also available. One bedroom has a double bed that sleeps 2, one bedroom has a queen size bed with a sofa bed next to it.  Restaurants nearby: With in 10 min. walk, we have Spring st. Cafe, Sofia Steak House;  Dunkin Donuts and Tony's place which serves the best Pizza in our town. Within 5 min. drive, there are several other restaurants, such as Japanese, Tai, American... Parking: on street parking (drivew",none,"Our neighborhood is the best one in the greater Boston area according to the police report. It is very safe, quiet and convenient. We love our neighborhood and try our best to keep the way it is. Hopefully, our guests can do the same.",The hosts are one couple with two long term staying middle school students from China. The guests probably won't see them in the house due to different schedules.,NA,"House Modern, spacious and open plan-- living room, dining room, huge eat-in kitchen, laundry room, sunroom and backyard are common areas. Wi-fi and central air-conditioning throughout.  Fully equipped kitchen (with dishwasher), washer and dryer in the basement. Guests are welcome to use kitchen only for eating purpose or simple cooking, such as making  sandwiches and soups. Kitchen use request needs to be part of communication before check in. Kitchen and living room area are closed around 10 pm except for those late comers.","We are very easy going people. We welcome our guests to join us for good conversation any time.  If the guests are very private, we'll definitely leave them alone.  Making our guests feel comfortable at home is our goal.",1.  No pets allowed. 2.  No smoking in the rooms. You may smoke in the yard but please don't leave the stubs in the grass etc.  3.No food in the bedroom.  4.Only water is allowed to drink in the bedroom. 5. Use slippers provided at the entrance or use your own slippers when you enter the house.  6. Please do not put your luggage on the top of the bed cover. 7. Living room and kitchen are closed at 10:00pm unless you need to get some water.,https://a1.muscache.com/im/pictures/18198275/08dce55d_original.jpg?aki_policy=small,https://a1.muscache.com/im/pictures/18198275/08dce55d_original.jpg?aki_policy=medium,https://a1.muscache.com/im/pictures/18198275/08dce55d_original.jpg?aki_policy=large,https://a1.muscache.com/im/pictures/18198275/08dce55d_original.jpg?aki_policy=x_large,3887707,https://www.airbnb.com/users/show/3887707,Em,2012-10-16,"Boston, Massachusetts, United States","I'm currently in grad school after living abroad, and this is my family home in Boston, MA. The host is my mom, a Chinese teacher, who has lived in the Boston area for 25+ years (we are originally from Beijing, China). She likes to garden, cook and ballroom dance. We've always had visitors and boarders and are excited to welcome you to our home.",within a day,90%,100%,FALSE,https://a1.muscache.com/im/users/3887707/profile_pic/1369775946/original.jpg?aki_policy=profile_small,https://a1.muscache.com/im/users/3887707/profile_pic/1369775946/original.jpg?aki_policy=profile_x_medium,West Roxbury,3,3,"['email', 'phone', 'facebook', 'reviews']",TRUE,FALSE,"Morrell Street, Boston, MA 02132, United States",West Roxbury,West Roxbury,NA,Boston,MA,02132,Boston,"Boston, MA",US,United States,42.27176131182028,-71.1675924126962,TRUE,House,Private room,4,1.5,1,4,Real Bed,"{""Cable TV"",Internet,""Wireless Internet"",""Air Conditioning"",Kitchen,""Free Parking on Premises"",Breakfast,""Indoor Fireplace"",Heating,""Family/Kid Friendly"",""Suitable for Events"",Washer,Dryer,""Smoke Detector"",""Carbon Monoxide Detector"",""First Aid Kit"",Essentials,Shampoo,""24-Hour Check-in"",Hangers,""Hair Dryer"",Iron,""Laptop Friendly Workspace"",""translation missing: en.hosting_amenity_50""}",NA,$60.00,NA,NA,NA,$20.00,1,$20.00,1,1125,today,NA,17,35,65,340,2016-09-06,163,2013-06-03,2016-08-22,93,9,10,9,10,9,9,FALSE,NA,NA,TRUE,moderate,FALSE,FALSE,1,4.1
